entity_id,entity_name,entity_type,sector,status,successor,years_active,study_id,notes
ENT-DYF-001,DynaFlo Systems,Technology Vendor,Internet Email / ISP Solutions,Defunct,Unknown,~1995-late 1990s,1997-dynaflo-systems----e-mail-for-the-b-854582,"Small ISP email solution vendor; PushMail product profiled by Aberdeen in 1997; no record of survival through ISP consolidation era"
ENT-DYF-002,Aberdeen Group,Research Firm,IT Research & Advisory,Acquired,Harte-Hanks (2001) then rebranded Aberdeen,1988-2013,1997-dynaflo-systems----e-mail-for-the-b-854582,Publisher of this vendor profile
ENT-DYF-003,Internet Service Providers (ISP market),Industry Segment,Internet Services,Consolidated,Various (AOL EarthLink AT&T etc.),1993-2000s,1997-dynaflo-systems----e-mail-for-the-b-854582,"ISP market grew from 1400 providers in early 1996 to ~3000 by 1997; consolidated dramatically by 2000"
ENT-DYF-004,EarthLink,ISP,Internet Services,Acquired,EarthLink Holdings then Windstream,1994-2016,1997-dynaflo-systems----e-mail-for-the-b-854582,Example of ISP that survived consolidation by acquiring smaller providers; grew to 320000 customers by 1997
ENT-DYF-005,America Online (AOL),ISP / Portal,Internet Services,Acquired,Verizon Media (2015) then Yahoo (2021),1985-2015,1997-dynaflo-systems----e-mail-for-the-b-854582,"Dominant consumer ISP with 20 million subscribers by 2000; the type of large player Aberdeen warned would enter ISP market"
