"tech_id","tech_name","category","vendor","era","lifecycle_at_study","lifecycle_current","study_id","notes"
"peoplesoft-crm","PeopleSoft CRM","application","PeopleSoft -> Oracle","2001-2010","emerging","legacy-supported","2003-peoplesoft-gains-crm-market-momentum-b4b610","PeopleSoft's CRM offering; continued under Oracle; eventually superseded by Siebel CRM and Oracle CX Cloud"
"jde-enterprise-one","JD Edwards EnterpriseOne","application","J.D. Edwards -> PeopleSoft -> Oracle","1977-present","mature","active","2003-peoplesoft-gains-crm-market-momentum-b4b610","Mid-market ERP; brought manufacturing/distribution to PeopleSoft portfolio; still actively sold by Oracle 2026"
"siebel-crm","Siebel CRM","application","Siebel Systems -> Oracle","1993-present","mature","legacy-supported","2003-peoplesoft-gains-crm-market-momentum-b4b610","Market-leading CRM at time of study; acquired by Oracle 2005; Oracle Siebel CRM still supported as legacy product"
"sap-crm","SAP CRM","application","SAP","1999-present","emerging","active","2003-peoplesoft-gains-crm-market-momentum-b4b610","SAP's CRM suite; evolved into SAP C/4HANA and SAP Customer Experience; still active"
"erp-platform","Enterprise Resource Planning (ERP)","framework","multiple","1990s-present","mature","active","2003-peoplesoft-gains-crm-market-momentum-b4b610","Category context for PeopleSoft+JDE combined positioning"
