"tech_id","tech_name","category","vendor","era","lifecycle_at_study","lifecycle_current","study_id","notes"
"san","Storage Area Network (SAN)","protocol","multiple","1996-present","emerging","active","2003-storage-trends-what-will-be-hot-in-2003-and-beyond-cd0aeb","Fibre Channel SAN dominant in enterprise; HP led open SAN with 31.2% share Q3 2003; grew 15.7% YoY; still widely deployed"
"nas","Network Attached Storage (NAS)","platform","multiple","1992-present","mature","active","2003-storage-trends-what-will-be-hot-in-2003-and-beyond-cd0aeb","File-based storage networking; EMC led NAS market 2003; NAS persisted and evolved to unified/object storage"
"iscsi","iSCSI (Internet Small Computer Systems Interface)","protocol","multiple","2001-present","emerging","active","2003-storage-trends-what-will-be-hot-in-2003-and-beyond-cd0aeb","IP-based block storage; standardized 2003; gained traction as cost-effective SAN alternative; widely deployed in mid-market"
"tape-automation","Tape Automation","platform","multiple","1980s-present","mature","active","2003-storage-trends-what-will-be-hot-in-2003-and-beyond-cd0aeb","Backup and archive tape libraries; StorageTek was leader; tape automation remained viable through 2020s for archive"
"disk-array","Disk Array / RAID","platform","multiple","1988-present","mature","active","2003-storage-trends-what-will-be-hot-in-2003-and-beyond-cd0aeb","External controller-based disk storage; $12.89B market 2003 per Gartner; grew 6% in 2003; shifted to SSD and NVMe by 2020s"
"storage-virtualization","Storage Virtualization","framework","multiple","2001-present","emerging","active","2003-storage-trends-what-will-be-hot-in-2003-and-beyond-cd0aeb","Resource pooling and abstraction layer; Hill predicted this would transform data centers; became foundational (VMware VSAN etc)"
"storage-automation","Storage Automation","framework","multiple","2002-present","emerging","active","2003-storage-trends-what-will-be-hot-in-2003-and-beyond-cd0aeb","Policy-driven provisioning and management; Hill's central long-term prediction; materialized as software-defined storage"
"it-utility","IT Utility / Storage Utility","framework","multiple","2002-present","emerging","active","2003-storage-trends-what-will-be-hot-in-2003-and-beyond-cd0aeb","Concept of storage as on-demand utility service; Hill's prescient framing anticipated cloud storage (AWS S3 launched 2006)"
"global-file-system","Global File System / Namespace","framework","multiple","2001-present","emerging","active","2003-storage-trends-what-will-be-hot-in-2003-and-beyond-cd0aeb","Single-image namespace across distributed storage; materialized as object storage (S3) and distributed file systems (HDFS)"
