"tech_id","tech_name","category","vendor","era","lifecycle_at_study","lifecycle_current","study_id","notes"
"intel-celeron-m","Intel Celeron M mobile processor","chip","Intel Corporation","2004-2009","new","legacy-supplanted","technology-news-hardware-intel-unveils-l-1f420a","Intel value mobile CPU brand (Pentium M-derived); launched Jan 2004 at 1.3 GHz; successor to mobile Celeron; replaced by Celeron on Core architecture 2008-2009"
"intel-pentium-m","Intel Pentium M mobile processor","chip","Intel Corporation","2003-2008","new","legacy-supplanted","technology-news-hardware-intel-unveils-l-1f420a","Banias/Dothan/Yonah low-power x86 CPU family; basis of Centrino platform; directly ancestral to Intel Core microarchitecture (2006)"
"intel-centrino","Intel Centrino mobile platform","platform","Intel Corporation","2003-2010","new","legacy-supplanted","technology-news-hardware-intel-unveils-l-1f420a","Intel marketing brand for Pentium M + integrated chipset + Wi-Fi bundle; launched Mar 2003; retired as Centrino brand 2010"
"amd-athlon-64","AMD Athlon 64 processor","chip","AMD","2003-2009","new","legacy-supplanted","technology-news-hardware-intel-unveils-l-1f420a","AMD first desktop 64-bit CPU (Sep 2003, K8 microarchitecture); brought AMD64 ISA to consumer desktops ahead of Intel EM64T"
"amd64-architecture","AMD64 / x86-64 architecture (Opteron/Athlon 64)","chip","AMD","2003-present","new","mature","technology-news-hardware-intel-unveils-l-1f420a","AMD 64-bit extension of x86 (Opteron Apr 2003, Athlon 64 Sep 2003); Intel adopted as Intel 64 (EM64T) 2004; became dominant 64-bit desktop/server ISA"
"laptop-notebook-pc","Laptop / notebook PC","platform","industry","1985-present","mature","active","technology-news-hardware-intel-unveils-l-1f420a","Portable clamshell PCs; thin-and-light category emerged 2003-2005; overtook desktops in unit sales ~2008"
