"entity_id","entity_name","entity_type","sector","status","successor","years_active","study_id","notes"
"ENT-S2-001","Digital Equipment Corporation (DEC)","Vendor","Computing Hardware","Acquired","Compaq (1998); HP (2002)","1957–1998","1997-digital-&-oracle-s-nci--partners-in-2d680c","Acquired by Compaq for $9.6B in June 1998 (then-largest tech acquisition). Compaq acquired by HP in 2002. Alpha processor IP sold to Intel in 2001."
"ENT-S2-002","Network Computer Inc. (NCI)","Vendor","Network Computing Software","Defunct","Oracle (parent; NCI shut down 1999)","1996–1999","1997-digital-&-oracle-s-nci--partners-in-2d680c","Oracle subsidiary that developed NC software suite. Oracle spent ~$175M on NCI before shutting it down in 1999 and renaming the assets for interactive TV. Foundational to later cloud computing concepts."
"ENT-S2-003","Oracle Corporation","Vendor","Enterprise Software","Active (public)","N/A (continues)","1977–present","1997-digital-&-oracle-s-nci--partners-in-2d680c","Parent of NCI. Oracle remains major enterprise software company; NCI strategy failed but Oracle pivoted successfully to database, cloud (Oracle Cloud)."
"ENT-S2-004","Advanced RISC Machines (ARM Holdings)","Semiconductor IP","Semiconductors","Active (public, SoftBank/Nasdaq)","N/A (continues as ARM Ltd.)","1990–present","1997-digital-&-oracle-s-nci--partners-in-2d680c","Licensor of ARM architecture used in DEC's StrongARM. ARM Holdings IPO'd in 2023; ARM architecture now dominates mobile and embedded computing."
"ENT-S2-005","Intel Corporation","Semiconductor","Computing Hardware","Active (public)","N/A","1968–present","1997-digital-&-oracle-s-nci--partners-in-2d680c","Acquired DEC's semiconductor division (including StrongARM) in 1997 as patent lawsuit settlement. NetPC was Intel/Microsoft response to NC threat. Intel later marketed XScale (StrongARM successor)."
"ENT-S2-006","Microsoft Corporation","Vendor","Software","Active (public)","N/A","1975–present","1997-digital-&-oracle-s-nci--partners-in-2d680c","Co-developer of NetPC with Intel. Microsoft won the 1997-era desktop battle against NC. Later developed Azure cloud, effectively realizing the NC vision."
"ENT-S2-007","IBM Corporation","Vendor","Computing Hardware/Services","Active (public)","N/A","1911–present","1997-digital-&-oracle-s-nci--partners-in-2d680c","Early NC market participant; launched IBM Network Station. IBM's NC efforts were modest commercially."
"ENT-S2-008","Sun Microsystems","Vendor","Computing Hardware/Software","Acquired","Oracle (2010)","1982–2010","1997-digital-&-oracle-s-nci--partners-in-2d680c","NC market participant with JavaStation. Acquired by Oracle in 2010. Java, Sun's language, was central to NC concept."
