tech_id,tech_name,category,vendor,era,lifecycle_at_study,lifecycle_current,study_id,notes
TECH-SPARC,SPARC Architecture,processor-architecture,Sun/SPARC International,1987-2017,mainstream,declining,aberdeen-1995-sun-microsystems-computer-company,SPARC64 still produced by Fujitsu through ~2020; Oracle phased out SPARC chip development in 2017.
TECH-SOLARIS,Solaris (Unix V.4),operating-system,Sun Microsystems,1992-present,mainstream,declining,aberdeen-1995-sun-microsystems-computer-company,Oracle Solaris still maintained but declining; last major release Solaris 11.4 in 2018.
TECH-SMP,Symmetric Multiprocessing (SMP),computing-architecture,multiple,1990-present,emerging,mainstream,aberdeen-1995-sun-microsystems-computer-company,SMP became standard in server computing; foundational to modern multi-core architectures.
TECH-HA-CLUSTER,High Availability (HA) Clustering,systems-architecture,multiple,1994-present,emerging,mainstream,aberdeen-1995-sun-microsystems-computer-company,SPARCcluster HA. HA clustering became standard enterprise practice; evolved to include cloud HA.
TECH-TPC,TPC Benchmarks,benchmark,TPC (Transaction Processing Council),1988-present,mainstream,active,aberdeen-1995-sun-microsystems-computer-company,TPC-C benchmarks referenced for commercial DB performance comparison.
TECH-UNIX,Unix Operating System,operating-system,AT&T/multiple,1969-present,mainstream,legacy-niche,aberdeen-1995-sun-microsystems-computer-company,Commercial Unix largely displaced by Linux for new workloads; legacy deployments still active.
TECH-RDBMS-COMM,Commercial RDBMS Workloads on Unix,workload-pattern,multiple,1990-2005,mainstream,migrated-to-linux,aberdeen-1995-sun-microsystems-computer-company,Oracle/DB2/Sybase on Unix servers was primary commercial use case; largely migrated to Linux x86 by 2010.
