"tech_id","tech_name","category","vendor","era","lifecycle_at_study","lifecycle_current","study_id","notes"
"data-mining","Dell Asset Recovery Services (ARS)","service-platform","Dell","2000s","emerging","evolved","2003-dell-ars-white-paper-53d13d","Flat-rate IT asset disposal service: $49/unit recycling or $69/unit value recovery; evolved into Dell Technologies Asset Recovery Services"
"windows-nt","Dell Exchange","service-platform","Dell","1990s","mature","superseded","2003-dell-ars-white-paper-53d13d","Dell's first official reuse/recycling program launched in early 1990s; predecessor to ARS"
"corba-common-object-request-broker-architecture","DoD 5220.22M Data Sanitization","standard","U.S. Department of Defense","1990s","mature","superseded","2003-dell-ars-white-paper-53d13d","Military-grade data wiping standard referenced for high-security disk sanitization; largely superseded by NIST SP 800-88"
"metadata-management","Hard Drive Data Overwriting","process","multiple","1990s","mature","evolved","2003-dell-ars-white-paper-53d13d","Multi-pass sector overwriting for data destruction; still used but supplemented by degaussing and physical destruction for SSDs"
"massively-parallel-processing","Pentium III","processor","Intel","late-1990s","declining","obsolete","2003-dell-ars-white-paper-53d13d","Referenced as typical 36-month-old PC processor; launched 1999"
"sun-ultrasparc","CRT Monitor","display","multiple","1990s","mature","obsolete","2003-dell-ars-white-paper-53d13d","Referenced as bulky hazardous e-waste requiring special handling; fully replaced by LCD/LED displays"
"db2","Western Digital Caviar HDD","storage","Western Digital","late-1990s","mature","obsolete","2003-dell-ars-white-paper-53d13d","8-GB and 20-GB models cited for data wiping time benchmarks; product line continued but capacities now in TB range"
"predictive-analytics","IT Asset Lifecycle Management","methodology","multiple","1990s","emerging","mainstream","2003-dell-ars-white-paper-53d13d","End-of-life process framework including valuation, cleansing, packing, recycling, sales, and verification"
"business-intelligence","E-Waste De-Manufacturing","process","multiple","1990s","emerging","mainstream","2003-dell-ars-white-paper-53d13d","Component-level disassembly for material recovery from electronic devices; now a major global industry"
