"entity_id","entity_name","entity_type","sector","status","successor","years_active","study_id","notes"
"electronic-news","Electronic News (Electronics News Australia)","company","trade-media","merged-into-edn","Folded into EDN/EE Times umbrella","1957-2005","electronic-news-videoconferencing-sars-c-044642","Reed Business Information trade pub; Electronics News Australia sister edition"
"ry-crozier-electronics-news","Ry Crozier","person","tech-journalism","active","","2000s-present","electronic-news-videoconferencing-sars-c-044642","Electronics News Australia reporter; later iTnews Australia editor"
"peter-s-kastner","Peter S. Kastner","person","IT-analyst","active","","1980s-present","electronic-news-videoconferencing-sars-c-044642","Cited co-author with Russ Craig"
"russ-craig-aberdeen","Russ Craig","person","IT-analyst","active","","1980s-present","electronic-news-videoconferencing-sars-c-044642","Aberdeen Group analyst, electronics supply-chain coverage"
"aberdeen-group","Aberdeen Group","firm","IT-research","acquired","Spiceworks Ziff Davis (2018)","1988-2018","electronic-news-videoconferencing-sars-c-044642",""
"china-electronics-mfg","China electronics assembly industry (cluster)","agency","manufacturing-cluster","active","","1990s-present","electronic-news-videoconferencing-sars-c-044642","Pearl River Delta and Yangtze River Delta concentration cited as systemic risk"
"who","World Health Organization","agency","global-health","active","","1948-present","electronic-news-videoconferencing-sars-c-044642","Implicit subject of 'aggressive public health actions'"
