tech_id,tech_name,category,vendor,era,lifecycle_at_study,lifecycle_current,study_id,notes
esperant,ESPERANT,application,Software AG,1990-2005,mature,obsolete,aberdeen-1996-software-ag-digital-high-performance-solutions,Data warehousing and decision support solution from Software AG
essbase,Arbor Essbase,application,Arbor Software -> Hyperion -> Oracle,1992-present,mature,active,aberdeen-1996-khalix-financial-awareness-competitive-advantage,Proprietary MOLAP engine competitor; Oracle Essbase still active in 2026
ethernet-switching,Ethernet Switching,protocol,multi-vendor,1993-present,emerging,active,aberdeen-1995-3com-lanplex-2500,"Layer-2 frame switching for 10 Mbps Ethernet segments; evolved through Fast, Gigabit, 10GbE, etc."
etl,Extract Transform Load (ETL),framework,multiple,1990-present,emerging,active,aberdeen-1996-enterprise-data-knowledge-integrated-data-marts,Data integration methodology central to Aberdeen's synchronization framework
fast-ethernet-100basetx,Fast Ethernet (100Base-TX),protocol,multiple,1995-2010,emerging,legacy-supported,1997-bay-networks--switch-node-routing-s-4d9885; aberdeen-1995-3com-lanplex-2500,2-port 100Base-TX switching module available in Switch Node hardware; Fast Ethernet becoming dominant campus backbone.
fddi,FDDI (Fiber Distributed Data Interface),protocol,ANSI standard,1987-2000,mature,obsolete,aberdeen-1995-3com-lanplex-2500; aberdeen-1996-hp-networking-vision-workgroups,100 Mbps token-ring LAN standard; prominent as campus backbone technology at time of study.
firewall-technology,Firewall Technology,application,multiple,1991-present,emerging,active,aberdeen-1996-iss-internet-security-systems,Circuit-filter and proxy-server firewalls; ISS Firewall Scanner tests actual firewall effectiveness
flexifinancials,FlexiFinancials,application,FlexiInternational Software,1993-present,emerging,active,aberdeen-1996-flexiinternational-software-financial-acumen-technology,Object-oriented financial CSS; survived as niche insurance/financial platform
flowmark,,workflow-management,,,,,aberdeen-1995-ibm-db2-common-server,
forte-cade,Forte (Second-Generation CADE),application,Forte Software,1991-1999,emerging,obsolete,aberdeen-1995-commercial-messaging,"Leading second-generation CADE with Commercial Messaging, repository/directory, and application partitioning; acquired by Sun 1999, Oracle 2010"
frad,Frame Relay Access Device (FRAD),platform,Netlink,1991-2005,emerging,obsolete,aberdeen-1996-frame-relay-access-devices,"Netlink products: TurboFRAD, OmniFRAD, NetFRAD; superseded by routers and MPLS"
frame-relay,Frame Relay,protocol,Various carriers,1991-2010,emerging,obsolete,aberdeen-1996-frame-relay-access-devices; aberdeen-1996-remote-access-cisco-untold-story; aberdeen-1996-vpns-business-mfs-success-strategy,Packet-switched WAN protocol; began displacing leased lines 1991; peaked ~2000; displaced by MPLS
fsiop,AS/400 FSIOP (File Server Input/Output Processor),platform,IBM,1995-2002,emerging,obsolete,aberdeen-1996-ibm-as400-vs-microsoft-nt-server,Intel processor board on AS/400 for NOS; could run LAN Manager; NT Server support anticipated
fusion-numa-technology,Fusion/NUMA Technology,platform,Sequent/Digital/Pyramid,1994-2002,emerging,obsolete,aberdeen-1996-computer-telephony-integration,SMP+clustering+MPP hybrid for scaling beyond SMP limits; superseded by commodity clusters
fx32,FX!32 Binary Translation,application,Digital Equipment Corporation,1996-1998,emerging,obsolete,aberdeen-1996-digital-leading-nt-across-enterprise-charge,Binary translation/emulation enabling 32-bit Windows/NT x86 apps to run on Alpha with performance improvements
gigaplane-bus,Sun Gigaplane System Bus,platform,Sun Microsystems,1996-2002,emerging,obsolete,aberdeen-1996-sun-microsystems-decision-warehouse,2.6 GBps; thin boards with dual CPUs and memory (up to 2GB/board); high-speed I/O channels; mainframe-class speeds
groupware,Groupware / E-mail Systems,application,"Lotus, Microsoft",1990-present,emerging,active,aberdeen-1996-year-2000-transition-opportunity-reconstruction,Identified as least likely to have Y2K problems due to relative newness
gsmp,GSMP (Generic Switch Management Protocol),protocol,Ipsilon Networks,1996-2001,emerging,obsolete,1997-cabletron-and-ipsilon--linking-secu-adba48,Protocol for managing ATM switches from IP routing layer; developed by Ipsilon; submitted to IETF; GSMP v3 eventually published as RFC 3292; technology path was superseded by MPLS.
gsr-12000,Cisco 12000 Series Gigabit Switch Router (GSR),hardware,Cisco Systems,1997-present,emerging,legacy-supported,1997-cisco-s-core-products-business-inte-bd8697,"Cisco's next-generation router designed for ISPs and internet backbone; first deployed 1997; multigigabit crossbar fabric sustaining 80 Gbps; interfaces OC-3/OC-12/OC-48, Gigabit Ethernet, Packet over SONET, ATM; Aberdeen described as 'appropriate and necessary'; sold 1,000 units by November 1998; became a major commercial success; still referenced in carrier networks."
gupta-centura,Gupta Centura (Team Developer),framework,Gupta Technologies,1996-2006,emerging,obsolete,aberdeen-1996-moving-effectively-next-gen-client-server,"Next-gen extension of SQLWindows; includes Team Developer, Centura Ranger, Centura Application Server, Centura Web Data Publisher."
hacmp,,high-availability,,,,,aberdeen-1995-ibm-db2-common-server; aberdeen-1996-bulls-sagister-datacenterdisciplined-unix-businesscritical-applications; aberdeen-1996-ibm-aix-4-not-your-fathers-325,
help-desk-software,Internal IT Help Desk Software,application,multiple,1990-present,mature,active,1997-automating-and-managing-internal-op-e69e64,Category that spawned ITSM; Aberdeen saw help desk as launchpad for broader COM adoption.
himalaya-nonstop,Tandem NonStop Himalaya,platform,Tandem,1989-present,mature,active,aberdeen-1996-tandem-vision-21st-century-electronic-business,Fault-tolerant OLTP server; continues as HPE Integrity NonStop
hl7-standard,HL7 (Health Level 7),protocol,HL7 International,1987-present,mature,active,aberdeen-1997-hp-andover-working-group,"Standard for formatting, transmitting, receiving textual healthcare data; ECF built on HL7 2.2; HL7 FHIR now dominant version"
hp-3000,HP 3000 (MPE/iX),platform,Hewlett-Packard,1972-2010,mature,obsolete,aberdeen-1996-hp-3000-increasing-customers-successes,Proprietary minicomputer platform; support ended Dec 31 2010 by HP
hp-9000,HP 9000 (HP-UX),platform,Hewlett-Packard,1984-2003,mature,obsolete,aberdeen-1996-hp-3000-increasing-customers-successes; aberdeen-1996-hp-9000-enterprise-server-64bit-pa8000; aberdeen-1996-risc-unix-market,Unix-based midrange server; hardware twin of HP 3000; discontinued 2003
hp-enterprise-switch,HP Enterprise Switch (Fibre Channel),platform,Hewlett-Packard,1995-2003,emerging,obsolete,aberdeen-1996-hp-enterprise-parallel-server-scalable-performance,16 ports at 266 Mbit/s; hub architecture; target 32 ports at 1 Gbit/s by 3Q97
hp-eps,HP Enterprise Parallel Server (EPS),platform,Hewlett-Packard,1995-2002,emerging,obsolete,aberdeen-1996-hp-enterprise-parallel-server-scalable-performance,EPS21 (K-Class SMP nodes) and EPS30 (T-Class SMP nodes) introduced May 15 1996; PA-RISC based; eventually superseded by Itanium and then x86
hp-intel-architecture,HP/Intel Joint Processor Architecture (IA-64 / Itanium),platform,Hewlett-Packard / Intel,1994-2021,emerging,obsolete,aberdeen-1996-risc-unix-market,Joint HP and Intel microprocessor architecture effort; delivery expected 1998 per study; eventually became Itanium; discontinued 2021
hp-intel-merced,HP-Intel P7/Merced (Itanium),platform,HP/Intel,1994-2021,emerging,obsolete,aberdeen-1996-hp-3000-increasing-customers-successes; aberdeen-1996-hp-9000-enterprise-server-64bit-pa8000,Joint HP-Intel 64-bit architecture project; shipped as Itanium 2001; Intel ended 2021
hp-openmail,HP OpenMail,application,Hewlett-Packard,early 1990s-2000s,emerging,obsolete,aberdeen-1995-commercial-messaging,Messaging APIs for multi-standard e-mail integration; focused on e-mail market; transaction support planned within 2 years of study
hp-openview,HP OpenView,application,Hewlett-Packard,1988-2010,mature,legacy-supported,1997-ca-s-unicenter-tng-framework-pk-apr-50d15f; aberdeen-1996-dec-manageworks-22; aberdeen-1996-hp-3000-increasing-customers-successes; aberdeen-1996-hp-networking-vision-workgroups; aberdeen-1996-hp-praesidium-family; aberdeen-1996-hp-vectra-xw-personal-workstation; aberdeen-1996-ibm-tivoli; aberdeen-1996-mitels-nevadanetworked-voice-data-speeding-toward; aberdeen-1997-hp-andover-working-group,HP OpenView was dominant network management platform; Aberdeen says HP 'has clearly lost momentum' in 1997; HP's own systems division endorsed Unicenter Framework as preferred management platform.
hp-pa8000,HP PA-8000 RISC Processor,platform,Hewlett-Packard,1996-2002,emerging,obsolete,aberdeen-1996-hp-enterprise-parallel-server-scalable-performance,64-bit PA-RISC; next-gen processor expected 3Q96; Aberdeen predicted significant performance boost
hp-praesidium,HP Praesidium Security Framework,framework,Hewlett-Packard,1996-2003,emerging,obsolete,aberdeen-1996-hp-praesidium-family,Integrated security framework for Intranet/Internet transactions; VirtualVault + Authorization Server + ICF + ImagineCard
hp-ux,HP-UX 10.2 / 11.0,platform,Hewlett-Packard,1984-2023,mature,legacy-supported,aberdeen-1996-hp-9000-enterprise-server-64bit-pa8000; aberdeen-1996-hp-enterprise-parallel-server-scalable-performance; aberdeen-1997-hp-andover-working-group,Unix OS for HP 9000; HP-UX 10.2 supports PA-8000; 11.0 adds VLM support
hp-ux-10,HP-UX 10,platform,Hewlett-Packard,1995-2003,emerging,obsolete,aberdeen-1996-risc-unix-market,Included production features beyond original Unix design; well-managed 1995 transition from HP-UX 9
hp-ux-9,HP-UX 9,platform,Hewlett-Packard,1992-1995,declining,obsolete,aberdeen-1996-risc-unix-market,Previous HP-UX release; transition to HP-UX 10 in 1995 was well supported with upgrade utilities
hp-vectra-xw,HP Vectra XW Personal Workstation,platform,Hewlett-Packard,1996-2002,emerging,obsolete,aberdeen-1996-hp-vectra-xw-personal-workstation,Discontinued 2002 after HP-Compaq merger; replaced by Evo/Compaq lines
hp-visualize,HP VISUALIZE Unix Workstations,platform,Hewlett-Packard,1993-2002,mature,obsolete,aberdeen-1996-hp-vectra-xw-personal-workstation,HP's premium Unix/RISC workstation line; positioned above Vectra XW for high-end compute
hpfs,High Performance File System (HPFS),protocol,IBM/Microsoft,1988-2000,mature,obsolete,aberdeen-1996-ibm-os2-warp-server,OS/2 native file system; provided uniprocessor performance advantage
hpsn,HPSN (High-Performance Scalable Networking),framework,3Com,1994-1998,emerging,obsolete,aberdeen-1995-3com-lanplex-2500,"3Com's 3-stage networking vision: Stage 1=collapsed backbone, Stage 2=distributed LAN switches, Stage 3=ATM migration."
html,HTML,protocol,W3C,1991-present,emerging,active,aberdeen-1996-blyths-ren-architecture-prescription-it-success; aberdeen-1996-iq-software-www-reporting; aberdeen-1996-web-warehouses-dss-for-masses,Web markup language; Blyth's tools generated HTML dynamically
http,HTTP (HyperText Transfer Protocol),protocol,W3C/IETF,1991-present,emerging,active,aberdeen-1996-open-market-web-based-commerce,Open Market built its entire architecture on open HTTP; key differentiator vs proprietary solutions
ibm-5250-terminal,IBM 5250 Terminal,platform,IBM,1977-2000,mature,obsolete,aberdeen-1996-ibm-as400-vs-microsoft-nt-server,"$1,940 dual session terminal; key cost advantage vs $4,900 NT Workstation PC"
ibm-advanced-36,IBM Advanced/36,platform,IBM,1994-2000,emerging,obsolete,aberdeen-1996-evaluating-system36-migration-strategies,"Introduced October 1994; priced $9,800-$21,000; ran System/36 SSP applications; withdrew from marketing by 2000; Advanced/36 Machine support removed in OS/400 V4R5"
ibm-as400,IBM AS/400 Advanced System,platform,IBM,1988-2000,mature,active,aberdeen-1996-evaluating-system36-migration-strategies; aberdeen-1996-ibm-transformation-business-machines-information-service; aberdeen-1997-as400-nt-server-ibm-microsoft-working-together; aberdeen-1997-lawson-insight-process-orientation-business-management,"Entry level ~$8,000; OS/400 V3R6/V3R7 Year 2000 compliant; evolved to iSeries (2000), System i (2006), IBM Power Systems running IBM i (2008-present)"
ibm-db2,IBM DB2,platform,IBM,1983-present,mature,active,aberdeen-1996-distributed-open-rdbms-buying-guide; aberdeen-1996-ibm-transformation-business-machines-information-service,Enterprise RDBMS; IBM's flagship database product
ibm-karat,IBM Karat Project,platform,IBM,1990-1996,emerging,obsolete,aberdeen-1996-ibm-tivoli,IBM's internal management platform project; cancelled in favor of Tivoli acquisition
ibm-mqseries,IBM MQSeries,platform,IBM,1993-2002,emerging,active,aberdeen-1995-commercial-messaging,"Renamed IBM MQ in 2014; Aberdeen identifies as leading Commercial Messaging product; supports multithreading, assured once-and-only-once delivery, CICS/Tuxedo/Encina integration"
ibm-netview,IBM NetView,application,IBM,1986-present,mature,active,aberdeen-1996-ibm-tivoli,IBM network management; became Tivoli NetView; IBM NetView for z/OS still active
ibm-network-station,IBM Network Station,platform,IBM,1996-2001,emerging,obsolete,aberdeen-1997-as400-nt-server-ibm-microsoft-working-together,IBM's Network Computer concept; cited alongside AS/400+NT as IBM's network computing vision
ibm-notes-domino,Lotus Notes / Domino,application,Lotus/IBM,1989-2024,mature,legacy-supported,aberdeen-1996-ibm-transformation-business-machines-information-service,Internet-enabled Domino Notes released; IBM leveraged acquisition for network computing strategy
ibm-rs6000,IBM RS/6000 / PowerPC,platform,IBM,1990-2003,mature,obsolete,aberdeen-1996-ibm-transformation-business-machines-information-service,Unix server line; formerly competing internally with mainframe and AS/400 divisions
ibm-rs6000-sp,IBM RS/6000 SP,platform,IBM,1993-2000,mature,obsolete,aberdeen-1996-bulls-sagister-datacenterdisciplined-unix-businesscritical-applications; aberdeen-1996-hp-enterprise-parallel-server-scalable-performance,Massively parallel competitor to Sagister; Aberdeen notes lacks mainframe-class operational tools
ibm-s390,IBM S/390 (Mainframe),platform,IBM,1990-2000,mature,legacy-supported,aberdeen-1996-ibm-transformation-business-machines-information-service; aberdeen-1996-mainframe-revival-short-lived-or-long-term,Evolving to IBM Z-series; mainframe migrations driving Y2K and services demand
ibm-ssp,IBM System Support Program (SSP),platform,IBM,1983-2000,declining,obsolete,aberdeen-1996-evaluating-system36-migration-strategies,Operating system for System/36 and Advanced 36; SSP applications ran in System/36 Environment on AS/400; Year 2000 compliant SSP apps were rare
ibm-system36,IBM System/36,platform,IBM,1983-2000,declining,obsolete,aberdeen-1996-evaluating-system36-migration-strategies,"Installed base declined from ~87,000 sites (1992) to ~42,000 sites (1996); declining at 20%+ per year; hardware parts increasingly unavailable"
ibm-systemview,IBM SystemView,application,IBM,1990-2002,mature,obsolete,aberdeen-1996-ibm-tivoli,IBM's legacy management platform; positioned to become well-behaved Tivoli application
ibm-tdl,IBM Transition Data Link (TDL),application,IBM,1994-2000,mature,obsolete,aberdeen-1996-evaluating-system36-migration-strategies,Moves System/36 data to Advanced 36 at 45MB per hour; migration service ~$50/hour; average migration time one day
ieee-mib,IEEE Medical Information Bus (MIB),protocol,IEEE,1992-2000,mature,legacy-supported,aberdeen-1997-hp-andover-working-group,IEEE P1157; standards for medical device interconnectivity; AWG third standards initiative
ifmp,IFMP (Ipsilon Flow Management Protocol),protocol,Ipsilon Networks,1996-1999,emerging,obsolete,1997-cabletron-and-ipsilon--linking-secu-adba48,Ipsilon's proprietary flow management protocol; core of IP Switching implementation; submitted to IETF but not adopted as standard; lost to Cisco's Tag Switching (MPLS precursor).
image-sql,IMAGE/SQL (TurboIMAGE),application,Hewlett-Packard,1973-2010,mature,obsolete,aberdeen-1996-hp-3000-increasing-customers-successes,HP 3000 network database with SQL interface
imaginecard,ImagineCard Smart Card,platform,HP/Gemplus/Informix,1996-1999,emerging,obsolete,aberdeen-1996-hp-praesidium-family,Multi-credential smart card for authentication; planned but never achieved widespread adoption
informix-dynamic-server,Informix Dynamic Server,platform,Informix,1980-2001,mature,legacy-supported,aberdeen-1996-distributed-open-rdbms-buying-guide,Acquired by IBM 2001; continued as IBM Informix
informix-illustra,Informix Illustra DataBlade,application,Informix,1995-2001,emerging,obsolete,aberdeen-1996-tandem-vision-21st-century-electronic-business,Object-relational extensions; used by Tandem to add video/complex data support to NonStop SQL
integrated-pc-server,IBM Integrated PC Server (FSIOP),platform,IBM,1994-2002,emerging,obsolete,aberdeen-1997-as400-nt-server-ibm-microsoft-working-together,Intel Pentium Pro 200MHz board in AS/400 slot; original name FSIOP ('fizzy-op')
intel-i960,Intel i960 RISC Microprocessor,platform,Intel,1988-2007,mature,obsolete,aberdeen-1996-frame-relay-access-devices,Used in Netlink FRAD parallel port architecture; Matrix VC architecture
intel-landesk,Intel LANDesk,application,Intel,1992-present,emerging,active,aberdeen-1996-dec-manageworks-22,Desktop management partner integrated with ManageWORKS; later became LANDESK Software (now Ivanti)
intel-pentium-100,Intel Pentium 100 / Intel 100,platform,Intel,1994-1997,emerging,obsolete,aberdeen-1995-digital-multia,Newly announced Intel model of Multia at time of study; 100 MHz Pentium
intel-pentium-pro,Intel Pentium Pro / Klamath / Deschutes,platform,Intel,1995-1999,mature,obsolete,aberdeen-1996-debunking-ntsmp-scalability-myth,Pentium Pro 200MHz in Compaq ProLiant 5000; Klamath expected at 266MHz; Deschutes at 333MHz
intel-pentiumpro,Intel PentiumPro Processor,platform,Intel,1995-1999,emerging,obsolete,aberdeen-1996-risc-unix-market,May significantly improve performance of Intel-based commercial multiuser systems in 1996; watched nervously by RISC/Unix suppliers
intel-proshare,Intel ProShare Videoconferencing,application,Intel Corporation,1994-2001,emerging,obsolete,aberdeen-1996-vpns-business-mfs-success-strategy,Used by CNNfn virtual studio over MFS Datanet (Dec 1995); Intel ProShare discontinued; superseded by modern video conferencing
international-cryptography-framework,International Cryptography Framework (ICF),framework,Hewlett-Packard,1996-2001,emerging,obsolete,aberdeen-1996-hp-praesidium-family,HP standard to resolve national export controls on encryption; designed for global enterprise cryptography deployment
internet-cis,Internet-enabled CIS,application,Multiple,1996-present,emerging,active,aberdeen-1996-managing-customers-next-gen-helpdesk,Aberdeen discusses 'unexpected implications' of Internet-enabled CIS in 1996 edition.
internet-commerce-platform,Internet Commerce Platform (Category),application-category,multiple,1995-present,emerging,active,1997-commerce-exchange-pvp-250db8,"The emerging category of software that Commerce eXchange exemplified; Aberdeen's analysis of this category anticipates modern e-commerce platforms (Shopify, Magento, Salesforce Commerce Cloud, etc.); the category grew to a multi-billion dollar market."
internet-database-access,Internet/Intranet Database Access,protocol,Multiple,1995-present,emerging,active,aberdeen-1996-distributed-open-rdbms-buying-guide,Core DORS evolution driver per Aberdeen analysis
internet-intranet-deployment,Internet/Intranet Application Deployment,platform,multiple,1994-present,emerging,active,aberdeen-1997-silknet-software,Primary delivery medium for next-generation CIS applications; foreshadowed SaaS
internet-transaction-processing,Internet Transaction Processing (ITP),framework,Tandem/Aberdeen,1996-2005,emerging,obsolete,aberdeen-1996-tandem-vision-21st-century-electronic-business,Aberdeen/Tandem coined term; concept evolved into modern web-scale OLTP and microservices
intranet,Enterprise Intranet,framework,multiple,1994-present,emerging,active,aberdeen-1996-web-warehouses-dss-for-masses,Aberdeen identifies intranet as first high-impact Web candidate for enterprise DSS
ip-autolearn,IP AutoLearn,protocol,Bay Networks,1997-2000,emerging,obsolete,1997-bay-networks--switch-node-routing-s-4d9885,Bay proprietary feature; transparently integrates with existing routers without reconfiguration; automatically learns IP forwarding tables.
ip-switching,IP Switching (Ipsilon Technology),protocol,Ipsilon Networks,1994-1999,emerging,obsolete,1997-cabletron-and-ipsilon--linking-secu-adba48,Ipsilon's technology combining IP routing with ATM switching hardware; 5x router performance at fraction of cost; achieved via IFMP (Ipsilon Flow Management Protocol) and GSMP (Generic Switch Management Protocol); lost the standards battle to Cisco's MPLS/Tag Switching; IETF declined to standardize IFMP.
ipx-spx,IPX/SPX,protocol,Novell,1983-2000,mature,obsolete,aberdeen-1995-digital-multia,Novell network protocol included in Multia communications stack
iq-cyberlinks,IQ/CyberLinks,application,IQ Software,1996-1999,emerging,obsolete,aberdeen-1996-iq-software-www-reporting,Hyperlinking and navigation software for cross-database drill-through
iq-liveweb,IQ/LiveWeb,application,IQ Software,1996-1999,emerging,obsolete,aberdeen-1996-iq-software-www-reporting,"Web-enabled enterprise reporting; April 16, 1996 introduction; $3,995-$19,995 pricing"
iq-objects,IQ/Objects,framework,IQ Software,1993-1999,mature,obsolete,aberdeen-1996-iq-software-www-reporting,Object-oriented query building blocks; precursor to IQ/LiveWeb
iq-smartserver,IQ/SmartServer,application,IQ Software,1996-1999,emerging,obsolete,aberdeen-1996-iq-software-www-reporting,Scheduling and execution module; runs on Unix and Windows NT; publishes HTML to Web
iq-vision,IQ/Vision,framework,IQ Software,1996-1999,emerging,obsolete,aberdeen-1996-iq-software-www-reporting,Open architecture OLAP integration approach; slice/dice/drill-down
isdn,ISDN,protocol,Standards body,1988-2010,emerging,obsolete,aberdeen-1996-ciscos-access-business-unit-crystallizes-vision; aberdeen-1996-omnibox-interactive-broadcasting-network; aberdeen-1996-remote-access-cisco-untold-story; aberdeen-1997-3com-accelerates-remote-access-market; aberdeen-1997-aberdeen-group-impacts,Integrated Services Digital Network; key Combinet/750 series focus; basis for SOHO digital connectivity
ise-chip,ISE-Chip (Intelligent Switching Engine ASIC),platform,3Com,1994-2000,emerging,obsolete,aberdeen-1995-3com-lanplex-2500,"3Com proprietary ASIC delivering 565K pps forwarding. Front-end engine to RISC processor, creating 'fast path' architecture."
ism-openmaster,ISM/OpenMaster,framework,Groupe Bull,1993-2005,mature,obsolete,aberdeen-1996-bulls-sagister-datacenterdisciplined-unix-businesscritical-applications,Bull's network and systems management framework; tailored for datacenter commercial requirements
java,Java,language,Sun Microsystems,1995-present,emerging,active,aberdeen-1996-computer-telephony-integration; aberdeen-1996-lawson-software-desktop-workflow; aberdeen-1996-live-object-caching-high-performance; aberdeen-1996-moving-effectively-next-gen-client-server; aberdeen-1996-oracle-network-computing-architecture; aberdeen-1996-progress-software-webspeed-internet; aberdeen-1996-spider-technologies-netdynamics; aberdeen-1996-sun-microsystems-ultracomputing-business,Aberdeen dismisses Java as near-term overhyped; long-term Java became enterprise standard
java-activex,Java / ActiveX,framework,Sun Microsystems / Microsoft,1995-present,emerging,active,aberdeen-1996-data-generals-cybershield-security-solutions-advancing,Client-side technologies for Cybershield-based e-commerce; Java remains active; ActiveX deprecated
java-applets,Java Applets,language,Sun Microsystems,1995-2015,emerging,obsolete,aberdeen-1996-blyths-ren-architecture-prescription-it-success; aberdeen-1997-silknet-software,Referenced as market's dominant view of Net development at time; OMNIS could generate Java-equivalent code
java-server,Java Server / JAVA Forms,language,Sun Microsystems,1995-2010,emerging,active,aberdeen-1997-lawson-insight-process-orientation-business-management,Lawson WebDesktop delivered Insight screens as JAVA forms; Phase II planned JAVA Server support
kea,Kea! (Attachmate),application,Attachmate Corporation,1990-2014,mature,obsolete,aberdeen-1995-digital-multia,Terminal emulator (VT/3270) bundled with Multia; Attachmate acquired by Micro Focus 2014
khalix-21,Khalix 2.1,application,Longview Solutions,1996-2007,emerging,legacy-supported,aberdeen-1996-khalix-financial-awareness-competitive-advantage,Integrated CPM; now part of insightsoftware Longview suite; announced May 1996
khalix-financial-warehouse,Khalix Financial Warehouse,application,Longview Solutions,1996-2007,emerging,legacy-supported,aberdeen-1996-khalix-financial-awareness-competitive-advantage,"$95,000 add-on for data warehouse components; runs on Informix, SQL Server, Oracle, Sybase"
lan-server-40,IBM LAN Server 4.0,platform,IBM,1994-1996,mature,obsolete,aberdeen-1996-ibm-os2-warp-server,Integrated into OS/2 Warp Server
lan-server-400,IBM LAN Server/400,platform,IBM,1992-2000,mature,obsolete,aberdeen-1997-as400-nt-server-ibm-microsoft-working-together,IBM's NOS on AS/400 prior to NT integration; OS/2-based
lanplex-2500,LANplex 2500,platform,3Com,1994-2000,emerging,obsolete,aberdeen-1995-3com-lanplex-2500,16-port 10 Mbps Ethernet + 2 FDDI ports. Modular workgroup switch. ISE-chip ASIC. Introduced December 1994.
