study_id,title,author,date,type,subject_domain,methodology,source_file,abstract,license,importance,importance_rationale,relevance,relevance_rationale,prescience,prescience_rationale
1997-automating-and-managing-internal-op-e69e64,Automating and Managing Internal Operations,Aberdeen Group,1997-02-01,white-paper,IT-operations-management,"field-research, industry-analysis, competitive-profiling",1997 Automating and Managing Internal Operations wp.pdf,"Aberdeen Group examines the trend toward 'Consolidated Operations Management' (COM) as enterprises automate internal processes—IT help desk, asset management, SLA tracking, procurement, and HR—using a common adaptable platform. The paper identifies six success factors for COM adoption and profiles Remedy Corporation's Action Request System (AR System) as the leading vehicle for this transition, citing its extensibility, 3,000-plus customer base, and use beyond traditional help desk functions.",CC-BY-4.0,medium,Defined the 'Consolidated Operations Management' category and positioned help desk software as enterprise automation backbone; influential in framing ITSM market during Aberdeen's peak influence period.,medium,"The COM framework and its six success factors (adaptability, data access, UI, business rules, rapid modification, openness) remain conceptually applicable to modern ITSM and enterprise automation platforms, though specific product details are historical.",high,"Aberdeen's prediction that AR System would become a popular COM vehicle proved correct—Remedy grew to 7,000+ customers before acquisition by Peregrine/BMC; the ITSM platform consolidation trend Aberdeen described accurately forecast ServiceNow-era convergence."
1997-bay-networks--concentrating-on-remo-06bdd8,Bay Networks: Concentrating on Remote Access,Virginia Brooks,1997-10-01,announcement-profile,network-remote-access,"competitive-profiling, product-profiling",1997 Bay Networks_ Concentrating on Remote Access pr.pdf,"This Aberdeen Announcement Profile examines Bay Networks' two new remote access concentrator products: the 5399 (high-density, modular, for service providers and large enterprises) and the Model 8000 (stand-alone, for smaller ISPs and enterprises). Both feature BayDSP modem technology from Bay's acquisition of Penril Datability Networks. Aberdeen evaluates the emerging 56K modem market and how Bay's solutions address high-density remote access requirements.",CC-BY-4.0,medium,Profiles Bay Networks at a pivotal moment in remote access evolution when 56K modem standards were still contested between x2 and K56flex; captures the enterprise remote access market circa 1997 before DSL/cable broadband rendered dial-up concentrators obsolete.,low,"The specific products (5399, 8000 RAC) and technology (56K dial-up concentrators) are entirely obsolete; historical interest only for studying enterprise networking vendor strategies of the late 1990s.",medium,"Study noted 56K modem standard fragmentation as a challenge; ITU V.90 standard was ratified in September 1998, resolving the x2/K56flex conflict as implied by the study's concerns about compatibility issues."
1997-bay-networks--switch-node-routing-s-4d9885,Bay Networks' Switch Node Routing Switch Tackles Routing Performance Bottlenecks Head-On,Virginia Brooks,1997-03-07,impact-brief,enterprise-networking,"competitive-profiling, product-profiling, field-research",1997 Bay Networks_ Switch Node Routing Switch im.pdf,"Aberdeen analyst Virginia Brooks examines Bay Networks' Switch Node Routing Switch, announced March 3, 1997, as a Layer 3 switching solution for congested campus networks. The study analyzes how enterprise network traffic patterns had reversed from the traditional 80/20 local/cross-subnet model to 20/80, making router bottlenecks critical. Aberdeen assesses the Switch Node's architecture—separating data plane and control plane on dual 1.2 Gbps buses with IP AutoLearn—as a cost-effective alternative to router upgrades or full ATM migration.",CC-BY-4.0,medium,Captures the Layer 3 switching debate at a pivotal moment when campus networks were grappling with routing bottlenecks; Aberdeen's endorsement of Bay's approach over competing IP Switching/Tag Switching/Flow Switching alternatives reflects genuine market uncertainty about optimal solutions.,low,"The specific hardware products (Switch Node, 10/100BaseTX) are obsolete; however, the architectural insight of separating data-plane forwarding from control-plane topology remains foundational in modern SDN design.",medium,Aberdeen correctly identified routing bottlenecks as a critical enterprise problem and Layer 3 switching as the solution; Bay's approach was eventually superseded when Bay was acquired by Nortel (1998) and Cisco's EIGRP/switching dominated campus networking by 2000.
1997-broadvision-dynamic-web-application-5f10bb,"BroadVision Dynamic Web Applications Enhance Employees, Clinch Customers, and Pamper Partners",Aberdeen Group,1997-07-07,product-viewpoint,e-commerce-web-applications,"field-research, competitive-profiling, product-profiling, industry-analysis","1997 BroadVision Dynamic Web Applications Enhance Employees, Clinch Customers, and Pamper Partners pvp.pdf","Aberdeen Group's Product Viewpoint (Volume 10, Number 11, July 7, 1997) evaluates BroadVision's One-to-One Application System as a high-end dynamic Web application platform for corporate relationship management. Aberdeen defines a three-tier hierarchy of dynamic web servers (low-end CGI, mid-range ODBC, high-end CORBA-based object-oriented) and positions One-to-One as the industry leader in the high-end tier for personalized content delivery across Internet, intranet, and extranet channels. The study profiles One-to-One's capabilities for customer management, employee knowledge management, and partner/supplier extranets, citing customers including Liberty Financial, Banco Santander, USWest, and Kodak Picture Network.",CC-BY-4.0,high,"Published at the dawn of commercial e-commerce, this study accurately characterized the personalization and relationship management paradigm that would define CRM and e-commerce platforms for the next two decades; Aberdeen's categorization of dynamic web application tiers (CGI/ODBC/CORBA) was widely adopted in industry discourse.",medium,"The conceptual framework of personalized web applications, customer data exploitation, and relationship management via digital channels directly anticipates modern CRM, CDP, and martech platforms; specific performance benchmarks and product details are dated.",high,"Aberdeen's predictions about customer data becoming a competitive advantage, channel shift to internet reducing costs, and CRM/personalization as a strategic imperative all proved highly accurate; however, BroadVision itself lost market leadership to Salesforce.com and SAP by 2005."
1997-ca-s-unicenter-tng-framework-pk-apr-50d15f,CA's Unicenter TNG Framework: Entry-Level for the Industry's Best Enterprise Management Software Solution,Peter S. Kastner,1997-07-14,analyst-profile,enterprise-systems-management,"competitive-profiling, product-profiling, field-research, industry-analysis",1997 CA_s Unicenter TNG Framework PK apr.pdf,"Aberdeen Group analyst Peter S. Kastner profiles Computer Associates International's Unicenter TNG Framework, a free/bundled subset of Unicenter TNG announced July 14, 1997 at the CA World conference. The Framework provides auto-discovery, an object repository, 2D/3D mapping, event management, scheduling, and virus scanning—enabling 10-minute enterprise network discovery. Kastner analyzes CA's strategic shift to a 'razor/razor-blade' distribution model, bundling the Framework with server hardware from nine partners including HP and Digital Equipment, to establish it as a de facto enterprise management standard against IBM Tivoli, HP OpenView, and Sun Solstice.",CC-BY-4.0,high,Captured a pivotal strategic move by CA that presaged modern freemium/platform distribution strategies; Kastner was an influential Aberdeen Group analyst covering enterprise management and the study's framing of Unicenter's billion-dollar run rate and its competitive dynamics accurately characterized the enterprise management software market of the late 1990s.,medium,"The enterprise management market structure Aberdeen analyzed (CA vs. Tivoli vs. HP OpenView) provides historical context for modern observability and ITOM markets; the distribution strategy (bundle with hardware, create de facto standard) remains a relevant model for infrastructure software vendors.",medium,"CA's Framework did expand the Unicenter market and CA grew revenues to $6.1B by 2000; however, CA faced major accounting fraud scandals (2004-2006), HP OpenView was not permanently displaced, and IBM Tivoli remained competitive; CA was acquired by Broadcom in 2018."
1997-cabletron--discovering-the-beacon-u-2d44d5,Cabletron: Discovering the Beacon Under the Basket,Aberdeen Group,1997-04-01,company-profile,enterprise-networking,"competitive-profiling, industry-analysis, product-profiling",1997 Cabletron_ Discovering the Beacon Under the Basket strat pr.pdf,"Aberdeen Group Company Profile (Spring 1997) of Cabletron Systems, Inc., a leading LAN switch, VLAN, and network management technology company headquartered in Rochester, NH. The report argues that Cabletron's technical excellence is systematically underrecognized ('beacon under the basket') due to limited marketing investments and narrow Fortune 500 channel focus. Aberdeen documents Cabletron's SecureFast VLAN architecture, Spectrum network management platform, SmartSwitch product family, CyberSWITCH remote access line, and Synergy Plus VAR program. The report presents Aberdeen's concept of the Public-Private Switched Network (PPSN) as an emerging market for which Cabletron is positioned as a top-tier competitor. Key predictions include Cabletron's successful geographic expansion via World/One and Synergy Plus, and its ability to compete as an end-to-end LAN/WAN equipment provider against Cisco. Cabletron's subsequent corporate collapse and breakup in 2000 contradicted most of these predictions.",CC-BY-4.0,medium,This profile documents a pivotal but unsuccessful attempt by a major networking vendor to evolve from LAN switches to end-to-end networking solutions. Cabletron's failure illustrates the challenges of technology company transitions and the dominance of Cisco's ecosystem during the late 1990s routing/switching consolidation. The PPSN concept anticipated converged LAN/WAN architectures that later emerged as SD-WAN.,medium,"The strategic analysis of the routing-to-switching technology transition remains relevant context. Aberdeen's PPSN framework anticipates carrier-edge convergence that materialized in different forms (MPLS, SD-WAN). The product investment protection philosophy Cabletron espoused (long upgrade cycles vs. forklift replacement) remains a genuine enterprise networking value driver.",low,Aberdeen predicted Cabletron would succeed as an end-to-end LAN/WAN provider and PPSN competitor. In reality: Cabletron's revenue peaked in 1997 and then declined; the company failed to break into carrier markets; it reorganized as a holding company in 2000 and split into four subsidiaries; Enterasys Networks (core successor) was acquired by Extreme Networks in 2013 for only $180M. The PPSN market Aberdeen defined materialized but was dominated by Cisco/Lucent/Alcatel rather than Cabletron.
1997-cabletron-and-ipsilon--linking-secu-adba48,Cabletron and Ipsilon: Linking SecureFast Architecture and IP Switching,Samuel M. Alunni (Aberdeen Group),1997-04-17,impact-brief,enterprise-networking,"industry-analysis, competitive-profiling, product-profiling",1997 Cabletron and Ipsilon_ Linking SecureFast Architecture and IP Switching im.pdf,"Aberdeen Group Impact Brief (April 17, 1997) analyzing the strategic alliance between Cabletron Systems and Ipsilon Networks, in which Cabletron made a $20 million equity investment in Ipsilon. Aberdeen endorses the deal as one of the most rational of the industry's M&A wave: Cabletron contributes its SecureFast SmartSwitch technology with VLAN and policy-based management; Ipsilon contributes IP Switching technology that achieves 5x router performance at a fraction of the cost. The combined solution extends switched networking from desktop-to-campus-to-WAN, competing directly with Cisco's Tag Switching. Aberdeen predicts customers upgrading from hub/router LANs will find the combined product set extremely attractive, and forecasts that the alliance creates meaningful competitive differentiation against Cisco.",CC-BY-4.0,medium,This brief captures a pivotal moment in the late-1990s routing-vs-switching debate — one of the central technology battles that defined enterprise networking strategy for a decade. The Cabletron/Ipsilon alliance was representative of the industry's attempts to challenge Cisco's hegemony. The document records the short-lived IP Switching era and demonstrates how incumbent vendors attempted to counter Cisco's Tag Switching initiative.,medium,"The analysis of enterprise networking architecture evolution (from hubs to switches to IP switching) remains instructive for understanding how network markets transition. The specific technologies (GSMP, IFMP, LFAP protocols) are now obsolete, but the strategic logic of combining campus-switching with WAN edge intelligence anticipates modern SD-WAN approaches.",low,Aberdeen's prediction that the Cabletron/Ipsilon alliance would create sustained competitive differentiation against Cisco proved incorrect. Nokia acquired Ipsilon for $120M in December 1997 — just 8 months after this report — effectively unwinding the alliance. Cabletron's $20M equity stake in Ipsilon was devalued significantly. The IP Switching technology standard (IFMP) lost to Cisco's MPLS approach. Cabletron itself declined and was broken up in 2000.
1997-cis-report-ba825e,Managing Customers with Next-Generation Software Applications: 1997 Edition,"Hugh Bishop, Chris Pavlic & Bill Hills (Aberdeen Group)",1997-10-01,market-research-report,customer-interaction-software,"field-research, competitive-profiling, industry-analysis, product-profiling",1997 CIS Report.pdf,"Aberdeen Group's third annual market research report on Customer Interaction Software (CIS) — a class of front-line applications covering customer service, customer support, sales force automation, telemarketing/telesales, sales configuration, internal help desk, and quality assurance. Published in late 1997 at $895 per copy and 246 pages, the report profiles over 60 CIS software suppliers, seven systems integrators, and three systems suppliers. Key themes include: the transition to Web-based CIS architectures, diverging paths of customer support vs. customer service vs. help desk, CIS-to-ERP integration trends, and computer-telephony integration (CTI). The report names Siebel Systems, Clarify, Vantive, Remedy, Scopus, and over 50 other vendors as major market participants, and forecasts substantial market growth through the late 1990s.",CC-BY-4.0,high,This report captured the CRM market at its inflection point — the moment when disparate front-office applications began coalescing into what the industry would later call CRM. Aberdeen's framework of CIS modules and its vendor landscape became foundational reference material during the most active period of CRM market consolidation (1997-2005). The report anticipated the rise of integrated CRM suites that would define Oracle's and SAP's application portfolios.,high,"The CIS/CRM framework developed in this report remains structurally valid. Modern CRM platforms (Salesforce, Microsoft Dynamics, SAP CX) still organize capabilities around the same functional pillars: sales automation, customer service, help desk/ITSM, and field service. The specific vendor profiles are dated, but the market structure analysis retains explanatory power.",high,"Aberdeen correctly foresaw Web-based CIS architectures becoming dominant, the convergence of CIS with ERP, and CTI as a critical enabler — all of which materialized. However, the specific vendor predictions were dramatically disrupted: Siebel rose to ~45% market share by 2002 then was acquired by Oracle; Vantive was bought by PeopleSoft; Clarify was sold to Nortel then Amdocs; Scopus was acquired by Siebel; Remedy went to Peregrine then BMC; and Salesforce.com (founded 1999, not in this report) eventually displaced all of them."
1997-cisco-s-core-products-business-inte-bd8697,Cisco's Core Products Business Integrates Routing and Switching,Aberdeen Group,1997-01-01,company-profile,enterprise-networking,"competitive-profiling, industry-analysis, product-profiling",1997 Cisco_s Core Products Business Integrates Routing and Switching pr.pdf,"Aberdeen Group Company Profile (January 1997) of Cisco Systems, Inc., examining how the undisputed leader in enterprise internetworking has evolved from a router-only vendor to a comprehensive end-to-end networking solutions provider. The report documents Cisco's acquisition strategy including the 1996 StrataCom acquisition, its IOS software as the de facto internetworking standard, and two key new technologies: NetFlow Switching (enhancing router performance with per-flow statistics and QoS) and Tag Switching (combining Layer 2/3 switching submitted to IETF). Aberdeen analyzes Cisco's positioning for ISPs and the emerging Gigabit Switch Router (GSR/12000 Series). The report correctly identifies Cisco's strengths (IOS investment protection, comprehensive product line, channel execution) and key challenge (can Cisco maintain leadership if switching replaces routing?). Aberdeen's answer: yes, through technology assimilation and Tag Switching.",CC-BY-4.0,high,"This report captures Cisco at the moment it was consolidating its dominant position in enterprise networking while simultaneously pioneering the routing/switching integration that would define the next decade of internet infrastructure. The IOS operating system, Tag Switching (which became MPLS), NetFlow, and the GSR all proved to be transformative technologies. Aberdeen's analysis of Cisco's competitive strategy during this period is historically significant.",high,"The core analytical framework — Cisco's strategy of assimilating emerging technologies rather than defending legacy ones — remains the definitive explanation of how Cisco maintained market leadership for two decades. The IOS investment protection model, Tag Switching/MPLS analysis, and ISP market targeting all directly predict the actual trajectory of internet infrastructure development.",high,Aberdeen's analysis proved highly accurate: Cisco did maintain dominant market position through switching integration; Tag Switching became MPLS and is still fundamental to backbone networks; the GSR 12000 Series became a hugely successful product ($1B+ revenue); NetFlow evolved into a network monitoring standard (IPFIX); Cisco's IOS remained the de facto standard through the 2000s. Aberdeen correctly identified all key strategic elements.
1997-commerce-exchange-pvp-250db8,Commerce eXchange Answers The 'Show Me The Internet Money!' Challenge,Aberdeen Group,1997-03-14,product-viewpoint,internet-commerce,"field-research, product-profiling, user-research, industry-analysis",1997 Commerce eXchange pvp.pdf,"Aberdeen Group Product Viewpoint (Volume 10, Number 2, March 14, 1997) evaluating InterWorld Technology Ventures' Commerce eXchange 2.0 — an enterprise Internet commerce platform. Aberdeen argues that the primary obstacle for high-volume Internet sites is lack of solution breadth, and positions Commerce eXchange as the answer for companies needing a single-vendor solution covering transaction engine, application portfolio, distributed object architecture (Oasis), and management tools. The study documents Commerce eXchange's support for both B2C and B2B electronic commerce (including EDI integration), its CORBA/DCOM-neutral abstraction layer, and its customers including Broderbund, MicroWarehouse, Multiple Zones International, and Scholastic. Aberdeen forecasts 1997 will see explosive Internet sales across financial services, retail, and travel sectors. InterWorld ultimately failed, filing for Chapter 11 in 2004 under its successor entity eB2B Commerce, Inc.",CC-BY-4.0,high,"This report documents the birth of enterprise e-commerce infrastructure at the precise moment the market was forming. Aberdeen's analysis of the challenge of high-volume internet site architecture — open scalable platforms, integrated transaction engines, abstraction layers to avoid technology lock-in — directly anticipates the e-commerce platform architecture debates that would dominate the industry for the next decade. The customers cited (computer hardware retailers) represent the exact market segment that drove early internet commerce.",high,"The analytical framework for evaluating internet commerce platforms (transaction engine, application portfolio, open architecture, management tools) remains structurally valid for evaluating modern e-commerce platforms. Aberdeen's identification of scalability, openness, and integration as the key requirements directly maps to modern cloud commerce platform evaluation criteria.",medium,"Aberdeen's market timing predictions (1997 as the year of explosive internet sales) proved broadly accurate. The architectural prescriptions (open platforms, abstraction layers, distributed transaction processing) proved directionally correct. However, InterWorld itself failed — a common pattern in 1990s e-commerce pioneers. Specific technology predictions (CORBA as the enterprise object standard, EDI as B2B integration) were partially superseded by XML/REST architectures and later API-based integration."
1997-commercial-risc-unix-1996-mvp-711569,Commercial RISC/Unix 1996: HP Achieves Over 50% Share In 28% Growth Market,AberdeenGroup,1997-02-03,Market Viewpoint,Enterprise Computing / Server Infrastructure,Annual survey; vendor interviews; market revenue analysis; IS decision-maker surveys,1997 Commercial Risc_Unix 1996 mvp.pdf,Aberdeen's seventh annual survey of the commercial multiuser RISC/Unix marketplace documents 28% revenue growth to $18.2 billion in 1996. Hewlett-Packard achieved 52% market share through strong PA-8000 processor performance and customer loyalty. IBM held 18% with RS/6000 SP LAN-consolidation wins. Sun Microsystems grew 73% on Internet/web server demand and Java. The report forecasts continued RISC/Unix dominance for enterprise-level production applications through 1998-1999 while projecting Intel IA-64 as a shared future processor platform for both Unix and NT.,CC-BY-4.0,5,"Primary quantitative market data from Aberdeen's seventh consecutive annual survey of the RISC/Unix market, providing rare vendor-level revenue breakdowns ($18.2B total, HP 52%, IBM 18%, Sun fast-growing) validated by direct enterprise IS surveys. Documents a pivotal transitional moment before the IA-64 era and the internet server explosion.",4,"Directly relevant to understanding the Unix server market trajectory in the late 1990s, vendor competitive dynamics, and how RISC platforms competed against early Windows NT. Provides context for HP's commercial computing dominance before its eventual decline and Sun's web/internet positioning that foreshadowed Java's importance.",4,Aberdeen correctly anticipated Sun's growing web/internet importance (Sun was acquired by Oracle in 2010 after dominating internet servers). The IA-64 prediction was partially correct — Intel released Itanium but it never achieved the universal adoption projected. The NT-for-workgroups / Unix-for-enterprise bifurcation proved accurate for roughly a decade. HP's PA-8000 leadership was correctly assessed though HP's eventual pivot to Itanium and later x86 proved the RISC/Unix market terminal. The Year 2000 factor driving new RISC/Unix deployments over mainframe repair proved prescient.
1997-crm-siebel-systems-pr-569e52,Siebel Systems: Customer Interaction Software Vendor Profile,Aberdeen Group,1997-06-04,Vendor Strategy Profile,CRM / Enterprise Software / Sales Force Automation,Vendor assessment; product evaluation; partnership analysis; analyst opinion,1997 crm Siebel Systems pr.pdf,"Aberdeen Group strategy profile evaluating Siebel Systems as a major and rapidly growing force in the Customer Interaction Software (CIS) market. Covers the N-tiered architecture of Siebel Enterprise Applications, the company's partner-driven deployment model (Andersen Consulting, KPMG, Cambridge Technology Partners, Price Waterhouse), and Microsoft alliance. Aberdeen predicts 1997 will be another successful year for Siebel as CRM market grows.",CC-BY-4.0,8,Siebel became the dominant CRM vendor of the late 1990s peaking at 45% market share; this profile captures a critical early inflection point before the CRM explosion; the 214-employee company described here grew to $1B+ revenue by 2000,7,CRM remains a massive enterprise software category; Siebel's Oracle CRM descendants still in use; the partner-led deployment model and N-tier architecture patterns pioneered by Siebel are standard today,9,Aberdeen's prediction of Siebel's success was spectacularly accurate: 1997 revenue $120M; 1998 revenue $391.5M (+89%); named fastest-growing US company by Fortune in 1999; $1B revenue by 2000; acquired by Oracle for $5.85B in 2006 at 45% CRM market share peak
