study_id,title,author,date,type,subject_domain,methodology,source_file,abstract,license,importance,importance_rationale,relevance,relevance_rationale,prescience,prescience_rationale
1997-dynaflo-systems----e-mail-for-the-b-854582,DynaFlo Systems: E-Mail For The Business Masses,Peter Kastner and Dan Taylor,1997-07-01,Profile,Internet Email / ISP Services,Vendor profile with field research findings,1997 DynaFlo Systems -- E-Mail For The Business Masses pr.pdf,"Aberdeen Group vendor profile of DynaFlo Systems and its PushMail product, a cost-effective Internet email solution targeting Service Providers (ISPs) seeking to expand beyond early adopters. Aberdeen field research found many ISPs were growing sales while losing money; DynaFlo's PushMail offered ISPs a high-margin add-on service to reach the larger non-connected business market (9 of 10 businesses had not yet connected to the Internet in 1997).",CC-BY-4.0,3,"Brief profile (~2,100 chars extracted) of a small ISP email vendor. Captures the mid-1990s ISP market dynamics and the 'business masses' Internet adoption challenge accurately, though DynaFlo itself did not survive.",4,"Highly relevant to historians of ISP market consolidation, early Internet email services, and the challenge of monetizing ISP connectivity. The '9 of 10 businesses not yet connected' statistic and ISP profitability problem are historically significant.",4,"Aberdeen's core predictions — that ISPs needed enhanced services beyond connectivity, that the non-early-adopter business market was the key growth opportunity, and that ISP consolidation would occur — all proved correct. DynaFlo's specific PushMail product did not survive the ISP consolidation of the late 1990s."
1997-dynasoft's-boks-family--a-pragmatic-e6df7d,DynaSoft's BoKS Family: A Pragmatic Choice for Single Sign-On,Aberdeen Group,1997-06-01,Profile,Enterprise Security / Single Sign-On,Vendor profile with user interviews and product evaluation,1997 DynaSoft's BoKS Family_ A Pragmatic Choice for Single Sign-On pr.pdf,"Aberdeen Group profile of DynaSoft AB (Stockholm, Sweden) and its BoKS product family, evaluating it as a pragmatic Single Sign-On (SSO) solution for enterprises. The report covers DynaSoft's SSO/SSSO product architecture (BoKS Desktop, BoKS Connect, BoKS Manager, ToolBoKS), its authentication framework using RSA cryptography and X.509 certificates, strategic partnerships with Hewlett-Packard and Sun Microsystems, and user testimonials from major enterprises including BankBoston, BP Oil, Citibank, Chase Manhattan Bank, Merrill Lynch, and Telstra. Aberdeen concludes BoKS delivers reliable, pragmatic SSO that users consistently recommend.",CC-BY-4.0,4,"Full-text profile of a real enterprise security product with verifiable user deployments and strategic vendor endorsements (HP Praesidium, Sun Security Manager). Provides concrete insight into 1997-era SSO market and security product landscape.",4,"Directly relevant to historians of enterprise identity management, SSO evolution, and the security technology vendor landscape of the late 1990s. DynaSoft was acquired by Security Dynamics (later RSA Security) in July 1997 for $115M — validating Aberdeen's assessment.",4,Aberdeen correctly assessed BoKS as enterprise-grade and worth investment. The acquisition by Security Dynamics for $115M within months confirmed the technology's value. SSO itself became foundational enterprise infrastructure. However the specific BoKS product line was absorbed into RSA Security and eventually superseded by modern identity platforms (Active Directory Okta etc.).
1997-electronic-commerce-to-internet-com-b26a35,Electronic Commerce to Internet Commerce: The Evolution of The InterNetworked Enterprise,David Alschuler,1997-11-01,White Paper,Electronic Commerce / Internet Commerce,Analytical framework with market research; EDI and Internet technology assessment,1997 Electronic Commerce to Internet Commerc...ution of The InterNetworked Enterprise wp.pdf,"Aberdeen Group Executive White Paper concluding that organizations are 'on the threshold of a revolution in Electronic Commerce (EC).' Focuses on the convergence of EC and Internet technologies into 'Internet Commerce (IC).' Explores benefits of Internet Commerce, its relationship to EDI, and impacts on internal and external business processes. Provides analytical framework for understanding virtual channel impacts on business equilibrium and for assessing EC/IC supplier technologies.",CC-BY-4.0,4,Captures a pivotal moment in the transition from EDI-based electronic commerce to Internet-based commerce. The 'Internet Commerce' framing and the analytical framework for EC/IC supplier assessment are historically important as early attempts to systematize the e-commerce vendor evaluation process.,4,Directly relevant to e-commerce history; Aberdeen's conclusion that EC revolution was already underway in November 1997 — just 3 years after Amazon launched — is a significant historical data point. EDI-to-Internet transition framework remains educationally valuable.,5,Aberdeen's core prediction that Internet Commerce would grow explosively and transform business processes proved spectacularly correct. The report correctly identified Internet technologies as the enabler and EDI as the legacy to be replaced. E-commerce grew from near-zero to a global market exceeding $6 trillion by 2024.
1997-forte-enterprise-development-enviro-a07cf9,Forte Enterprise Development Environment,Aberdeen Group,1997-10-01,product-profile,Application Development Tools,"vendor-briefing,product-analysis,market-assessment",1997 Forte Enterprise Development Environment pr.pdf,"Aberdeen Group examines Forte Software's Forte Release 3.0, Forte Express, and Forte Conductor — a second-generation High-end Application Development Environment (HADE) suite. The profile evaluates Forte's capabilities in application partitioning, multitier client-server development, Internet/Intranet support, and workflow automation. Aberdeen concludes that Forte delivers significant long-term value for enterprise-critical applications and rates it a leader in second-generation HADE capabilities.",CC-BY-4.0,3,Documents a significant mid-tier enterprise app dev tool of the mid-1990s that was ultimately acquired by Sun Microsystems for $540M in 1999. Provides a detailed technology snapshot of HADE capabilities during the critical client-server era transition.,3,"Illustrates the architectural paradigms (application partitioning, multitier, workflow) that prefigured modern microservices and workflow orchestration. Relevant to historians of enterprise software tooling.",4,"Aberdeen correctly identified Forte's Internet integration strategy as key to long-term value. The prediction of CORBA/IIOP and Java integration as competitive differentiators proved accurate. The assessment that Forte had M&A appeal proved correct when Sun acquired the company for $540M in 1999, valuing exactly the EAI and web application integration capabilities Aberdeen highlighted."
1997-hewlett-packard-v-class--providing--897f7a,Hewlett-Packard V-Class: Providing Enterprise Customers With the Power Path They Need,Aberdeen Group,1997-05-22,product-profile,Enterprise Server Hardware,"vendor-briefing,benchmark-analysis,competitive-assessment",1997 Hewlett-Packard V-Class_ Providing Ente...ustomers With the Power Path They Need pr.pdf,"Aberdeen Group evaluates HP's newly announced V-Class HP 9000 enterprise SMP servers (announced May 22, 1997). Based on supercomputing crossbar technology acquired from Convex, the V2200 Enterprise Server promises a 50% improvement in OLTP performance over existing top SMP systems. Aberdeen examines HP's roadmap through 1999 including NUMA extensions, competitive positioning against Sun, IBM, and Digital, and recommends enterprise IS executives evaluate V-Class for mainframe replacement and high-end production workloads.",CC-BY-4.0,3,Documents HP's strategic repositioning in the high-end UNIX server market using Convex supercomputing technology. The V-Class represented HP's competitive response to Sun and IBM; the HP 9000 line was eventually discontinued in 2003 after HP's Itanium-based Integrity servers emerged.,3,Illustrates the intense UNIX server performance wars of the late 1990s and the Y2K mainframe replacement cycle. The crossbar interconnect technology foreshadowed modern high-bandwidth memory fabric architectures.,3,"Aberdeen correctly predicted that OLTP performance demands would continue to grow and that V-Class would displace mainframe workloads. HP did ship the V2200 approximately on schedule. However, the prediction that NT would not be viable for enterprise workloads ""this millennium"" proved wrong — NT/Windows 2000 gained significant enterprise traction by 1999-2001. The Merced/IA-64 prediction for 1999 was also delayed; Itanium shipped in 2001."
1997-hewlett-packard’s-strategy-to-surpa-905013,Hewlett-Packard's Strategy to Surpass Compaq in the Enterprise-NT Marketplace,Aberdeen Group,1997-08-01,white-paper,Enterprise Computing Strategy / Windows NT Market,"market-analysis,competitive-assessment,vendor-briefing",1997 Hewlett-Packard's Strategy to Surpass Compaq in the Enterprise-NT Marketplace wp.pdf,"Aberdeen Group examines HP's Simplified Enterprise Computing (SEC) strategy and predicts HP has a legitimate shot at becoming the NT market leader over Compaq by late 1998. The paper analyzes HP's SEC framework (TCO reduction, HP/Microsoft joint solutions, heterogeneous interoperability), Compaq's weaknesses at the enterprise level, and Compaq's Tandem acquisition. Aberdeen concludes HP's enterprise experience, service infrastructure, and Microsoft partnership give it decisive advantages over Compaq in the high-end NT market.",CC-BY-4.0,4,"This white paper documents the strategic dynamics of the late-1990s NT server market just before Compaq acquired DEC (1998) and HP acquired Compaq (2002). Aberdeen's predictions about HP's enterprise advantages and Compaq's channel limitations proved prescient; however, HP never achieved NT market leadership — instead merged with Compaq to form the combined company. The paper also documents the Tandem acquisition by Compaq before it closed.",4,"Highly relevant to the history of enterprise computing platform wars. The HP vs Compaq dynamics directly led to the 2002 merger. The paper's framework (MAP requirements, TCO, enterprise vs channel), the VPA pricing strategy, and the IA-64/Merced roadmap discussions are all historically significant.",3,"Aberdeen correctly predicted Compaq would face severe pressure from Dell/Gateway in low-end markets and from HP/IBM in enterprise. The Tandem acquisition analysis was accurate (Compaq did acquire Tandem). However, Aberdeen predicted HP would achieve NT market leadership 'potentially by late 1998' — this did not happen. HP never led the NT market; instead HP merged with Compaq in 2002. The IBM competitive dynamic also evolved differently."
1997-ibm-application-development-product-895c4d,IBM Application Development Product Family,Aberdeen Group,1997-06-04,product-profile,Application Development Tools / Network Computing,"vendor-briefing,product-analysis,customer-reference",1997 IBM Application Development Product Family pr.pdf,"Aberdeen Group profiles IBM's Application Development (IBM AD) product family, anchored by the VisualAge suite (COBOL, BASIC, C++, Smalltalk, Java-upcoming), FlowMark workflow, IBM Business Process Modeler, DataAtlas, and Team Connection. The profile evaluates these tools' suitability for IBM shops migrating legacy COBOL/3GL applications to network computing architectures. Aberdeen concludes IBM AD tools provide a solid mix of emerging and tried-and-true technologies particularly valuable for IBM installed-base migrations.",CC-BY-4.0,3,"Documents IBM's mid-1990s developer tooling strategy during the network computing transition. VisualAge is a historically significant product family — its VisualAge Micro Edition evolved into the Eclipse IDE framework, one of the most important developer tools ever created. The profile is a key snapshot of IBM's OOP and Java strategy just as Java was being released.",3,Relevant to historians of enterprise development tools and the legacy COBOL modernization challenge (which persists to this day). FlowMark evolved into IBM MQ Workflow; OpenDoc was abandoned. The IBM SOM/DSOM interoperability architecture represents a road not taken (CORBA vs COM war era).,3,"Aberdeen correctly identified VisualAge for Java as the most strategically important upcoming product — Java did become the dominant enterprise language. The assessment that IBM AD tools were most effective for IBM installed-base migration (rather than greenfield development) proved accurate. However, Aberdeen did not predict the most significant outcome: VisualAge Micro Edition evolving into Eclipse (2001), which became the world's dominant Java IDE."
1997-ibm-business-intelligence-family-pr-43c37e,IBM Business Intelligence Family,Aberdeen Group,1997-06-04,product-profile,Business Intelligence / Data Warehousing,"vendor-briefing,product-analysis,market-assessment",1997 IBM Business Intelligence Family pr.pdf,"Aberdeen Group profiles IBM's Business Intelligence Family — a suite spanning Information Warehouse (enterprise data warehouse), Visual Warehouse (data marts), Intelligent Decision Server (OLAP), and Intelligent Miner (data mining), all built on DB2 and Internet-enabled via Net.data. The profile evaluates IBM's strategy to expand decision support from corporate data analysts to line-of-business users and remote locations via network computing. Aberdeen concludes the BI Family differentiates through breadth, advanced OLAP, and network-computing integration.",CC-BY-4.0,4,This profile documents IBM's BI strategy during the critical transition from centralized data warehousing to distributed/departmental data marts and early web-enabled analytics. The Intelligent Decision Server evolved from Metaphor DIS — a historically significant product. IBM's BI strategy eventually led to the Cognos acquisition (2007); Intelligent Miner presaged modern machine learning tooling. This is a key archival document of the 1990s data warehousing era.,4,"Highly relevant to the history of business intelligence and data warehousing. Concepts including data marts vs enterprise warehouses, OLAP drill-down, and data mining described here are foundations of modern BI. IBM's eventual path (acquiring Cognos 2007) and the rise of self-service BI tools validate many Aberdeen observations.",4,"Aberdeen correctly predicted that data warehousing would expand from corporate specialists to line-of-business/remote users ('to the masses') — this describes the entire trajectory of BI from 1997 to 2020s (self-service BI, Tableau, Power BI, etc.). Aberdeen correctly identified data mining as a key growth area. The prediction of network-computing enabling broader decision support proved accurate. However, Aberdeen did not anticipate SaaS-delivered BI or the rise of columnar databases (Redshift, Snowflake) that disrupted the DB2-centric architecture."
1997-ibm-extended-transaction-systems-fa-0369fa,IBM Extended Transaction Systems Family,Aberdeen Group,1997-06-04,Profile,Transaction Processing / Network Computing,Vendor product analysis with technology assessment,1997 IBM Extended Transaction Systems Family pr.pdf,"Aberdeen Group evaluates IBM's Extended Transaction Systems (ETS) product family — comprising MQSeries commercial messaging, Lotus Notes groupware, Transaction Server (CICS/Encina), Database Server (DB2), and IMS — assessing their value for mission-critical transaction processing in network-computing and Internet/Intranet architectures. The study recommends ETS as a low-risk migration path for IBM shops transitioning to network computing.",CC-BY-4.0,8,"ETS framed the strategic convergence of mainframe TP heritage (CICS, IMS) with emerging Internet middleware. MQSeries became one of the most durable enterprise messaging platforms in history, remaining active as IBM MQ through 2026. The document captures the critical juncture when enterprises needed to extend proven TP infrastructure to the Web without wholesale rewrites.",7,"Highly relevant to contemporary middleware, messaging, and enterprise integration discussions. The core architectural pattern — decoupling application components via persistent queuing, using TP monitors for load balancing, and federating heterogeneous databases — directly anticipates modern microservices and event-driven architectures. Practitioners studying legacy modernization or IBM Z environments will find direct lineage.",8,"Aberdeen accurately predicted that MQSeries would evolve to support distributed Object Request Brokers and third-party tooling (confirmed: renamed WebSphere MQ 2002, IBM MQ 2014, now at v9.4). The prediction that Lotus Notes would continue integrating with the Internet proved directionally correct though Notes ultimately lost the web collaboration race to Microsoft Exchange/SharePoint. The forecast that DB2 multimedia/Extender capabilities would expand proved correct. The framing of TP-monitor middleware as the critical scalability layer for Internet architectures directly anticipated what became application servers (WebSphere, JBoss)."
1997-ibm-information-integration-family--29351c,IBM Information Integration Family,Aberdeen Group,1997-06-04,Profile,Data Integration / Network Computing,Vendor product analysis with technology assessment,1997 IBM Information Integration Family pr.pdf,"Aberdeen Group evaluates IBM's Information Integration product family — DataJoiner (heterogeneous federated query), DataPropagator (log-based replication), Net.data (web-to-database middleware), and MQSeries — assessing their ability to coordinate data across distributed network-computing databases. Aberdeen concludes the family excels in heterogeneity and scalability, and recommends it for enterprises with multiple-supplier database environments.",CC-BY-4.0,7,The study documents the emergence of data federation and replication middleware as enterprise imperatives at the dawn of the Internet era. DataJoiner's federated query model directly anticipates IBM InfoSphere Federation Server and later Apache Drill/Presto-style query engines. The insight that enterprises need to reuse middleware across recurring data-integration projects — rather than build one-offs — is foundational to modern ELT/ETL platforms.,8,"Highly relevant to contemporary data integration, ETL/ELT, and data mesh discussions. The 'data archipelago' metaphor and the need to federate heterogeneous data sources anticipate modern data lakehouse architecture. DataPropagator's log-based CDC (Change Data Capture) approach is now the dominant pattern in tools like Debezium and AWS DMS. Net.data's web-to-database dynamic query pattern anticipated REST APIs and GraphQL.",7,Aberdeen accurately predicted: (1) DataPropagator would add further traditional RDBMS scalability technologies (confirmed — evolved into DB2 Replication Services); (2) a Visual Programming Environment for rapid development would be added (partially confirmed via IBM Rational tools); (3) administrative tools would improve toward near-lights-out ease of use (confirmed — IBM InfoSphere CDC and modern cloud tools). The prediction that information integration products would be reused across wider variety of cases proved correct — the pattern became the data integration platform market.
1997-ibm-ships-first-64-bit-rs-6000-serv-961e2c,IBM Ships First 64-bit RS/6000 Server,Tom Willmott / Aberdeen Group,1997-10-06,Announcement Profile,UNIX Server Hardware / 64-bit Computing,Analyst announcement brief with market context,1997 IBM Ships First 64-bit RS_6000 Server pra.pdf,"Brief Aberdeen Group Announcement Profile by analyst Tom Willmott reviewing IBM's October 6, 1997 availability of the RS/6000 S70 (code-named Raven), the first 64-bit RS/6000 server. The S70 is a 4-to-12-way SMP server using IBM's RS64 (Apache) 64-bit processor with PCI bus, delivering an estimated 18,000 TPC Transactions Per Minute. The piece contextualizes IBM's Unix market position and the two-phase 1997 RS/6000 product strategy (PowerPC 604e SMP in May, 64-bit RS64 in October).",CC-BY-4.0,7,"Documents a pivotal moment in IBM's Unix computing history: the first 64-bit RS/6000 server, powered by IBM's RS64 (Apache) processor. This milestone positioned IBM to compete in high-end commercial Unix workloads against Sun SPARC and HP PA-RISC at a time when 64-bit computing for commercial workloads was still novel. Aberdeen had accurately forecast this product in prior research. The RS64 line eventually merged into the POWER4 architecture in 2001.",5,"Primarily of historical interest to IBM POWER/AIX platform historians and those studying the Unix workstation market consolidation of the late 1990s. Modern relevance is indirect: IBM Power Systems (AIX) remains active in 2026, and the RS64's commercial-transaction optimization philosophy carries forward in IBM Z and IBM Power. Limited direct applicability to contemporary enterprise IT buyers.",7,"Aberdeen's prior prediction of a Spring 1997 roll-out of SMP servers based on PowerPC 604e chip proved correct (RS/6000 F50 in May 1997). Aberdeen's framing of a two-phase 1997 product announcement — 604e SMP first, then 64-bit high-end — proved accurate. The prediction that IBM's Unix position and AIX strategy would continue to be relevant proved correct: AIX/Power Systems remains active through 2026+ with AIX 7.3 supported through 2033. The RS64 line merged into POWER4 in 2001 as predicted by industry observers."
1997-ibm-when-a-pc-is-simply-platform-ov-5e9364,When a PC is Simply Platform Overkill: IBM's Network Station Alternative,Aberdeen Group,1997-04-01,Profile,Thin Client Computing / Network Computer / Desktop Strategy,Vendor product evaluation with cost analysis and user testing,1997 IBM When a PC is Simply Platform Overkill pr.pdf,"Aberdeen Group evaluates IBM's Network Station network computer (NC), assessing its core technology, market positioning, and cost/value proposition versus full-featured PCs. The IBM Network Station is a PowerPC 403-based diskless thin client supporting 5250/3270/ASCII/X terminal emulators, Java applets, and Windows NT-server-hosted applications via WinCenter Pro. At a $695 base price (vs. $2,000+ PC), Aberdeen endorses the Network Station for information workers needing multi-server access, recommending IS managers evaluate it to reduce PC support costs estimated at $4,000-$15,000 per user per year.",CC-BY-4.0,8,"This study documents the peak optimism of the 1990s Network Computer movement — a pivotal moment in computing history. The NC reference profile standard (IBM, Oracle, Sun, Apple, Netscape) represented a coordinated industry attempt to break Microsoft/Intel dominance. Aberdeen's detailed cost analysis ($695 NC vs $2,000+ PC; $4,000-$15,000/year PC support costs) established a TCO framework that still underlies thin client / VDI / Chromebook arguments today. The NC failed commercially but the concept resurfaced in cloud PCs, Chromebooks, and virtual desktop infrastructure.",9,"Exceptionally relevant to contemporary IT strategy. The arguments Aberdeen made in 1997 are structurally identical to those made for Chromebooks (2011+), Amazon WorkSpaces, Citrix VDI, and Windows 365 Cloud PC. The cost of PC support ($4,000-$15,000/user/year), the management complexity of distributed PC estates, and the appeal of centralized application delivery are live enterprise concerns in 2026. The Network Station's failure provides important lessons about timing, application ecosystem readiness, and the commoditization of PC hardware.",6,"Mixed prescience. Aberdeen correctly identified the fundamental cost and management problem with distributed PC estates (now addressed by MDM tools, Autopilot, Intune). The prediction that NC devices would lead to significant desktop cost reductions proved largely incorrect for the NC specifically — PC prices fell below $1,000, neutralizing the cost argument. The prediction that Java would be 'broadly accepted as a primary application development environment' proved correct for server-side Java but incorrect for desktop Java. The NC concept was vindicated by Chromebooks and cloud PCs, but not within the 3-5 year timeframe implied."
