"entity_id","entity_name","entity_type","sector","status","successor","years_active","study_id","notes"
"aberdeen-group","Aberdeen Group","firm","Market Research / IT Consulting","acquired","Harte-Hanks Communications (2006); later spun off as Aberdeen Strategy & Research","1988-present","1996-electronic-commerce-25d31b","Co-author organization; Boston-based market research and consulting firm."
"acer","Acer","company","Consumer / Enterprise IT Hardware","active","","1976-present","intel-2010-vpro-daily-globe-42697e","OEM among first to ship 2010 Core i5/i7 business PCs and notebooks."
"adaptec","Adaptec","company","Storage Controllers","acquired","PMC-Sierra (acquired 2010)","1981-present","intel-infiband-wp--edit-psk-5-22f-a2c551","IBA HCA adapter vendor (late 2002 / early 2003)."
"advanced-micro-devices","Advanced Micro Devices (AMD)","company","Semiconductors","active","","1969-present","amd-profile01-64e43b","Subject of critique; manufacturer of Athlon XP processors"
"agilent-technologies","Agilent Technologies","company","Electronic Measurement / Networking","active","","1999-present","intel-infiband-wp--edit-psk-5-22f-a2c551","IBA HCA adapter vendor."
"airborne-express","Airborne Express","company","Logistics / freight","acquired","DHL (acquired by Deutsche Post/DHL, closed August 15, 2003, $1.05B; airline spun off as ABX Air)","unknown [REVIEW]","dell-sd2-final-d6e78c","Named logistics partner for pre-packed box returns; pickup via www.airborne.com or 1-800-AIRBORNE"
"amazon","Amazon","company","E-Commerce / Cloud","active","","1994-present","2010-intel-ia-continuum-wp-1-2-fc5653","Cited as online channel merchant."
"amberpoint","AmberPoint","company","SOA Governance Software","acquired","Oracle Corporation (2010)","2001-2010","hp-can-boost-soa-offerings-with-acquisit-48e07e","Listed as competitor in governance and compliance for SOA."
"amd","AMD","company","Semiconductor","active","","1969-present","2010-intel-ia-continuum-wp-1-2-fc5653","Intel settled major dispute with AMD prior to FTC antitrust suit."
"apc","APC (American Power Conversion)","company","Power / Storage Accessories","acquired","Schneider Electric (acquired 2007)","1981-present","snap-appliances-snapshot-10-15pk-f183fe","Software partnership with Snap Appliance"
"apple","Apple","company","Consumer Electronics / Software","active","","1976-present","2010-intel-ia-continuum-wp-1-2-fc5653","iPhone and iPad cited as driving competitive feeding frenzy in mobile."
"ariba","Ariba","company","Enterprise Software / e-Procurement","acquired","SAP (acquired 2012)","1996-present","oracleroiwhitepaperprod-7023c3","e-Procurement point solution vendor; partnered with i2 and IBM in million-dollar ad campaign, dissolved in under 6 months; cited as example of fragile best-of-breed partnerships."
"arthur-andersen","Arthur Andersen","firm","Accounting / Audit","defunct","N/A (dissolved 2002)","1913-2002","amd-profile01-64e43b","Provided attestation letter for AMD's benchmark methodology; dissolved after Enron scandal"
"avnet","Avnet","company","Electronics Distribution","active","","1921-present","goremote-profile-5-2a-8fa814","GoRemote enterprise customer cited."
"axcelerant","Axcelerant","company","Managed Network Services","unknown","","1990s-2003","goremote-profile-5-2a-8fa814","Acquired by GoRemote late 2003; specialized in broadband fixed-location services for teleworkers and branch offices; Global 5000 track record."
"baan","Baan","company","Enterprise Software / ERP","acquired","Infor (via Invensys then SSA GT then Infor)","1978-2003","oracleroiwhitepaperprod-7023c3","Major ERP vendor cited among integrated suite providers; later acquired by SSA Global."
"bapco","Business Applications Performance Corporation (BAPCo)","institution","Benchmark Standards","active","","1991-present","amd-profile01-64e43b","Keeper of SYSmark benchmark; AMD failed to file results as required"
"baragwanath-hospital","Baragwanath Hospital","institution","Healthcare","renamed","Chris Hani Baragwanath Academic Hospital (renamed 1997; official full name added 'Academic' designation)","unknown [REVIEW]","auditor-report-4-43ad9b","Cited as world's largest hospital (Johannesburg, South Africa); 3,200 beds in 1999, using 2,600 in 2004"
"bea-systems","BEA Systems","company","Enterprise Middleware / Java Application Server","acquired","Oracle Corporation (2008)","1995-2008","hp-can-boost-soa-offerings-with-acquisit-48e07e","Mercury had a relationship with BEA; Aberdeen suggests HP could leverage this to further compete with IBM."
"beneficial-life","Beneficial Life","company","Insurance / Financial Services","renamed","Beneficial Financial Group (renamed June 2004; stopped writing new policies August 2009)","unknown [REVIEW]","oracleroiwhitepaperprod-7023c3","Oracle Applications customer; large company with legacy homegrown software; more than 50% of IT staff involved in new product customization and integration."
"best-buy","Best Buy","company","Consumer Electronics Retail","active","","1966-present","iha-full-report---draft-jul-28-41de81","Cited by focus group respondents as expected retail outlet for SD Memory Cards."
"bmc-software","BMC Software","company","Enterprise Software / Systems Management","active","","1980-present","hp-can-boost-soa-offerings-with-acquisit-48e07e","Competitor to HP-Mercury in enterprise systems management."
"british-petroleum","British Petroleum (BP)","company","Energy / Oil & Gas","renamed","BP p.l.c. (rebranded as 'BP' in 2001)","1909-present","intelitaniummfewp1[1]-773ea2","Named as major user implementing Itanium in 2003"
"broadcom","Broadcom Corporation","company","Semiconductors","acquired","Broadcom Inc. (Avago Technologies acquired Broadcom Corporation for $37B in 2016; combined entity took Broadcom name)","1991-present","sars2-hot-topic-cf91d4","Named as semiconductor firm maintaining applications engineers in Asia-Pacific region facing SARS disruption"
"broadvision","BroadVision","company","Enterprise Software / CRM","active","","1993-present","oracleroiwhitepaperprod-7023c3","CRM/e-commerce point solution vendor cited as 'Best of Breed' example alongside Siebel."
"brocade","Brocade","company","Networking / Storage","acquired","Broadcom Limited (acquired November 17, 2017); data center networking business also sold to Extreme Networks (October 2017)","1995-present","2004-05dell-storage-profile-editpk-05170-3c00b1","SAN switch partner for Dell AX100 solution."
"ca-technologies","CA Technologies (CA)","company","Enterprise Software / Systems Management","acquired","Broadcom Inc. (2018)","1976-present","hp-can-boost-soa-offerings-with-acquisit-48e07e","Competitor to HP-Mercury in both governance/compliance and enterprise systems management."
"china-telecom","China Telecom","company","Telecommunications","active","","1994-present","goremote-profile-5-2a-8fa814","One of 300+ telecom service providers in GoRemote TierOne network."
"christopher-stevens","Christopher Stevens","person","Market Research / IT Consulting","unknown","","1990s","1996-electronic-commerce-25d31b","Research Analyst at Aberdeen; co-author; focused on Internet payments and B2C EC."
"cirrus-logic","Cirrus Logic","company","Semiconductors","active","","1984-present","sars2-hot-topic-cf91d4","Named as semiconductor firm maintaining applications engineers in Asia-Pacific region"
"cisco","Cisco","company","Networking","active","","1984-present","2001-hp-compaq-kastner-insight1-d6dc38","Technology partner for high-availability solutions."
"citrix","Citrix Systems","company","Enterprise Software / Virtualization","acquired","Cloud Software Group (Vista Equity Partners + Elliott Management, 2022)","1989-present","intel-2010-vpro-daily-globe-42697e","vPro ecosystem software/services partner."
"commerce-one","Commerce One","company","Enterprise Software / e-Procurement","dissolved","","1994-2004","oracleroiwhitepaperprod-7023c3","e-Procurement point solution vendor cited alongside Ariba as 'Best of Breed' example."
"commvault","CommVault Systems","company","Storage Software","active","","1988-present","2004-05dell-storage-profile-editpk-05170-3c00b1","CommVault Galaxy added to Dell backup/recovery software portfolio."
"compal-electronics","Compal Electronics","company","Electronics Manufacturing / ODM","active","","1984-present","sars2-hot-topic-cf91d4","Major manufacturer of laptops for Dell and HP; barred employees from Hong Kong and PRC due to SARS"
"compaq","Compaq","company","Enterprise IT Hardware","acquired","Hewlett-Packard (2002)","1982-2002","2001-hp-compaq-kastner-insight1-d6dc38","Target of the proposed HP merger; strong in storage (VAX heritage) and Intel servers."
"compusa","CompUSA","company","Consumer Electronics Retail","dissolved","Gordon Brothers Group (liquidated 2007–2008); brand/16 stores sold to Systemax/TigerDirect","1984-2012","intelitaniummfewp1[1]-773ea2","Named as major Itanium user in 2003"
"computer-associates","Computer Associates (CA)","company","Enterprise Software","acquired","Broadcom Inc. (acquired November 2018, renamed CA Technologies)","1976-present","snap-appliances-snapshot-10-15pk-f183fe","Software partnership with Snap Appliance"
"computerworld","Computerworld","institution","Technology Media","renamed","Part of IDG/Foundry (IDG acquired by Blackstone 2017; digital brand continues under Foundry/IDG Communications)","1967-present","computerworld-ilm-article-15f604","Publication venue for this ILM advisory article"
"compuware","Compuware","company","Enterprise Software / APM","acquired","Thoma Bravo (2014); Dynatrace spun off as separate public company","1973-present","hp-can-boost-soa-offerings-with-acquisit-48e07e","Listed as competitor in governance and compliance."
"conexant","Conexant Systems","company","Semiconductors","acquired","Synaptics (acquired July 2017)","1999-present","sars2-hot-topic-cf91d4","Named as semiconductor firm maintaining applications engineers in Asia-Pacific region"
"ctic","CTIC (Taiwan construction company)","company","Construction / Taiwan","active","","unknown [REVIEW]","sars2-hot-topic-cf91d4","Six employees returned from Beijing via Hong Kong with SARS; prompted corporate shutdown"
"david-hill","David Hill","person","Market Research / IT Consulting","unknown","","2000s","2004-05dell-storage-profile-editpk-05170-3c00b1","Co-author; Aberdeen Storage and Storage Management Practice."
"dell","Dell","company","Enterprise IT Hardware","active","Dell Technologies (renamed after EMC acquisition 2016)","1984-present","2001-hp-compaq-kastner-insight1-d6dc38","Named as key competitive beneficiary if HP-Compaq merger falters."
"dell-computer-corp","Dell Computer Corp.","company","Information technology / hardware manufacturing","renamed","Dell Inc., then Dell Technologies","1984-present","dell-ars-white-paper-prod-7-11m-c60434","Subject and sponsor of white paper; provider of Asset Recovery Services (ARS)"
"dick-csaplar","Dick Csaplar","person","Market Research / IT Consulting","unknown","","2000s-2010s","desktop-virtualization-roi---aberdeen-8fa168","Senior Research Analyst, Virtualization and Storage Practice at Aberdeen Group; author of this report."
"dovebid-viant","Dovebid/Viant","company","Asset disposition / consulting","acquired","GoIndustry DoveBid (combined entity); acquired by Liquidity Services Inc. (completed September 2011)","unknown [REVIEW]","dell-ars-white-paper-prod-7-11m-c60434","Cited in connection with data breach from improperly wiped drives; possibly two entities conflated"
"eclipsys-corp","Eclipsys Corp.","company","Healthcare information technology","acquired","Allscripts Healthcare Solutions (merged 2010, $1.3B all-stock deal)","unknown [REVIEW]","auditor-report-4-43ad9b","Client; maker of SunriseXA clinical information system; benchmark conducted at Eclipsys offices in Malvern, PA"
"elpida-memory","Elpida Memory","company","Semiconductors","acquired","Micron Technology (acquired July 2013)","1999-2012","sars2-hot-topic-cf91d4","Named (as Elipda) as external firm with production commitment to new PRC 8-inch semiconductor plants; joint venture NEC/Hitachi DRAM"
"emc","EMC Corporation","company","Enterprise Storage","acquired","Dell Technologies (Dell acquired EMC 2016; merged as Dell EMC)","1979-2016","2004-05dell-storage-profile-editpk-05170-3c00b1","Dell's key storage partner; Dell|EMC CX product family co-developed."
"emulex","Emulex","company","Storage Networking","acquired","Avago Technologies (acquired 2015; Avago subsequently merged with Broadcom)","1979-2015","intel-infiband-wp--edit-psk-5-22f-a2c551","IBA HCA adapter vendor."
"eric-kelly","Eric Kelly","person","Storage / Enterprise IT","active","","2000s","snap-appliances-snapshot-10-15pk-f183fe","President and CEO of Snap Appliance"
"fastclick","Fastclick, Inc.","company","Online Advertising / Ad Network","acquired","ValueClick (acquired September 2005)","2000-2000s","mirror-image-profile-v2-(050404)-e7eb95","Mirror Image customer; delivering 5 billion ad impressions/month in late 2003; CTO Steve Chang quoted."
"fclc","Fibre Channel Loop Committee (FCLC)","institution","Standards Body / Storage","dissolved","Standards work absorbed into INCITS T11 / Fibre Channel Industry Association (FCIA)","1990s-2000s","2004-05dell-storage-profile-editpk-05170-3c00b1","Standards body Dell participates in for Fibre Channel."
"france-telecom","France Telecom","company","Telecommunications","renamed","Orange S.A. (2013)","1991-present","goremote-profile-5-2a-8fa814","One of 300+ telecom service providers in GoRemote TierOne network."
"goremote-communications","GoRemote Communications, Inc.","company","Managed Remote Access / Telecom Services","acquired","iPass Inc. (2006)","1994-2000s","goremote-profile-5-2a-8fa814","NASDAQ: GRIC; managed communications services for remote/mobile knowledge workers; TierOne global network; acquired Axcelerant late 2003."
"hand-held-entertainment","Hand Held Entertainment (ZVUE)","company","Consumer Electronics","dissolved","ZVUE Corp (renamed); company ceased operations circa 2009–2010 after financial losses","2003-present","dct-oct.-4-hot-topic-b61c0d","Founded Feb 2003; maker of ZVUE pocket video/music player"
"harte-hanks","Harte-Hanks","company","Marketing Services","active","","1923-present","desktop-virtualization-roi---aberdeen-8fa168","Parent company of Aberdeen Group in 2011; direct marketing and research conglomerate."
"hewlett-packard","Hewlett-Packard (HP)","company","Enterprise IT Hardware/Services","renamed","Split into HP Inc. and Hewlett Packard Enterprise (November 2015)","1939-present","2001-hp-compaq-kastner-insight1-d6dc38","Acquirer in the proposed merger; known for printers and enterprise servers."
"i2-technologies","i2 Technologies","company","Enterprise Software / SCM","acquired","JDA Software (acquired 2010)","1988-2010","oracleroiwhitepaperprod-7023c3","Supply Chain Management point solution vendor; one of three systems in Nike's failed $400M integration; also cited as 'best of breed' SCM example."
"ibm","IBM","company","Enterprise IT Hardware/Services","active","","1911-present","2001-hp-compaq-kastner-insight1-d6dc38","Named as competitive beneficiary; IBM Global Services cited as comparison for combined HP services."
"ibm-global-services","IBM Global Services","company","IT Services / Outsourcing","active","","1991-present","outsourcing-application-development-and--59d651","Underwriter of this report; one of world's largest IT services and consulting providers; covers full lifecycle of development, management, maintenance, support, governance for legacy/package/custom apps."
"ibm-rational","IBM Rational","company","Software Development Tools","active","","1994-present","hp-can-boost-soa-offerings-with-acquisit-48e07e","IBM development tools subsidiary; competitor in governance/compliance."
"ibm-tivoli","IBM Tivoli","company","Enterprise Systems Management","active","","1996-present","hp-can-boost-soa-offerings-with-acquisit-48e07e","Major ESM competitor to HP OpenView; cited as powerhouse HP needs to challenge."
"ibm-zseries","IBM zSeries (z990)","company","Enterprise Computing / Mainframe","active","","2000s","perspective-041304-e4be4c","IBM mainframe platform; primary comparison target for Itanium; IBM increasingly discounting mainframe prices to retain customers as Intel alternatives improve."
"indian-motorcycle","Indian Motorcycle","company","Manufacturing / Consumer Goods","active","","1901-present","oracleroiwhitepaperprod-7023c3","Mid-market Oracle Applications customer; implemented full Oracle suite in 1999; reported ROI achieved within one year of going live."
"infineon","Infineon Technologies","company","Semiconductors","active","","1999-present","sars2-hot-topic-cf91d4","Named as external firm with production commitment to new PRC semiconductor plants"
"infiniband-trade-association","InfiniBand Trade Association (IBTA)","institution","Technology Standards","active","","2000-present","intel-infiband-wp--edit-psk-5-22f-a2c551","Standards body formed to maintain InfiniBand specification; steering committee includes major vendors."
"infinicon","InfiniCon Systems","company","Storage Networking / IBA","dissolved","","2000s","intel-infiband-wp--edit-psk-5-22f-a2c551","IBA switching/routing hardware vendor bridging SCSI/FC to IBA."
"infiniswitch","InfiniSwitch","company","High-Performance Networking","dissolved","","2000s","intel-infiband-wp--edit-psk-5-22f-a2c551","IBA switch vendor."
"infor","Infor","company","Enterprise Software","active","","2002-present","ibm-+-webify-=-industry-soa-application--97733a","ERP vendor cited alongside SAP, Oracle, Lawson as incumbent ERP players that IBM-Webify would complement/compete with."
"intel","Intel Corporation","company","Semiconductor","active","","1968-present","2010-intel-ia-continuum-wp-1-2-fc5653","Subject of white paper; IA Continuum strategy analyzed."
"internet-home-alliance","Internet Home Alliance (IHA)","institution","Consumer Electronics / Trade Association","dissolved","","2000s","iha-full-report---draft-jul-28-41de81","Trade association of companies involved in digital home electronics; commissioned this SD Memory Card consumer adoption study. Also included a home electronics retailer distributing memory cards nationally."
"jd-edwards","JD Edwards","company","Enterprise Software / ERP","acquired","Oracle (PeopleSoft acquired JD Edwards in 2003; Oracle acquired PeopleSoft in 2005)","1977-2003","oracleroiwhitepaperprod-7023c3","ERP suite vendor cited among integrated suite providers; acquired by PeopleSoft in 2003."
"jillian-mansolf","Jillian Mansolf","person","Storage / Enterprise IT","unknown","","2000s","snap-appliances-snapshot-10-15pk-f183fe","VP Worldwide Sales and Channel Marketing at Snap Appliance"
"jim-hurley","Jim Hurley","person","Market Research / IT Consulting","unknown","","2000s","intel-consumer-lt-10-5-03-580af7","Aberdeen Group VP of Security Practice; co-proposer with Kastner for consumer LT research."
"lawson-software","Lawson Software","company","Enterprise Software","acquired","Infor (via Golden Gate Capital, 2011)","1975-2012","ibm-+-webify-=-industry-soa-application--97733a","ERP vendor cited alongside SAP, Oracle, Infor as incumbent players."
"legato","Legato Systems","company","Storage Software","acquired","EMC Corporation (acquired October 2003; operated as Legato Software division of EMC)","1988-2003","2004-05dell-storage-profile-editpk-05170-3c00b1","Backup/recovery software partner; Legato Networker featured."
"lenovo","Lenovo","company","Enterprise IT Hardware","active","","1984-present","intel-2010-vpro-daily-globe-42697e","OEM shipping ThinkPad T series, W510, ThinkCentre M90 with vPro."
"level-3","Level 3 Communications","company","Telecommunications","merged","Lumen Technologies (via CenturyLink merger, 2017)","1998-present","goremote-profile-5-2a-8fa814","One of 300+ telecom service providers in GoRemote TierOne network."
"lockheed-martin","Lockheed Martin","company","Defense / Aerospace","active","","1995-present","goremote-profile-5-2a-8fa814","GoRemote enterprise customer cited."
"manugistics","Manugistics","company","Enterprise Software / SCM","acquired","JDA Software (acquired 2006)","1969-2006","oracleroiwhitepaperprod-7023c3","SCM point solution vendor cited alongside i2 as 'Best of Breed' example."
"mark-pollard","Mark Pollard","person","Storage / Enterprise IT","active","","2000s","snap-appliances-snapshot-10-15pk-f183fe","VP Marketing and Business Development at Snap Appliance"
"marshall-mcluhan","Marshall McLuhan","person","Academic / Media Theory","deceased","","1950s-1980s","webex--taking-conferencing-to-the-busine-5b8109","Canadian media guru cited: 'The media is the message'; used to position WebEx as media-rich communications platform."
"matsushita","Matsushita","company","Consumer Electronics","renamed","Panasonic Corporation (2008)","1918-present","goremote-profile-5-2a-8fa814","GoRemote enterprise customer cited; parent company of Panasonic."
"mci","MCI","company","Telecommunications","acquired","Verizon Communications (2006)","1963-2006","goremote-profile-5-2a-8fa814","One of 300+ telecom service providers in GoRemote TierOne network."
"mellanox-technologies","Mellanox Technologies","company","Semiconductor / High-Performance Networking","acquired","NVIDIA (acquired April 2020)","1999-present","intel-infiband-wp--edit-psk-5-22f-a2c551","Source of Figure 3 (Blade Server Rack With Integral InfiniBand Switch); IBA silicon provider."
"memorial-hermann-healthcare-system","Memorial Hermann Healthcare System","institution","Healthcare","active","","unknown [REVIEW]","auditor-report-4-43ad9b","Cited as real-world size reference: 3,179 operating beds in 11 hospitals in Houston; benchmark simulates larger 6,000-bed hospital"
"mercury-interactive","Mercury Interactive (LoadRunner)","company","Software / performance testing","acquired","Hewlett-Packard (acquired November 2006, $4.5B); became HP Software division","unknown [REVIEW]","auditor-report-4-43ad9b","Maker of Mercury LoadRunner, the load simulation tool used in the benchmark"
"meridian-data","Meridian Data","company","Storage / NAS","acquired","Quantum Corporation (acquired 1999); spun off as Snap Appliance (2002)","1994-2000","snap-appliances-snapshot-10-15pk-f183fe","Original company that launched first Snap Servers in 1998; acquired by Quantum in 2000"
"michael-ferron-jones","Michael Ferron-Jones","person","Semiconductor","unknown","","2000s","intel-consumer-lt-10-5-03-580af7","Desktop Platform Analyst Relations, Intel Corporation; former LT Platform Marketing Manager; letter recipient."
"michael-porter","Michael Porter","person","Academic / Business Strategy","active","","1970s-present","oracleroiwhitepaperprod-7023c3","Harvard Business School professor; cited for 'Strategy and the Internet' (HBR March 2001) arguing that best-of-breed applications cannot deliver durable competitive advantage."
"microfocus","Micro Focus International","company","Enterprise Software / COBOL","acquired","OpenText (acquired January 2023)","1976-present","intelitaniummfewp1[1]-773ea2","COBOL migration tool vendor; Microfocus COBOL allowed porting of mainframe programs to Wintel without recompilation"
"microsoft","Microsoft","company","Enterprise Software / OS","active","","1975-present","2001-hp-compaq-kastner-insight1-d6dc38","Technology partner for Windows-based enterprise solutions."
"mirror-image-internet","Mirror Image Internet, Inc.","company","Internet Infrastructure / CDN","dissolved","","1997-present","mirror-image-profile-v2-(050404)-e7eb95","Subject of vendor profile; wholly owned subsidiary of Xcelera.com (Amex: XLA); headquartered in Woburn, MA; 75 employees as of 2004."
"motorola","Motorola","company","Electronics / Semiconductors / Mobile","reorganized","Motorola Solutions (active) + Motorola Mobility (acquired by Google 2012, sold to Lenovo 2014)","1928-present","sars2-hot-topic-cf91d4","Temporarily closed cell phone manufacturing facility in Singapore after 305 workers quarantined for SARS exposure"
"narendar-sahgal","Narendar Sahgal","person","Semiconductor","unknown","","2000s","intel-consumer-lt-10-5-03-580af7","Intel executive; discussed consumer LT concepts with Kastner at IDF in September 2003."
"national-semiconductor","National Semiconductor","company","Semiconductors","acquired","Texas Instruments (acquired 2011)","1959-2011","sars2-hot-topic-cf91d4","Named as semiconductor firm maintaining applications engineers in Asia-Pacific region"
"nec","NEC Corporation","company","Electronics / Computing","active","","1899-present","dct-oct.-4-hot-topic-b61c0d","Announced fuel-cell laptop prototype at WPC Expo Tokyo September 2003"
"new-york-presbyterian","New York Presbyterian","institution","Healthcare","active","","unknown [REVIEW]","auditor-report-4-43ad9b","Cited as size reference: largest hospital in NYC at 2,400 beds"
"newegg","Newegg.com","company","E-Commerce / Technology Retail","active","","2001-present","2010-intel-ia-continuum-wp-1-2-fc5653","Cited as online channel merchant selling Intel products."
"nielsen","Nielsen (Nielsen Families)","institution","Market Research / Consumer Research","reorganized","NIQ (NielsenIQ / NIQ Global Intelligence plc)","1923-present","technology-themes-ee5ba4","Referenced as example of traditional survey-based consumer research being superseded by real-time web click tracking."
"nike","Nike","company","Consumer Goods / Apparel","active","","1964-present","oracleroiwhitepaperprod-7023c3","Cited as cautionary tale: 4-year $400M integration of SAP, Siebel, and i2 resulted in missed quarterly earnings; problems from integrating disparate point solutions with supply chain."
"nokia","Nokia","company","Mobile / Consumer Electronics","active","","1865-present","2010-intel-ia-continuum-wp-1-2-fc5653","Nokia Meego Linux merged with Intel Moblin; announced February 2010."
