tech_id,tech_name,category,vendor,era,lifecycle_at_study,lifecycle_current,study_id,notes
100base-t,100Base-T (Fast Ethernet),protocol,IEEE,1995-2010,emerging,legacy-supported,aberdeen-1996-hp-networking-vision-workgroups,Competing fast Ethernet standard; won market over 100VG
100vg,100VG-AnyLAN,protocol,HP/IEEE,1994-2000,emerging,obsolete,aberdeen-1996-hp-networking-vision-workgroups,HP-backed fast Ethernet standard; scalable 10/100 Mbps; lost to 100Base-T
10base-t,10Base-T Ethernet,protocol,IEEE,1990-2000,mature,obsolete,aberdeen-1996-hp-networking-vision-workgroups,HP early leader in 10Base-T stackable hubs; 10 Mbps optimal speed
3270-terminal-emulation,IBM 3270 Terminal Emulation,application,IBM / various,1971-present,mature,legacy-supported,aberdeen-1995-digital-multia,Pre-configured on Multia for IBM mainframe access; provided via Rumba (Wall Data) and Kea! (Attachmate)
3com-accessbuilder,3Com AccessBuilder Family,platform,3Com,1994-2000,mature,obsolete,aberdeen-1997-3com-accelerates-remote-access-market,From Centrum Communications acquisition; high-end remote access servers
3com-impact-isdn,3Com Impact ISDN Modems/Adapters,platform,3Com,1995-2001,mature,obsolete,aberdeen-1997-3com-accelerates-remote-access-market,Individual remote user segment; ISDN terminal adapters
3com-netbuilder,3Com NetBuilder Family,platform,3Com,1994-2000,mature,obsolete,aberdeen-1997-3com-accelerates-remote-access-market,WAN router family; discontinued June 2000 when 3Com exited enterprise
3d-vr-interface,Unicenter TNG 3D / Virtual Reality Interface,application,Computer Associates,1996-2005,emerging,obsolete,1997-ca-s-unicenter-tng-framework-pk-apr-50d15f,Kastner describes 3D mapping as 'animation and elements of virtual reality to create realistic floor plans indicating location of devices within the building'; considered breakthrough enterprise management UI in 1997.
3space-viewer,3Space Viewer,application,Template Graphics Software,1994-2000s,emerging,obsolete,aberdeen-1996-digitals-personal-workstation-new-markets-channels,Included with all Personal Workstations; allowed 3D models from Unix CAD apps to be imported into Microsoft Office via OLE 2.0
56k-modem,56K Modem Technology (x2 / K56flex / V.90),protocol,multiple,1996-2004,emerging,obsolete,1997-bay-networks--concentrating-on-remo-06bdd8,Competing standards x2 (3Com/US Robotics) and K56flex (Rockwell) were unified by ITU V.90 standard ratified September 1998. All dial-up modem tech obsolete post-broadband.
64-bit-unix,64-bit Unix Operating Environment,platform,Multiple,1995-2010,emerging,active,aberdeen-1996-risc-unix-market,HP promised 64-bit systems in Q2 1996; IBM not until 1998; all major suppliers except IBM expected to move to 64-bit in 1996; NT not expected to follow for at least 4 more years
ACA_SERVICES,ACA Services,,,,,,aberdeen-1995-digital-objectbroker,
AMSOFTWARE-SCP,American Software Supply Chain Planning,supply chain software,American Software,mid-1990s,growth,legacy,aberdeen-1996-advanced-planning-engines-white-paper,"Supply Chain Planning, Visual Planning Workstation, Flow Manufacturing suite. Still active as Logility."
APET,Advanced Planning Engine Technologies (APET),planning software,multiple,mid-1990s,growth,mature,aberdeen-1996-advanced-planning-engines-white-paper,Aberdeen's term for constraint-based planning/scheduling systems; evolved into modern APS (Advanced Planning and Scheduling) and S&OP software.
APP-SERVER,Web-Server-to-Application-Server Architecture,application architecture,multiple,mid-1990s,emerging,mature,aberdeen-1996-3com-reconciling-clientserver-development-internet,"Aberdeen notes trend away from CGI toward app-server partitioning; this became the dominant n-tier architecture (WebSphere, IIS, Tomcat)."
AS400,IBM AS/400,midrange computing,IBM,late-1980s to 1990s,mature,legacy,aberdeen-1996-as400-year-2000-ibm-leading-users,"IBM midrange platform; rebranded iSeries (2000), System i (2006), IBM Power Systems (2008). Still active as IBM i on Power."
CGI,Common Gateway Interface (CGI),web technology,multiple,mid-1990s,growth,legacy,aberdeen-1996-3com-reconciling-clientserver-development-internet,Aberdeen notes suppliers moving away from CGI toward web-server-to-application-server partitioning; confirmed by Apache/IIS app servers.
CLIENT-SERVER,Client/Server Computing Paradigm,computing paradigm,multiple,early-to-mid 1990s,mature,legacy,aberdeen-1996-3com-reconciling-clientserver-development-internet,Two-tier application model dominant in early 1990s; Aberdeen argues this should be evolved rather than abandoned.
CLIENT-SERVER-APET,Client/Server APET Architecture,technology architecture,multiple,mid-1990s,growth,legacy,aberdeen-1996-advanced-planning-engines-white-paper,APET systems deployed as client/server using Windows PCs and UNIX servers with RDBMS backends.
COGNOS-POWERPLAY,Cognos PowerPlay 4.1,decision support / OLAP,Cognos,mid-1990s,mature,legacy,aberdeen-1996-app-dun-bradstreet-software-smartstrtogether-better,Used for decision support in SmartStream DE. Cognos acquired by IBM in 2008.
COM,COM (Component Object Model),,,,,,aberdeen-1995-digital-objectbroker,
CORBA,CORBA (Common Object Request Broker Architecture),,,,,,aberdeen-1995-digital-objectbroker,
CPP,C++ Language Binding,,,,,,aberdeen-1995-digital-objectbroker,
CS6400,Cray CS6400 SMP Server,server hardware,Cray Research,mid-1990s,growth,obsolete,aberdeen-1995-rdbms-cray-research-inc,SPARC-based SMP system with 4–64 CPUs; up to 5TB online storage; 1.76 GB/s internal bandwidth. Sold to Sun in 1996; evolved into Sun Enterprise 10000 (Starfire).
DATE-WINDOWING,100-Year Date Window Algorithm,software technique,IBM,mid-1990s,growth,obsolete,aberdeen-1996-as400-year-2000-ibm-leading-users,IBM AS/400 uses fixed 100-year window (1940-2039) to resolve 2-digit year ambiguity; published by IBM for use in new/migrated applications.
DCE,DCE (Distributed Computing Environment),,,,,,aberdeen-1995-digital-objectbroker,
DDE,DDE (Dynamic Data Exchange),,,,,,aberdeen-1995-digital-objectbroker,
DISTRIBUTED-CSS,Distributed Client/Server Architecture,application architecture,D&B Software,mid-1990s,growth,mature,aberdeen-1996-app-dun-bradstreet-software-smartstrtogether-better,SmartStream DE's server-centric two-tier architecture with distributed data via Sybase replication; business logic primarily server-based.
EDI,Electronic Data Interchange (EDI),integration protocol,multiple,mature,mature,legacy,aberdeen-1996-3com-reconciling-clientserver-development-internet,Aberdeen predicts EDI will move to Internet (TCP/IP) over next 5 years from 1996; confirmed — AS2/AS4 and API-based EDI replaced traditional VAN-based EDI.
ENSYNC,FACT Inc. EnSync Family,supply chain software,FACT Inc.,mid-1990s,growth,obsolete,aberdeen-1996-advanced-planning-engines-white-paper,"Client/server APET with Synchronizer, Coordinator, Operator, Optimizer modules."
ERP-CSS,Enterprise Resource Planning (ERP) / CSS,software category,multiple,mid-1990s,growth,mature,aberdeen-1996-app-dun-bradstreet-software-smartstrtogether-better,"Client/server ERP market contested by SAP, Oracle, PeopleSoft, D&B Software, SSA and others in 1996."
GSS_API,GSS-API (Generic Security Services API),,,,,,aberdeen-1995-digital-objectbroker,
IDL,Interface Definition Language (IDL),,,,,,aberdeen-1995-digital-objectbroker,
IML,Implementation Mapping Language (IML),,,,,,aberdeen-1995-digital-objectbroker,
INTRANET,Corporate Intranet,networking,multiple,mid-1990s,emerging,mature,aberdeen-1996-3com-reconciling-clientserver-development-internet,Aberdeen discusses intranet as ideal for pre-defined database queries and HR applications.
JAVA,Java Programming Language,programming language,Sun Microsystems,mid-1990s,emerging,mature,aberdeen-1996-3com-reconciling-clientserver-development-internet,Aberdeen notes Java is limited by language/class library constraints for complex OLTP in 1996; prediction was accurate for the era.
MAINFRAME,IBM Mainframe (zSeries predecessors),mainframe computing,IBM,mature,mature,legacy,aberdeen-1996-as400-year-2000-ibm-leading-users,Study contrasts AS/400 Y2K approach with mainframe environments; mainframes faced similar Y2K challenges.
MANU-SUITE,Manugistics Planning Suite,supply chain software,Manugistics,mid-1990s,growth,obsolete,aberdeen-1996-advanced-planning-engines-white-paper,"Integrated demand planning, manufacturing planning, transportation planning, distribution planning. Acquired by JDA 2006."
MILLENNIUM-SERIES,D&B Software Millennium (M) Series,mainframe software,D&B Software,legacy,legacy,obsolete,aberdeen-1996-app-dun-bradstreet-software-smartstrtogether-better,Legacy mainframe application suite; D&B Software committed to supporting as long as customer demand exists. 80%+ maintenance renewal rate.
MML,Method Mapping Language (MML),,,,,,aberdeen-1995-digital-objectbroker,
MRP,Material Requirements Planning (MRP),manufacturing planning,multiple,1970s-mature,mature,legacy,aberdeen-1996-advanced-planning-engines-white-paper,First-generation manufacturing planning; criticized for infinite capacity assumptions and inability to optimize. APET positioned as successor.
MRP2,Manufacturing Resource Planning (MRP II),manufacturing planning,multiple,1980s,mature,legacy,aberdeen-1996-advanced-planning-engines-white-paper,Second-generation MRP; APET positioned to replace MRP II modules for master scheduling and capacity planning.
MS-ACCESS,Microsoft Access 2.0,desktop database,Microsoft,mid-1990s,mature,legacy,aberdeen-1996-app-dun-bradstreet-software-smartstrtogether-better,Used for query and reporting in SmartStream DE.
MS-SQL-65,Microsoft SQL Server 6.5,RDBMS,Microsoft,mid-1990s,current,obsolete,aberdeen-1996-app-dun-bradstreet-software-smartstrtogether-better,Co-primary RDBMS for SmartStream DE; SQL Server 6.5 released 1995.
NAS,NAS (Network Application Support),,,,,,aberdeen-1995-digital-objectbroker,
NUMETRIX-SOL,Numetrix Solution Family,supply chain software,Numetrix,mid-1990s,growth,obsolete,aberdeen-1996-advanced-planning-engines-white-paper,"Five modules including Linx, Planx, Schedulex, SCI/SCV, 3D (Dynamic Deployment & Distribution)."
OBJECT-ORIENTED,Object-Oriented Design,software development,multiple,mid-1990s,growth,mature,aberdeen-1996-advanced-planning-engines-white-paper,Many APET products designed using OO technology for improved usability and flexibility.
OBJECTBROKER,Digital ObjectBroker,,,,,,aberdeen-1995-digital-objectbroker,
OBJECTPLUS,ObjectPlus,,,,,,aberdeen-1995-digital-objectbroker,
OLAP,Online Analytical Processing (OLAP),database / analytics,multiple,mid-1990s,growth,mature,aberdeen-1996-3com-reconciling-clientserver-development-internet,Cited as best suited for client/server not browser model; confirmed — complex OLAP stayed thick-client until modern SaaS BI.
OLE,OLE (Object Linking and Embedding),,,,,,aberdeen-1995-digital-objectbroker,
OLTP,Online Transaction Processing (OLTP),database,multiple,mature,mature,mature,aberdeen-1996-3com-reconciling-clientserver-development-internet,Complex OLTP cited as unsuitable for browser/web-server in 1996; still mostly server-side today.
OPENVMS,OpenVMS,,,,,,aberdeen-1995-digital-objectbroker,
ORB,Object Request Broker (ORB),,,,,,aberdeen-1995-digital-objectbroker,
OS400V3,OS/400 Version 3,operating system,IBM,mid-1990s,current,legacy,aberdeen-1996-as400-year-2000-ibm-leading-users,Latest OS/400 release at time of study; declared Year 2000 safe by IBM. OS/400 eventually became IBM i.
PARADIGM_PLUS,Paradigm Plus,,,,,,aberdeen-1995-digital-objectbroker,
POWERBUILDER,PowerBuilder,,,,,,aberdeen-1995-digital-objectbroker; aberdeen-1996-app-dun-bradstreet-software-smartstrtogether-better,
RDBMS-PARALLEL,Parallel RDBMS (Oracle, Informix, Sybase),database software,multiple,mid-1990s,growth,mature
RESPONSEAGENT,Red Pepper ResponseAgent,supply chain software,Red Pepper Software,mid-1990s,growth,obsolete,aberdeen-1996-advanced-planning-engines-white-paper,Agent-based APET using in-memory optimization; acquired by PeopleSoft 1996 for $225M; became foundation of PeopleSoft Manufacturing module.
RHYTHM-I2,i2 Technologies Rhythm Family,supply chain software,i2 Technologies,mid-1990s,growth,obsolete,aberdeen-1996-advanced-planning-engines-white-paper,"i2's flagship APET product line including Master Planner, Factory Planner, Distribution Planner, Scheduler, Forecast Planner. Acquired by JDA 2010."
SMARTSTREAM-DE,SmartStream Distributed Enterprise v4.0,ERP software,D&B Software,mid-1990s,growth,obsolete,aberdeen-1996-app-dun-bradstreet-software-smartstrtogether-better,"Full suite of line-of-business CSS for finance, manufacturing/distribution, procurement, HR, decision support. v4.0 based on Sybase 11.1, MS SQL Server 6.5, PowerBuilder 4.02, PowerPlay 4.1, MS Access 2.0. Abandoned by Geac after 1998 acquisition."
SMP,Symmetric Multiprocessing,computing paradigm,multiple,mid-1990s,growth,mature,aberdeen-1995-rdbms-cray-research-inc,SMP scaling to 64 CPUs was the key architecture for high-end RDBMS workloads; succeeded by NUMA and cloud scale-out architectures.
SOLARIS-CX,Cray-Enhanced Solaris OS,operating system,Cray Research / Sun,mid-1990s,growth,obsolete,aberdeen-1995-rdbms-cray-research-inc,"Sun Solaris UNIX 5.4 enhanced with processor partitioning, memory management, and hot-swap RAS features for enterprise workloads."
SPARC,Sun SPARC Architecture,processor architecture,Sun Microsystems,mid-1990s,mature,legacy,aberdeen-1995-rdbms-cray-research-inc,"RISC processor architecture; Cray CS6400 was binary-compatible with Sun SPARC, enabling access to 10000+ ISV applications."
SUPPLY-CHAIN-MGMT,Supply Chain Management (SCM),business category,multiple,mid-1990s,emerging,mature,aberdeen-1996-advanced-planning-engines-white-paper,The broader category that APET belongs to; became standard enterprise software category by late 1990s.
SYBASE-REPSERVER,Sybase Replication Server,RDBMS / replication,Sybase,mid-1990s,growth,obsolete,aberdeen-1996-app-dun-bradstreet-software-smartstrtogether-better,Used by SmartStream DE to propagate security and business process tables across distributed locations.
SYBASE-SQL11,Sybase System 11.1,RDBMS,Sybase,mid-1990s,current,obsolete,aberdeen-1996-app-dun-bradstreet-software-smartstrtogether-better,Underlying RDBMS for SmartStream DE v4.0; stored procedures and triggers central to architecture.
SYSTEM3X,IBM System/3X (System/36, System/38),legacy midrange,IBM,1969-1988,legacy,obsolete,aberdeen-1996-as400-year-2000-ibm-leading-users
T3D,Cray T3D Massively Parallel Processor,server hardware,Cray Research,mid-1990s,growth,obsolete,aberdeen-1995-rdbms-cray-research-inc,MPP system using DEC Alpha chipset; for scientific workloads >5TB. Later evolved into T3E under SGI ownership.
TECH-001,RISC/Unix Server,Server Platform,Multiple,1990s,mainstream,legacy,1997-commercial-risc-unix-1996-mvp-711569; 1997-data-integration-management-in-hete-de2429; 1997-data-mining-buying-guide-71e463; 1997-datafocus'-nutcracker--enterprise-c-bfc11e; 1997-dec-linkworks-webworker---an-object-db2d2a,Commercial RISC/Unix market peaked mid-2000s; replaced by x86-64 Linux servers
TECH-002,HP PA-8000 (PA-RISC),Processor,Hewlett-Packard,1996,emerging,discontinued,1997-commercial-risc-unix-1996-mvp-711569; 1997-data-integration-management-in-hete-de2429; 1997-data-mining-buying-guide-71e463; 1997-datafocus'-nutcracker--enterprise-c-bfc11e; 1997-dec-linkworks-webworker---an-object-db2d2a,PA-8000 launched 1996; PA-RISC line ended with PA-8900 around 2008; HP moved to Itanium
TECH-003,HP-UX,Operating System,Hewlett-Packard,1984-2025,mainstream,end-of-life,1997-commercial-risc-unix-1996-mvp-711569; 1997-data-integration-management-in-hete-de2429; 1997-data-mining-buying-guide-71e463; 1997-datafocus'-nutcracker--enterprise-c-bfc11e; 1997-dec-linkworks-webworker---an-object-db2d2a,HP-UX reached end of standard support December 31 2025
TECH-004,IBM RS/6000 (PowerPC),Server,IBM,1990s,mainstream,evolved,1997-commercial-risc-unix-1996-mvp-711569; 1997-data-integration-management-in-hete-de2429; 1997-data-mining-buying-guide-71e463; 1997-datafocus'-nutcracker--enterprise-c-bfc11e; 1997-dec-linkworks-webworker---an-object-db2d2a,RS/6000 rebranded as pSeries then IBM Power Systems; IBM Power architecture still active
TECH-005,IBM AIX,Operating System,IBM,1986-present,mainstream,active-niche,1997-commercial-risc-unix-1996-mvp-711569; 1997-data-integration-management-in-hete-de2429; 1997-data-mining-buying-guide-71e463; 1997-datafocus'-nutcracker--enterprise-c-bfc11e; 1997-dec-linkworks-webworker---an-object-db2d2a,AIX remains active on IBM Power Systems as of 2026
TECH-006,Sun UltraSPARC,Processor,Sun Microsystems,1995-2017,emerging,discontinued,1997-commercial-risc-unix-1996-mvp-711569; 1997-data-integration-management-in-hete-de2429; 1997-data-mining-buying-guide-71e463; 1997-datafocus'-nutcracker--enterprise-c-bfc11e; 1997-dec-linkworks-webworker---an-object-db2d2a,SPARC development ended 2017; Fujitsu continued M-series SPARC until ~2022
TECH-007,Solaris,Operating System,Sun Microsystems,1992-present,mainstream,active-niche,1997-commercial-risc-unix-1996-mvp-711569; 1997-data-integration-management-in-hete-de2429; 1997-data-mining-buying-guide-71e463; 1997-datafocus'-nutcracker--enterprise-c-bfc11e; 1997-dec-linkworks-webworker---an-object-db2d2a,Oracle Solaris 11.4 still supported through 2034
TECH-008,Java,Programming Language/Platform,Sun Microsystems,1995-present,emerging,active-dominant,1997-commercial-risc-unix-1996-mvp-711569; 1997-data-integration-management-in-hete-de2429; 1997-data-mining-buying-guide-71e463; 1997-datafocus'-nutcracker--enterprise-c-bfc11e; 1997-dec-linkworks-webworker---an-object-db2d2a,Java became one of most widely used programming languages globally
TECH-009,Intel IA-64 (Itanium),Processor,Intel/HP,1999-2021,pre-release,discontinued,1997-commercial-risc-unix-1996-mvp-711569; 1997-data-integration-management-in-hete-de2429; 1997-data-mining-buying-guide-71e463; 1997-datafocus'-nutcracker--enterprise-c-bfc11e; 1997-dec-linkworks-webworker---an-object-db2d2a,Itanium released 2001; last Itanium processor shipped 2017; Intel discontinued in 2021
TECH-010,Windows NT Server,Operating System,Microsoft,1993-2000,mainstream,evolved,1997-commercial-risc-unix-1996-mvp-711569; 1997-data-integration-management-in-hete-de2429; 1997-data-mining-buying-guide-71e463; 1997-datafocus'-nutcracker--enterprise-c-bfc11e; 1997-dec-linkworks-webworker---an-object-db2d2a,Evolved into Windows 2000 Server and subsequent Windows Server releases
TECH-011,ERP (SAP/Oracle/PeopleSoft/Baan),Enterprise Software,Multiple,1990s,emerging,mainstream,1997-commercial-risc-unix-1996-mvp-711569; 1997-data-integration-management-in-hete-de2429; 1997-datafocus'-nutcracker--enterprise-c-bfc11e; 1997-dec-linkworks-webworker---an-object-db2d2a,ERP on RISC/Unix was key use case; most ERP now runs on Linux/x86
TECH-012,RDBMS (Oracle/Informix/Sybase),Database,Multiple,1990s,mainstream,evolved,1997-commercial-risc-unix-1996-mvp-711569; 1997-data-integration-management-in-hete-de2429; 1997-datafocus'-nutcracker--enterprise-c-bfc11e; 1997-dec-linkworks-webworker---an-object-db2d2a,Relational databases evolved; Oracle dominant; Informix acquired by IBM 2001
TECH-013,NUMA (Non-Uniform Memory Access),Server Architecture,Multiple,1996-present,emerging,mainstream,1997-commercial-risc-unix-1996-mvp-711569; 1997-data-integration-management-in-hete-de2429; 1997-dec-linkworks-webworker---an-object-db2d2a,NUMA became standard in multi-socket x86 and RISC servers
TECH-014,RS/6000 SP (Massively Parallel),Server,IBM,1993-2001,mainstream,discontinued,1997-commercial-risc-unix-1996-mvp-711569; 1997-dec-linkworks-webworker---an-object-db2d2a,RS/6000 SP evolved into IBM eServer pSeries 690; eventually replaced by IBM Power servers
TECH-015,Informix DataBlades,Database Extension,Informix,1996,emerging,discontinued,1997-commercial-risc-unix-1996-mvp-711569; 1997-dec-linkworks-webworker---an-object-db2d2a,DataBlade technology absorbed into IBM after Informix acquisition in 2001
TECH-016,TCP/IP Networking,Networking Protocol,IETF,1983-present,mainstream,dominant,1997-commercial-risc-unix-1996-mvp-711569,TCP/IP became universal networking standard
TECH-017,OLTP (Online Transaction Processing),Application Type,Multiple,1960s-present,mainstream,active,1997-commercial-risc-unix-1996-mvp-711569,OLTP remains a core enterprise workload category
TECH-018,Data Warehousing,Technology/Architecture,Multiple,1990s-present,emerging,mainstream,1997-commercial-risc-unix-1996-mvp-711569,"Data warehousing evolved into cloud data warehouses; Snowflake, BigQuery etc dominant by 2020s"
TECH-BO-001,BusinessObjects 4.0,BI Platform,Business Objects,1996-2000s,emerging,legacy/acquired,1997-dev-expanding-universes-for-busines-c42c71,"Complete re-architecture of BusinessObjects; integrated Reporter, Explorer, Document Agent Server, Designer, Supervisor modules; foundation for subsequent releases; became SAP BusinessObjects after 2008"
TECH-BO-002,Microcube Engine,OLAP Technology,Business Objects,1996,emerging,superseded,1997-dev-expanding-universes-for-busines-c42c71,Client-side multidimensional analysis engine; builds compact microcubes on-the-fly from SQL queries; eliminates pre-built cube requirement; concept evolved into modern in-memory analytics
TECH-BO-003,Universe (semantic layer),Metadata Layer,Business Objects,1990s,emerging,evolved,1997-dev-expanding-universes-for-busines-c42c71,Business representation of database hiding SQL complexity; drag-and-drop metaphor for IS and business users; concept lives on in SAP HANA and modern BI semantic layers
TECH-BO-004,Project Darwin,Web BI Platform,Business Objects,1997 (beta),emerging,superseded,1997-dev-expanding-universes-for-busines-c42c71,Three-tier web application server to bring BusinessObjects functionality to WWW via Java applets; became WebIntelligence upon release; concept evolved into web-based BI standard
TECH-BO-005,BusinessMiner,Data Mining,Business Objects + ISoft,1997,emerging,discontinued,1997-dev-expanding-universes-for-busines-c42c71,Desktop decision-tree data mining tool licensed from ISoft; $995 standalone or $495 with BusinessObjects 4.0; discontinued; data mining integrated into broader BI platforms
TECH-BO-006,Document Agent Server,Report Distribution,Business Objects,1996,emerging,superseded,1997-dev-expanding-universes-for-busines-c42c71,"Third-tier component for scheduled report updating and distribution; $4,995; concept evolved into modern BI server and report scheduling"
TECH-BO-007,OLAP (On-Line Analytical Processing),Analytics Category,Multiple,1990s,emerging,mature,1997-dev-expanding-universes-for-busines-c42c71,Multidimensional data analysis; BusinessObjects 4.0 brought OLAP to mainstream users without proprietary OLAP databases
TECH-BO-008,Data Mining,Analytics Category,Multiple,1990s,niche,mainstream,1997-dev-expanding-universes-for-busines-c42c71,Pattern discovery in large datasets; Aberdeen predicted democratization of data mining from specialists to business analysts; prediction proved accurate by 2010s
TECH-BO-009,Relational OLAP (ROLAP),Analytics Architecture,Multiple,1990s,emerging,mature,1997-dev-expanding-universes-for-busines-c42c71,OLAP analysis on top of relational databases; BusinessObjects schemaless approach allowed this without star/snowflake schema requirements
TECH-BO-010,Java Applets,Web Technology,Sun Microsystems / W3C,1995-2017,emerging,obsolete,1997-dev-expanding-universes-for-busines-c42c71,Project Darwin planned to use Java applets for web delivery of BI; Java applets deprecated by browsers by 2017; concept succeeded through HTML5 and modern web standards
TECH-BO-011,Business Intelligence (BI),Software Category,Multiple,1990s,emerging,mature,1997-dev-expanding-universes-for-busines-c42c71,Broad category for analytics and reporting tools; Business Objects was a founding vendor of the category
TECH-CADE,Client-Server Application Development Environment (CADE),development-environment,multiple,1990-2000,mainstream,obsolete,aberdeen-1995-progress-software-profile,"Category largely displaced by web application frameworks, IDEs, and cloud-native tooling."
TECH-DATABLADE,Informix DataBlade Modules,database-extension,Informix,1995-2001,emerging,legacy,aberdeen-1995-universal-servers-rdbms-technology-next-decade,DataBlade architecture for complex data type extensions; IBM maintained basic DataBlade support post-acquisition.
TECH-DOT-001,Distributed Object Technology (DOT),Middleware,Multi-vendor,1990s,Emerging/Hyped,Superseded,1997-distributed-object-technology--dead-3cf2d1,Broad category encompassing CORBA and DCOM; succeeded by web services and microservices
TECH-DOT-002,CORBA (Common Object Request Broker Architecture),Middleware Standard,OMG,1990s,Emerging,Niche/Legacy,1997-distributed-object-technology--dead-3cf2d1,CORBA became popular in mid-1990s then declined after early 2000s; still used in legacy telecom and defense systems
TECH-DOT-003,DCOM (Distributed Component Object Model),Middleware Standard,Microsoft,1990s,Emerging,Superseded,1997-distributed-object-technology--dead-3cf2d1,Microsoft dropped DCOM after failed attempts to scale; replaced by .NET Remoting then WCF then REST APIs
TECH-DOT-004,Object Request Broker (ORB),Middleware Component,Multi-vendor,1990s,Emerging,Legacy,1997-distributed-object-technology--dead-3cf2d1,Core CORBA runtime component; niche use in legacy systems today
TECH-DOT-005,Internet/Intranet Applications,Application Platform,Multi-vendor,1990s,Emerging,Mature/Dominant,1997-distributed-object-technology--dead-3cf2d1,The Internet application platform the report identified as the key driver did indeed become dominant
