tech_id,tech_name,category,vendor,era,lifecycle_at_study,lifecycle_current,study_id,notes
ssl,SSL (Secure Sockets Layer),protocol,Netscape,1995-2015,emerging,obsolete,aberdeen-1996-open-market-web-based-commerce,Superseded by TLS; used within OM-SecureLink architecture
ssl-encryption,SSL (Secure Sockets Layer) Encryption,protocol,Netscape,1995-2015,emerging,obsolete,1997-commerce-exchange-pvp-250db8,Aberdeen notes Commerce eXchange uses SSL to protect sessions between browser and server; RC4 and MD5 encryption; SSL deprecated in favor of TLS (Transport Layer Security); TLS 1.3 is current standard; SSL itself obsolete.
store-and-forward-messaging,Store-and-Forward Messaging,protocol,various,1970s-present,emerging,active,aberdeen-1995-commercial-messaging,"Core underlying technology of Commercial Messaging; evolved into modern message queuing and event streaming (Kafka, RabbitMQ, AWS SQS, etc.)"
stratm-technology,Stratm Technology (ST),chip,StrataCom/Cisco,1996-2005,emerging,obsolete,1997-cisco-s-core-products-business-inte-bd8697,"High-performance ASIC set for ATM switching and traffic management from StrataCom; features complete ABR support, virtual path trunking, weighted fair queuing, multicast; enables higher-density lower-cost ATM switching; integrated into BPX platforms."
sun-ultra-enterprise,Sun Ultra Enterprise 5000,platform,Sun Microsystems,1996-2002,mature,obsolete,aberdeen-1996-hp-9000-enterprise-server-64bit-pa8000,"12-CPU system rated 11,466 tpmC; compared to HP K460 at 12,321 tpmC"
svr4-unix,Unix SVR4/MP (Unisys Enhanced),platform,Unisys,1992-1999,mature,obsolete,aberdeen-1996-unisys-clearpath-smp-servers,Unisys enhanced SVR4/MP; transitioning to SCO UnixWare 2.1 in 1996
switch-node-routing-switch,Bay Networks Switch Node Routing Switch,platform,Bay Networks,1997-2000,emerging,obsolete,1997-bay-networks--switch-node-routing-s-4d9885,"Announced March 3, 1997. Layer 3 switching with dual 1.2 Gbps buses, IP AutoLearn, 5-slot chassis; wire-speed IP/IPX routing. Discontinued after Bay's acquisition by Nortel."
sx-2000-pbx,Mitel SX-2000 LIGHT PBX,platform,Mitel Corporation,1984-2000,mature,obsolete,aberdeen-1996-mitels-nevadanetworked-voice-data-speeding-toward,Distributed PBX being evolved into NeVaDa integrated call server; modular LIGHT controller nodes
sybase-ase,Sybase Adaptive Server Enterprise,platform,Sybase,1987-2015,mature,legacy-supported,aberdeen-1996-distributed-open-rdbms-buying-guide,Codebase licensed to Microsoft for original SQL Server; now SAP ASE
sybase-rdbms,Sybase RDBMS,platform,Sybase,1984-2015,mature,legacy-supported,aberdeen-1996-open-market-web-based-commerce,Alternative database backend for OM-Transact; SAP acquired Sybase 2010
system3x,IBM System/3X line,,,,,,aberdeen-1995-ibm-as400-sap-r3,"IBM's midrange predecessor platform family (System/3, System/32, System/34, System/36, System/38); evolved into AS/400"
t1-01,Forte Release 3.0,Application Development Environment,Forte Software,client-server,growth,legacy/discontinued,1997-forte-enterprise-development-enviro-a07cf9,Core HADE product. Acquired by Sun 1999; evolved into Sun Forte Developer; discontinued ~2002.
t1-02,Forte Express,Business Modeling / CASE Tool,Forte Software,client-server,growth,legacy/discontinued,1997-forte-enterprise-development-enviro-a07cf9,Upper-CASE design and code generation tool integrated with Forte.
t1-03,Forte Conductor,Workflow Engine,Forte Software,client-server,introduction,legacy/discontinued,1997-forte-enterprise-development-enviro-a07cf9,Production workflow engine for automating business rules in distributed applications.
t1-04,CORBA/IIOP,Middleware/Protocol,OMG standard,client-server,growth,legacy,1997-forte-enterprise-development-enviro-a07cf9,Object Request Broker protocol. Declined with rise of Web Services (SOAP/REST) in early 2000s.
t1-05,DCE RPC,Middleware/Protocol,The Open Group,client-server,mature,legacy,1997-forte-enterprise-development-enviro-a07cf9,Distributed Computing Environment Remote Procedure Call. Superseded by DCOM then web services.
t1-06,HADE (High-end Application Development Environment),Development Methodology/Category,industry term,client-server,growth,obsolete-term,1997-forte-enterprise-development-enviro-a07cf9,Category coined to distinguish enterprise-grade RAD tools from simpler tools. Category faded as Java IDEs dominated.
t1-07,Application Partitioning,Architecture Pattern,generic,client-server,growth,evolved-to-microservices,1997-forte-enterprise-development-enviro-a07cf9,Technique to split apps across client/server tiers. Concept evolved into modern microservices architecture.
t1-08,IBM Encina TP Monitor,Transaction Processing Middleware,IBM,mainframe/client-server,mature,discontinued,1997-forte-enterprise-development-enviro-a07cf9,IBM transaction processing monitor supported by Forte for high-volume OLTP.
t2-01,HP 9000 V-Class (V2200),Enterprise SMP Server,Hewlett-Packard,unix-server,introduction,discontinued,1997-hewlett-packard-v-class--providing--897f7a,Announced May 1997; shipped November 1997. HP 9000 line discontinued 2003; succeeded by HP Integrity (Itanium).
t2-02,HyperPlane Crossbar Backplane,Server Interconnect,Hewlett-Packard,unix-server,introduction,discontinued,1997-hewlett-packard-v-class--providing--897f7a,15.3 GB/sec crossbar; derived from Convex supercomputing tech; operated at 120 MHz over 64-bit path.
t2-03,HP PA-RISC (PA-8200/PA-8500),Processor Architecture,Hewlett-Packard,unix-server,growth,discontinued,1997-hewlett-packard-v-class--providing--897f7a,PA-8200 in initial V2200; PA-8500 in 1998 upgrade. PA-RISC succeeded by Itanium (IA-64) in 2001.
t2-04,NUMA (Non-Uniform Memory Access),Server Architecture,generic,unix-server,pre-release,mature,1997-hewlett-packard-v-class--providing--897f7a,HP planned NUMA extension for 1999 V-Class beyond 32-way SMP. NUMA became standard in modern multi-socket servers.
t2-05,Intel Merced (IA-64),Processor Architecture,Intel/HP,unix-server,pre-release,discontinued,1997-hewlett-packard-v-class--providing--897f7a,"HP anticipated Merced integration for 1999 V-Class. Merced (Itanium) shipped 2001, not 1999. Itanium ultimately failed to displace x86-64; discontinued 2021."
t2-06,HP EPS (Enterprise Parallel Server),Clustered Server Architecture,Hewlett-Packard,unix-server,growth,discontinued,1997-hewlett-packard-v-class--providing--897f7a,Hybrid SMP/MPP cluster; EPS40 = up to 16 V2200 nodes (256 processors). Discontinued with HP 9000 line.
t2-07,HP-UX 11.0,Operating System,Hewlett-Packard,unix-server,introduction,legacy,1997-hewlett-packard-v-class--providing--897f7a,V2200 required HP-UX 11.0 (released November 1997). HP-UX still supported on HP Integrity but no new development.
t2-08,TPC-D Benchmark,Industry Benchmark,TPC,unix-server,mature,superseded,1997-hewlett-packard-v-class--providing--897f7a,Decision support benchmark cited for competitive comparisons. Superseded by TPC-H.
t2-09,Windows NT Server,Operating System,Microsoft,unix-server,growth,succeeded,1997-hewlett-packard-v-class--providing--897f7a,Aberdeen dismissed NT for enterprise production workloads in 1997. NT evolved to Windows 2000/Server 2003 which gained significant enterprise traction.
t3-01,Windows NT Server,Server Operating System,Microsoft,wintel-server,growth,succeeded,1997-hewlett-packard’s-strategy-to-surpa-905013,"Evolved to Windows 2000 Server, Windows Server 2003/2008/2012/2019/2022. Became dominant enterprise OS."
t3-02,HP Simplified Enterprise Computing (SEC),Go-to-Market Strategy,Hewlett-Packard / Microsoft,wintel-server,introduction,discontinued,1997-hewlett-packard’s-strategy-to-surpa-905013,"HP/Microsoft joint strategy announced March 1997. Included TCO reduction, joint application solutions, heterogeneous interoperability. Dissolved when HP acquired Compaq in 2002."
t3-03,HP OpenView,Systems Management Software,Hewlett-Packard,wintel-server,mature,evolved,1997-hewlett-packard’s-strategy-to-surpa-905013,HP planned to port OpenView IT/Operations to NT by year-end 1997 as part of SEC. Evolved into HP Software; renamed to Micro Focus Operations Bridge after 2017 Micro Focus acquisition.
t3-04,Microsoft Exchange Server,Email/Messaging,Microsoft,wintel-server,growth,mature,1997-hewlett-packard’s-strategy-to-surpa-905013,HP endorsed Exchange as strategic NT messaging; HP OpenMail to provide migration services. Exchange remains a major Microsoft product.
t3-05,IA-64 / Intel Merced,Processor Architecture,Intel / HP,wintel-server,pre-release,discontinued,1997-hewlett-packard’s-strategy-to-surpa-905013,HP co-developed Merced with Intel; expected early access advantage. Itanium shipped 2001; discontinued 2021 after failing to displace x86-64.
t3-06,Microsoft Wolfpack NT Clustering,High Availability Software,Microsoft,wintel-server,pre-release,succeeded,1997-hewlett-packard’s-strategy-to-surpa-905013,HP endorsed Wolfpack as strategic NT HA clustering. Wolfpack became Microsoft Cluster Service (MSCS) in Windows 2000; now Windows Server Failover Clustering.
t3-07,Tandem NonStop ServerNet,Fault-Tolerant Clustering,Tandem Computers,fault-tolerant-computing,mature,evolved,1997-hewlett-packard’s-strategy-to-surpa-905013,"Tandem's hardware clustering architecture for NT high-end. Post-Compaq acquisition, evolved into HPE NonStop systems."
t3-08,HP Volume Purchase Agreement (VPA),Pricing/Sales Strategy,Hewlett-Packard,wintel-server,mature,n/a,1997-hewlett-packard’s-strategy-to-surpa-905013,"HP VPA allowed bundled discounts across printers, networking, servers. Aberdeen cited as major competitive advantage over Compaq."
t3-09,HP PC-COE (PC Common Operating Environment),Desktop Management,Hewlett-Packard,wintel-server,introduction,discontinued,1997-hewlett-packard’s-strategy-to-surpa-905013,"HP's internal PC management environment saving $200M/year on 100,000+ employees. Being made externally available as part of SEC."
t3-10,HP Net Vectra NetPC,Desktop Computer,Hewlett-Packard,wintel-server,introduction,discontinued,1997-hewlett-packard’s-strategy-to-surpa-905013,"Low-cost NetPC at $1,000 entry-level announced as part of SEC. Network PC concept faded as thin clients and standard PCs dominated."
t4-01,IBM VisualAge (family),Integrated Development Environment,IBM,client-server/network-computing,growth,discontinued,1997-ibm-application-development-product-895c4d,"VisualAge family discontinued April 30, 2007. Eclipse framework derived from VisualAge Micro Edition (donated by IBM 2001). VisualAge Smalltalk transferred to Instantiations as VA Smalltalk in 2005."
t4-02,VisualAge for Java,Java IDE,IBM,network-computing,pre-release,discontinued,1997-ibm-application-development-product-895c4d,Upcoming at time of study (1997). VisualAge for Java evolved; Eclipse replaced it. VisualAge ME became Eclipse framework donated to open source 2001.
t4-03,IBM FlowMark,Workflow Engine,IBM,client-server,mature,evolved,1997-ibm-application-development-product-895c4d,FlowMark graphical workflow modeling and execution. Evolved into IBM MQ Workflow; later IBM Business Process Manager (BPM).
t4-04,IBM Team Connection,Source Code Management / ALM,IBM,client-server,mature,discontinued,1997-ibm-application-development-product-895c4d,Group development and repository management. Succeeded by IBM Rational ClearCase and other Rational products post-2003 acquisition.
t4-05,VisualAge Generator,Application Generator / 4GL,IBM,client-server,mature,evolved,1997-ibm-application-development-product-895c4d,Cross-platform application generation from platform-independent specifications. Evolved into IBM RDi (Rational Developer for i); still available for IBM i (AS/400 successor).
t4-06,IBM SOM/DSOM,Object Middleware,IBM,client-server,mature,discontinued,1997-ibm-application-development-product-895c4d,"System Object Model / Distributed SOM. IBM's CORBA-based object sharing. Competed with Microsoft DCOM. Discontinued; DCOM won the desktop, CORBA/J2EE won enterprise middleware."
t4-07,OpenDoc,Component Architecture,IBM / Apple,client-server,decline,discontinued,1997-ibm-application-development-product-895c4d,IBM/Apple compound document component architecture. Abandoned 1997 by Apple; IBM discontinued soon after. Lost to Microsoft OLE/ActiveX.
t4-08,IBM DataAtlas,Database Design / Performance Tool,IBM,client-server,mature,discontinued,1997-ibm-application-development-product-895c4d,Conceptual modeling and physical data design tool for performance optimization. Superseded by IBM Data Studio and other tools.
t4-09,IBM Business Process Modeler (ProModeler),Business Process Modeling,IBM,client-server,mature,evolved,1997-ibm-application-development-product-895c4d,Graphical business process mapping. Evolved into IBM WebSphere Business Modeler and eventually IBM Business Process Manager.
t4-10,IBM Extended Transaction Services,Transaction Middleware,IBM,client-server,mature,evolved,1997-ibm-application-development-product-895c4d,Middleware for scaling data-intensive Internet applications via comms multiplexing and load-balancing. Evolved into WebSphere Application Server transaction services.
t5-01,IBM Information Warehouse,Enterprise Data Warehouse,IBM,data-warehousing,mature,discontinued,1997-ibm-business-intelligence-family-pr-43c37e,Enterprise-scale data warehouse built on DB2. Evolved into IBM DB2 Warehouse; superseded by IBM Analytics/Cognos post-2007 Cognos acquisition.
t5-02,IBM Visual Warehouse,Data Mart,IBM,data-warehousing,growth,discontinued,1997-ibm-business-intelligence-family-pr-43c37e,10-100GB departmental data marts. Focused on fast installation; targeted OS/2 and Windows NT environments. Superseded by IBM DB2 Data Warehouse Manager.
t5-03,IBM Intelligent Decision Server (IDS),OLAP Server,IBM,data-warehousing,mature,discontinued,1997-ibm-business-intelligence-family-pr-43c37e,Evolution of Metaphor DIS; OLAP analytical application server. Discontinued; Cognos PowerPlay/TM1 became IBM's OLAP platform post-2007.
t5-04,IBM Intelligent Miner,Data Mining,IBM,data-warehousing,growth,discontinued,1997-ibm-business-intelligence-family-pr-43c37e,"Data mining supporting clustering, classification, prediction, association, sequential pattern discovery. IBM discontinued Intelligent Miner ~2010; capabilities absorbed into SPSS Modeler (IBM acquired SPSS 2009)."
t5-05,IBM DataPropagator,Data Replication,IBM,data-warehousing,mature,evolved,1997-ibm-business-intelligence-family-pr-43c37e,RDBMS change capture and replication for data warehouse population. Evolved into IBM InfoSphere Data Replication / IBM Data Replication.
t5-06,IBM DataJoiner,Federated Database,IBM,data-warehousing,mature,evolved,1997-ibm-business-intelligence-family-pr-43c37e,Federated data access across heterogeneous databases. Evolved into IBM WebSphere Federation Server / IBM InfoSphere Federation Server.
t5-07,IBM Net.data,Web-Database Integration,IBM,data-warehousing,introduction,discontinued,1997-ibm-business-intelligence-family-pr-43c37e,Web browser interface to DB2; key Internet-enablement tool for BI Family. Discontinued ~2005 as JSP/servlets became standard.
t5-08,IBM DB2,Relational Database,IBM,data-warehousing,mature,active,1997-ibm-business-intelligence-family-pr-43c37e,Core underlying RDBMS for all IBM BI Family products. DB2 remains an active IBM product (IBM Db2 family).
t5-09,IBM DataGuide,Data Catalog / Metadata,IBM,data-warehousing,mature,discontinued,1997-ibm-business-intelligence-family-pr-43c37e,Information catalog allowing end users to browse business-view metadata before drilling down. Concept evolved into modern data catalogs (IBM InfoSphere Information Governance Catalog).
t5-10,IBM Tivoli Management Environment (TME),Systems Management,IBM,data-warehousing,growth,evolved,1997-ibm-business-intelligence-family-pr-43c37e,IBM systems management framework integrated with BI Family. Evolved into IBM Tivoli (now IBM Automation).
tacacs-plus,TACACS+,protocol,Cisco Systems,1993-present,emerging,active,aberdeen-1996-ciscos-access-business-unit-crystallizes-vision,Terminal Access Controller Access Control System Plus; announced March 1995; still used in enterprise auth
tachyon-fc,HP Tachyon Fibre Channel Adapter,platform,Hewlett-Packard,1995-2005,emerging,obsolete,aberdeen-1996-hp-enterprise-parallel-server-scalable-performance,"Aberdeen predicted high probability of becoming open-systems industry standard; adopted by EMC, DG/CLARiiON and 50+ others"
tag-switching,Tag Switching (Cisco),protocol,Cisco Systems,1997-1999,emerging,obsolete,1997-cabletron-and-ipsilon--linking-secu-adba48; 1997-cisco-s-core-products-business-inte-bd8697,"Cisco's competing approach to IP/ATM integration; submitted to IETF; became the basis for MPLS (Multi-Protocol Label Switching, RFC 3031); Tag Switching itself obsolete but MPLS remains fundamental to modern backbone networks."
tcp-ip,TCP/IP,protocol,IETF,1983-present,mature,active,aberdeen-1995-commercial-messaging; aberdeen-1995-digital-multia; aberdeen-1995-ibm-db2-common-server; aberdeen-1996-ibm-os2-warp-server; aberdeen-1996-iss-internet-security-systems; aberdeen-1996-sun-microsystems-ultracomputing-business,One of multiple communications protocols simultaneously supported by MQSeries
tech-001,,enterprise-groupware,Digital Equipment Corporation,,,,aberdeen-1995-digital-linkworks; aberdeen-1995-intersolv-virtual-data-warehouse; aberdeen-1995-oracle-interoffice,
tech-002,,groupware-messaging,Lotus Development Corporation,,,,aberdeen-1995-digital-linkworks; aberdeen-1995-intersolv-virtual-data-warehouse; aberdeen-1995-oracle-interoffice,
tech-003,,messaging-groupware,Microsoft Corporation,,,,aberdeen-1995-digital-linkworks; aberdeen-1995-intersolv-virtual-data-warehouse; aberdeen-1995-oracle-interoffice,
tech-004,,integration-standard,Microsoft Corporation,,,,aberdeen-1995-digital-linkworks; aberdeen-1995-intersolv-virtual-data-warehouse; aberdeen-1995-oracle-interoffice,
tech-005,,middleware,Various (OMG standard),,,,aberdeen-1995-digital-linkworks; aberdeen-1995-intersolv-virtual-data-warehouse; aberdeen-1995-oracle-interoffice,
tech-006,,operating-system,Digital Equipment Corporation,,,,aberdeen-1995-digital-linkworks; aberdeen-1995-intersolv-virtual-data-warehouse; aberdeen-1995-oracle-interoffice,
tech-007,,operating-system,Hewlett-Packard Company,,,,aberdeen-1995-digital-linkworks; aberdeen-1995-intersolv-virtual-data-warehouse; aberdeen-1995-oracle-interoffice,
tech-008,,operating-system,Digital Equipment Corporation / VSI,,,,aberdeen-1995-digital-linkworks; aberdeen-1995-intersolv-virtual-data-warehouse; aberdeen-1995-oracle-interoffice,
tech-009,,operating-system,IBM Corporation,,,,aberdeen-1995-digital-linkworks; aberdeen-1995-intersolv-virtual-data-warehouse; aberdeen-1995-oracle-interoffice,
tech-01,Relational OLAP (ROLAP),analytical-framework,multiple,1993-present,emerging,evolved,aberdeen-1995-data-warehouse-olap,Central focus of study; combines RDBMS with multidimensional query capability; multi-tier architecture
tech-010,,operating-system,Microsoft Corporation,,,,aberdeen-1995-digital-linkworks; aberdeen-1995-intersolv-virtual-data-warehouse; aberdeen-1995-oracle-interoffice,
tech-011,,operating-system,Microsoft Corporation,,,,aberdeen-1995-digital-linkworks; aberdeen-1995-intersolv-virtual-data-warehouse; aberdeen-1995-oracle-interoffice,
tech-012,,office-automation,Digital Equipment Corporation,,,,aberdeen-1995-digital-linkworks; aberdeen-1995-intersolv-virtual-data-warehouse; aberdeen-1995-oracle-interoffice,
tech-013,,relational-database,Oracle Corporation,,,,aberdeen-1995-digital-linkworks; aberdeen-1995-intersolv-virtual-data-warehouse; aberdeen-1995-oracle-interoffice,
tech-014,,relational-database,Microsoft Corporation,,,,aberdeen-1995-digital-linkworks; aberdeen-1995-intersolv-virtual-data-warehouse; aberdeen-1995-oracle-interoffice,
tech-015,,middleware,Various (OSF/DCE standard),,,,aberdeen-1995-digital-linkworks; aberdeen-1995-intersolv-virtual-data-warehouse; aberdeen-1995-oracle-interoffice,
tech-016,,operating-system,IBM Corporation,,,,aberdeen-1995-digital-linkworks; aberdeen-1995-oracle-interoffice,
tech-017,,operating-system,Apple Computer,,,,aberdeen-1995-digital-linkworks; aberdeen-1995-oracle-interoffice,
tech-018,,gui-toolkit,Open Software Foundation,,,,aberdeen-1995-digital-linkworks; aberdeen-1995-oracle-interoffice,
tech-019,,software-category,Multiple,,,,aberdeen-1995-digital-linkworks; aberdeen-1995-oracle-interoffice,
tech-02,Multidimensional OLAP (MOLAP),analytical-framework,multiple,1990-present,mainstream,legacy-niche,aberdeen-1995-data-warehouse-olap,Proprietary MDB-based OLAP; scalability limited to 20-50GB; faces competition from ROLAP
tech-020,,operating-system,Microsoft Corporation,,,,aberdeen-1995-oracle-interoffice,
tech-021,,gui-toolkit,Open Software Foundation,,,,aberdeen-1995-oracle-interoffice,
tech-022,,operating-system,Apple Computer,,,,aberdeen-1995-oracle-interoffice,
tech-023,,terminal-interface,Various,,,,aberdeen-1995-oracle-interoffice,
tech-024,,mobile-device,"Various (Palm, HP, Casio)",,,,aberdeen-1995-oracle-interoffice,
tech-025,,server-platform,Hewlett-Packard,,,,aberdeen-1995-oracle-interoffice,
tech-026,,server-platform,Sun Microsystems,,,,aberdeen-1995-oracle-interoffice,
tech-027,,server-platform,IBM Corporation,,,,aberdeen-1995-oracle-interoffice,
tech-028,,messaging-groupware,Microsoft Corporation,,,,aberdeen-1995-oracle-interoffice,
tech-029,,groupware-messaging,Lotus Development Corporation,,,,aberdeen-1995-oracle-interoffice,
tech-03,Multidimensional Database (MDB),database-technology,multiple,1990-present,mainstream,legacy-niche,aberdeen-1995-data-warehouse-olap,Specialized storage using array/sparse-matrix technology; becoming impractical above 50GB
tech-030,,database-language,ANSI/ISO standard,,,,aberdeen-1995-oracle-interoffice,
tech-031,,network-security,Various,,,,aberdeen-1995-oracle-interoffice,
tech-04,Sparse-matrix technology,storage-optimization,multiple,1990-present,mainstream,legacy-niche,aberdeen-1995-data-warehouse-olap,Performance and storage optimization that hunts unused MDB cells and compresses arrays; used by Pilot and Express
tech-05,Parallel-scalable RDBMS,database-technology,multiple,1992-present,emerging,evolved,aberdeen-1995-data-warehouse-olap,RDBMSs scaling beyond 100GB; exemplified by Informix-Online; foundation for ROLAP
tech-06,Dimensional modeling,data-modeling,multiple,1993-present,emerging,active,aberdeen-1995-data-warehouse-olap,Organizes data into fact tables (measures) and dimension tables (satellite tables); core to ROLAP
tech-07,ODBC (Open Database Connectivity),connectivity-standard,Microsoft,1992-present,mainstream,legacy,aberdeen-1995-data-warehouse-olap,Standard interface used by report-writer tools to connect to databases; enables end-user query building
tech-08,SQL (Structured Query Language),query-language,ISO/ANSI,1974-present,mainstream,active,aberdeen-1995-data-warehouse-olap,Core query mechanism; Relational OLAP generates multi-pass SQL dynamically; layperson-baffling per study
tech-09,Metadata repository / data dictionary,data-management,multiple,1990-present,emerging,active,aberdeen-1995-data-warehouse-olap,Used to translate technical schema to business terms; critical for ROLAP change management
tech-10,Denormalization,database-design,multiple,1990-present,emerging,active,aberdeen-1995-data-warehouse-olap,Repetitively stores data to minimize joins; key ROLAP database optimization technique
tech-11,Summarization / pre-aggregation,query-optimization,multiple,1990-present,emerging,active,aberdeen-1995-data-warehouse-olap,Pre-aggregating data to eliminate runtime calculation; one of three core ROLAP optimization techniques
tech-12,Partitioning,database-design,multiple,1990-present,emerging,active,aberdeen-1995-data-warehouse-olap,Divides large fact tables into smaller tables; improves query response time and warehouse maintenance
tech-13,Multi-pass SQL generation,query-engine,MicroStrategy,1994-present,niche,evolved,aberdeen-1995-data-warehouse-olap,MicroStrategy OLAP engine capability; generates complex multi-pass SQL to avoid need for specialized MDB
tech-14,Fat-client architecture,software-architecture,multiple,1985-present,mainstream,obsolete,aberdeen-1995-data-warehouse-olap,Entire application resides on desktop; weakness exposed when querying large datasets; being superseded
tech-15,Data warehousing,data-management,multiple,1988-present,emerging,active,aberdeen-1995-data-warehouse-olap,Central enterprise RDBMS optimized for decision support; scaling to terabytes by 1995
tech-16,Essbase (Arbor Software),analytical-server,Arbor Software,1992-present,mainstream,evolved,aberdeen-1995-data-warehouse-olap,Server-based MDB; later became Oracle Essbase after Arbor-Hyperion-Oracle acquisition chain
tech-17,Holos (Holistic Systems),analytical-server,Holistic Systems Inc.,1993-present,mainstream,discontinued,aberdeen-1995-data-warehouse-olap,Server-based MDB listed alongside Essbase and Express; acquired into Seagate/Crystal/Business Objects
tech-18,Oracle Express (IRI Software),analytical-server,Oracle/IRI Software,1991-present,mainstream,discontinued,aberdeen-1995-data-warehouse-olap,Server-based MDB with sparse-matrix; Oracle acquired IRI Software for this product in 1995
tech-19,Pablo (Andyne Computing),analytical-client,Andyne Computing Ltd.,1993-present,mainstream,discontinued,aberdeen-1995-data-warehouse-olap,Client-side MDB maintaining pre-calculated data in PC memory; handles a few megabytes
tech-20,BusinessObjects,report-writer,Business Objects,1990-present,mainstream,evolved,aberdeen-1995-data-warehouse-olap,"High-end report writer; IS pre-defines complex SQL (Group By, Having, Union) for business users"
