study_id,title,author,date,type,subject_domain,methodology,source_file,abstract,license,importance,importance_rationale,relevance,relevance_rationale,prescience,prescience_rationale
aberdeen-1995-rdbms-cray-research-inc,"Cray Research, Inc.: RDBMS and Commercial Database Market Position",Aberdeen Group,1995-01-01,product-profile,high-performance computing / RDBMS,vendor analysis,1995 rdbms Cray Research Inc pr.pdf,"Aberdeen Group profile of Cray Research's pivot to commercial RDBMS markets via its CS6400 SMP server platform. Examines market positioning against IBM SP2 and AT&T GIS 3600, organizational restructuring into the Business Systems Division, and product capabilities for very large database (VLDB) workloads.",CC-BY-4.0,medium,"The study documents Cray Research's commercial database pivot at a historically significant moment, just months before its acquisition by SGI in February 1996. It captures the market dynamics of high-end UNIX SMP servers competing for VLDB workloads.",high,"Directly relevant to enterprise database infrastructure and high-performance computing market evolution, covering real commercial competitors and observable outcomes in a well-documented technology transition.",high,"Aberdeen's prediction that Cray would become 'a major force' in commercial databases was largely invalidated by SGI's acquisition and divestiture of the Superservers business to Sun in 1996. However, the analysis of SMP architecture as the dominant path for VLDB proved prescient—Sun's resulting Enterprise 10000 became highly successful."
aberdeen-1995-sun-microsystems-computer-company,Sun Microsystems Computer Company: Sun Emerges as a Top-Tier Commercial Systems Supplier,Aberdeen Group,1995-01-01,product-profile,Unix commercial server market,"vendor-briefing,user-interviews,benchmark-review",1995 Sun Microsystems Computer Company pr.pdf,"Aberdeen profiles Sun Microsystems Computer Company (SMCC) as it transitions from technical workstation leadership to commercial server market contender. The study examines Sun's SPARC-based server product line from workgroup to enterprise tiers, evaluates its response to commercial buyer requirements (performance, scalability, availability, cost of ownership), and assesses Sun's competitive position against IBM and HP in commercial Unix server sales.",CC-BY-4.0,high,Sun was a pivotal inflection point in 1995: its shift from technical workstations to commercial servers foreshadowed the Unix server dominance that lasted through the dot-com era. The TPC benchmark results and HA cluster systems described were key commercial differentiators.,high,The study documents Sun's commercial Unix server strategy at the precise moment the enterprise server market was consolidating. Sun's ultimate fate (acquired by Oracle for $7.4B in 2009-2010) makes this a well-documented historical arc ideal for archival research.,medium,"Aberdeen correctly identified Sun's commercial server trajectory, but the study underestimated the long-term threat from x86/Linux which eventually made SPARC uncompetitive in the 2000s, leading to Sun's acquisition by Oracle."
aberdeen-1995-universal-servers-rdbms-technology-next-decade,Universal Servers: RDBMS Technology for the Next Decade,Aberdeen Group,1995-06-03,technology-viewpoint,relational database management systems and object-relational extensions,"analyst-assessment,vendor-briefing,user-interviews",1995 Universal Servers_ RDBMS Technology for the Next Decade tvp.pdf,"Aberdeen examines the emergence of Universal Servers — RDBMS extensions supporting complex data types (text, video, spatial, ROLAP, user-defined) — as the next major RDBMS evolution beyond simple numeric data. The study positions Informix (via Illustra DataBlade acquisition) as the leader, assesses Oracle 7.3, IBM DB2, Sybase, Computer Associates, and Microsoft, and predicts Universal Server technology will become widespread within 2-3 years and be the most significant RDBMS advance for the next decade.",CC-BY-4.0,high,This report precisely documents the 1995 emergence of object-relational databases — a foundational transition in database technology history. Aberdeen's analysis of Informix/Illustra DataBlade architecture and its comparison to Oracle and IBM is primary source documentation of this technology inflection.,high,"Universal Server concepts (complex data types, extensibility, ROLAP) directly anticipate modern database capabilities including PostgreSQL extensions, vector databases, and modern multi-model databases. The framework remains analytically useful for assessing database extensibility.",high,"Aberdeen's core predictions proved remarkably accurate: RDBMS survived OODBMSs, complex data types did become standard (object-relational became mainstream via PostgreSQL and Oracle), ROLAP became major BI architecture, and LDAP/Internet data integration happened. However, Informix's predicted leadership was disrupted by its 2001 acquisition by IBM."
aberdeen-1995-upgrading-isv-methodology-enterprise-application-development,Upgrading To ISV Methodology For Enterprise Application Development,Aberdeen Group,1995-12-07,practice-viewpoint,enterprise application development methodology,"vendor-briefing,analyst-assessment,user-interviews",1995 Upgrading To ISV Methodology For Enterprise Application Development pvp.pdf,"Aberdeen examines ADM's SCRUM methodology — a codification of ISV best practices for enterprise application development — and argues that in-house IS organizations should adopt ISV-style rapid iterative development over traditional waterfall planning-heavy methods. The study details SCRUM's three phases (Planning, Sprints, Closure) and ADM's Product Management Facility implementation, concluding that IS teams must adopt sprint-based methods with small teams, short cycles, and flexible toolsets to compete with the speed of the best ISVs.",CC-BY-4.0,high,This 1995 document is a direct precursor to modern Agile methodologies. Aberdeen's endorsement of SCRUM — 6 years before the Agile Manifesto (2001) — documents the intellectual lineage from ISV practices to formalized Agile frameworks. ADM's Jeff Sutherland is credited as SCRUM co-creator.,high,SCRUM/Agile has become the dominant software development methodology globally. This document provides primary-source evidence of the methodology's roots in ISV practices and the specific framing used in 1995 to advocate for its enterprise adoption.,high,"Aberdeen's predictions proved exceptionally accurate: SCRUM became a global standard (the Scrum Guide, Scrum.org); ISV practices (small teams, short sprints, early delivery) were codified in the 2001 Agile Manifesto; traditional waterfall methods did lose ground in enterprise IS. Aberdeen correctly identified the methodology transition 6+ years before its formalization."
aberdeen-1996-3com-reconciling-clientserver-development-internet,Reconciling Client/Server Development and the Internet,Aberdeen Group,1996-11-01,impact-report,client/server computing / Internet development strategy,analyst-commentary,1996 3Com_ Reconciling Client_Server Development and the Internet im.pdf,"Aberdeen Group impact report examining how corporations should reconcile existing client/server development investments with emerging Internet-based application deployment. Authored by analyst Tim Sloane, it argues against dual-tool strategies and advocates for Web-enabled client/server tools rather than pure Internet or Java-based approaches. Sponsored by 3Com.",CC-BY-4.0,medium,The study captures a pivotal 1996 inflection point in enterprise IT architecture as the Web disrupted client/server development paradigms. The 3Com sponsorship is notable as a networking vendor positioning around corporate Internet infrastructure.,high,Directly relevant to enterprise application architecture evolution; the questions raised about reconciling investment protection with Web deployment remain pertinent to any platform transition debate.,high,Aberdeen's core prediction that Web-enabled client/server tools would prevail over dual-tool strategies and Java proved remarkably prescient. The Java limitation prediction proved accurate for the late 1990s. The argument that EDI would move to Internet over 5 years was confirmed. The prediction that browser-based applications would require server-centric execution was confirmed by modern SaaS architectures.
aberdeen-1996-advanced-planning-engines-white-paper,Advanced Planning Engine Technologies: Can Capital-Generating Technology Change the Face of Manufacturing?,Aberdeen Group,1996-02-01,white-paper,advanced planning and scheduling / supply chain management,vendor-analysis and case-study,1996 Advanced Planning Engines White Paper wp.pdf,"Aberdeen Group executive white paper examining Advanced Planning Engine Technologies (APET) for manufacturing, logistics and distribution. Profiles seven key vendors — American Software, FACT Inc., i2 Technologies, Manugistics, Numetrix, Red Pepper Software, and ILOG/others — detailing product capabilities, ROI case studies, and technical evaluation criteria. Argues APET should be the first solution acquisition on the path to enterprise reengineering.",CC-BY-4.0,high,"This is one of the earliest systematic surveys of the supply chain planning software market — a category that grew into a multi-billion dollar industry. The vendor profiles are primary sources on companies later acquired for hundreds of millions to billions of dollars (i2 for $604M, Red Pepper for $225M, Manugistics by JDA).",high,"Directly relevant to supply chain management technology evolution, enterprise planning software market history, and manufacturing optimization. The APET category evolved into modern S&OP and supply chain planning suites used by virtually all large manufacturers.",high,"Aberdeen's core prediction that APET would become indispensable to manufacturing enterprises was confirmed by market consolidation. Red Pepper was acquired by PeopleSoft for $225M in 1996, i2 Technologies went public in 1996 at ~$700M valuation and was acquired by JDA for $604M in 2010, and Manugistics was acquired by JDA in 2006. Supply chain planning is now a standard enterprise software category."
aberdeen-1996-app-dun-bradstreet-software-smartstrtogether-better,Dun & Bradstreet Software SmartStream Distributed Enterprise: Putting It All Together To Better Spread It All Apart,Aberdeen Group,1996-04-01,product-profile,enterprise resource planning / client-server applications,vendor analysis,1996 app Dun and Bradstreet Software -- SmartStr...Together to Better Spread It All Apart pr.pdf,"Aberdeen Group product profile of Dun & Bradstreet Software's SmartStream Distributed Enterprise (SmartStream DE) ERP suite. Examines the product's distributed client/server architecture, workflow capabilities, SQL Server/Sybase dependency, market positioning against Oracle Applications, PeopleSoft, SAP, and SSA, and D&B Software's strategic position as its parent Dun & Bradstreet Corporation prepares for divestiture. SmartStream DE revenues exceeded $100M in fiscal year 1995.",CC-BY-4.0,high,"This study documents D&B Software at a pivotal moment — generating $100M+ in SmartStream revenues with plans for divestiture by Dun & Bradstreet Corporation. The company was subsequently acquired by Geac Computer, which then abandoned the SmartStream manufacturing module. The fate represents a cautionary tale about single-RDBMS dependency limiting addressable market.",high,"Directly relevant to enterprise ERP market history, distributed application architecture evolution, and the consolidation dynamics that reduced dozens of ERP vendors to a handful (SAP, Oracle). The workflow-centric architecture anticipates modern BPM platforms.",medium,"Aberdeen's identification of the single-RDBMS limitation as a persistent competitive disadvantage proved prescient — D&B Software struggled to expand and was acquired by Geac, which abandoned SmartStream manufacturing in 1997. The prediction that SmartStream DE would gain leadership in distributed ERP was not fulfilled."
aberdeen-1996-as400-year-2000-ibm-leading-users,AS/400 and the Year 2000: IBM Leading Users Across an Unknown Chasm,Aberdeen Group,1996-09-27,market-viewpoint,Year 2000 compliance / IBM AS/400,analyst-commentary,1996 AS:400 and the Year 2000- IBM Leading Users Across an Unknown Chasm.pdf,"Aberdeen Group market viewpoint examining the Year 2000 (Y2K) problem specifically in the context of IBM AS/400 and System/3X installed base. Published September 27, 1996 as Volume 9, Number 17. Praises IBM's AS/400 division for proactive Y2K leadership — releasing OS/400 Version 3 as Year 2000 safe, publishing lists of compliant software, recruiting professional service organizations, and developing date-assessment tools. Contrasts IBM's approach favorably against other hardware suppliers.",CC-BY-4.0,high,This study is historically significant as one of the earliest systematic Y2K risk analyses for a specific platform. Published in September 1996 — more than 3 years before Y2K — it demonstrates remarkable early awareness of the problem's complexity and offers detailed platform-specific guidance that influenced IBM's strategy.,high,"Directly relevant to enterprise IT risk management, legacy system management, and platform migration decisions. The Y2K problem was one of the largest coordinated IT remediation efforts in history, and this study captures the mid-1990s planning period.",high,Aberdeen's prediction that IBM's proactive AS/400 Y2K leadership would result in greater user loyalty proved accurate — the AS/400 platform maintained strong loyalty through the Y2K transition and beyond. The warnings about subtle 'gotcha' problems surfacing continuously proved prescient. The prediction that no single supplier could fix all industry Y2K issues was confirmed.
aberdeen-1996-baan-changes-rules-erp-game,BAAN Changes the Rules of the ERP Game with Dynamic Enterprise Modeling,Aberdeen Group,1996-04-24,market-study,ERP-software,"industry-analysis, competitive-profiling, expert-opinion",1996 BAAN Changes the Rules of the ERP Game apr.pdf,"Aberdeen Group evaluates Baan Company's April 1996 release of BAAN IV, an enterprise resource planning suite featuring Dynamic Enterprise Modeling (DEM) and Orgware technology. The report argues that BAAN IV's process-oriented, dynamically configurable architecture fundamentally advances ERP software beyond the static, parameter-heavy systems of competitors, giving Baan at least a 12-month competitive lead. Aberdeen concludes that Baan should be on every serious ERP evaluation shortlist.",CC-BY-4.0,high,"Aberdeen's endorsement of BAAN IV as a category-redefining product coincided with Baan's peak market momentum (Boeing win, 1995 IPO, 91% revenue growth); the study introduced the 'Dynamic-ERP vs. Static-ERP' framework that shaped evaluations across the industry through the late 1990s.",medium,The Dynamic Enterprise Modeling concept foreshadowed model-driven ERP configuration approaches still relevant today; specific product claims and competitive landscape are dated given Baan's subsequent acquisition by Invensys and eventual absorption into Infor LN.,low,"Aberdeen predicted Baan's 12-month competitive lead and rising market stature; Baan's 1998 revenue manipulation scandal, loss of customers to SAP, and 2000 sale to Invensys for $700M (against a $7B peak cap) proved these claims premature and the competitive advantage was short-lived."
aberdeen-1996-blyths-ren-architecture-prescription-it-success,Blyth's REN Architecture: A Prescription for IT Success,Aberdeen Group,1996-01-01,market-study,application-development-tools,"industry-analysis, competitive-profiling, field-research, expert-opinion",1996 Blyth's REN Architecture_ A Prescription for IT Success pr.pdf,"Aberdeen Group evaluates Blyth Software's REN architecture (Real solutions, Endless possibilities, No boundaries), a dual-track application development framework targeting both traditional client-server and emerging Internet/Intranet commerce applications. The study argues that Blyth's OMNIS-based toolset, extended with five Net-enabled products (Web Enabler, OMNIS Data Server, Web Vault, Web Manager, Weblets), gives the company at least a 12-month competitive lead in mission-critical web development infrastructure. Aberdeen predicts that successful REN execution could elevate Blyth from a niche vendor to an IT household name.",CC-BY-4.0,medium,"The study captured an important inflection point in 1996 web application development, anticipating enterprise-grade web middleware requirements; however, Blyth remained a niche player and did not achieve the breakthrough Aberdeen predicted.",medium,The conceptual framework of 'Net development requiring client-server rigor foreshadowed today's enterprise web architecture principles; specific products are obsolete but the competitive analysis methodology transfers.,low,"Aberdeen predicted Blyth would become an 'IT household name' and carve out a long-term best-of-breed position in Net development; instead, Blyth/Omnis Technology never achieved mainstream status, was renamed multiple times (Omnis Technology -> Raining Data -> TigerLogic), and was ultimately sold to Cliftech Solutions in 2017."
aberdeen-1996-bulls-sagister-datacenterdisciplined-unix-businesscritical-applications,Bull's Sagister: Datacenter-Disciplined UNIX for Business-Critical Applications,Aberdeen Group,1996-01-01,market-study,UNIX-datacenter-management,"industry-analysis, competitive-profiling, document-review, expert-opinion",1996 Bull_s Sagister_ Datacenter-Disciplined UNIX for Business-Critical Applications pr.pdf,"Aberdeen Group evaluates Groupe Bull's Sagister product, a hardware/software/services package combining PowerPC-based RISC/UNIX systems with mainframe-discipline operational tooling for enterprise datacenters. The study argues Sagister uniquely bridges the gap between UNIX flexibility and mainframe reliability through four architecture tiers (Escala, AIX 4.1, HACMP, ISM/OpenMaster) and optional Function Sets for production, security, and mainframe interoperability. Aberdeen provides comparative analysis against IBM RS/6000 SP, HP MC/ServiceGuard/OpenView, DEC TruCluster, and CA-Unicenter.",CC-BY-4.0,medium,"Sagister addressed a real 1996 enterprise challenge — UNIX lacking mainframe-class operational discipline — that was widely debated; the product positioned Bull uniquely in the RISC/UNIX segment versus IBM, HP, and Sun, though Bull was a smaller market player than the others.",medium,The study's conceptual framework of 'mainframe discipline applied to open systems' directly anticipates modern DevOps/SRE practices and enterprise UNIX administration standards; specific hardware specs and vendors are dated but the operational rigor framework transfers.,medium,"Aberdeen correctly predicted Sagister's mainframe-interoperability and clustered UNIX approach would be valuable; however, Bull's corporate trajectory (acquired by Atos in 2014) limited Sagister's long-term standalone market impact. The broader thesis that UNIX needed mainframe-style operations tooling proved correct."
aberdeen-1996-ciscos-access-business-unit-crystallizes-vision,Cisco's Access Business Unit Crystallizes Its Vision,Aberdeen Group,1996-01-29,market-study,remote-access-networking,"industry-analysis, competitive-profiling, field-research, expert-opinion",1996 Cisco_s Access Business Unit Crystallizes Its Vision apr.pdf,"Aberdeen Group evaluates Cisco Systems' Access Business Unit (ABU) January 1996 product rollout, assessing the company's strategy to dominate all segments of the remote access market: ROBO, dial-up/access server, SOHO, and embedded/server-based systems. The study traces Cisco's 15-month journey through acquisitions (Combinet, Internet Junction, Network Translation) and product launches (AS5200, 750 series, CiscoRemote, CiscoPro), arguing that Cisco's IOS software is becoming the de facto standard for remote access. Aberdeen concludes that Cisco's end-to-end access strategy across carrier, enterprise, SOHO, and home segments has all the ingredients of a successful win strategy.",CC-BY-4.0,high,This study documents Cisco at a pivotal 1996 moment when the ABU — generating $1B revenue (50% of $2B total) — was crystallizing its end-to-end remote access strategy; Aberdeen's early identification of IOS as the de facto internetworking standard proved highly significant for understanding Cisco's dominance.,high,Cisco remains the world's largest networking vendor; IOS remains the core of Cisco's networking OS family; the ROBO/SOHO/carrier segmentation framework and the strategy of embedding OS in hardware products directly inform current Cisco and networking industry analysis.,high,"Aberdeen accurately predicted Cisco's IOS would become ubiquitous across networking segments, that the ISP/carrier market would demand intelligent software differentiation, and that Cisco's end-to-end strategy would succeed — all proved correct as Cisco grew to $40B+ revenue by 2000 and dominated every segment analyzed."
aberdeen-1996-clarify-inc,Clarify Inc.,Aberdeen Group,1996-10-01,market-study,customer-interaction-software,"industry-analysis, competitive-profiling, field-research, expert-opinion",1996 Clarify Inc dev pr..pdf,"Aberdeen Group evaluates Clarify Inc., a San Jose-based leader in customer interaction software (CIS) covering customer service, field service, quality assurance, helpdesk, and sales force automation. The study documents Clarify's integrated best-of-breed strategy, 99% uptime reliability, 100%+ annual revenue growth, linchpin accounts at Microsoft, Cisco, HP, MCI, and Sprint, and the Metropolis Software acquisition providing SFA and mobile computing capabilities. Aberdeen concludes Clarify is 'a CIS winner' positioned to dominate the rapidly consolidating CIS market.",CC-BY-4.0,high,"Clarify was a leading CRM/CIS vendor in 1996 with blue-chip anchor accounts (Microsoft, Cisco, HP, MCI); the study documents the early CRM market consolidation that culminated in Nortel's $2.1B acquisition of Clarify in 1999 — one of the most notable enterprise software deals of the era.",medium,"The CIS/CRM market analysis framework, metadata-based customization architecture, and integrated best-of-breed strategy remain analytically useful; specific products (ClearSupport, ClearSales) are obsolete but the customer success management principles and 'linchpin account' strategy remain relevant.",high,"Aberdeen correctly predicted Clarify's continued rapid growth and strong position in IT/telecom markets; Clarify was acquired by Nortel for $2.1B in 1999, validating the 'CIS winner' assessment. The prediction of CIS market consolidation and Aberdeen's specific identification of Clarify as a leader proved accurate."
aberdeen-1996-computer-telephony-integration,Internet Architecture: Prescription For Success,Aberdeen Group,1996-04-17,white-paper,internet-intranet-architecture,"industry-analysis, competitive-profiling, document-review",1996 New Computer Telephony Integration_ Doe...nization Have the Backbone to Succeed tvp.pdf,"Aberdeen Group prescribes an enterprise Internet/Intranet architecture for 1996, arguing that long-term value lies in the Intranet rather than public Internet. The study recommends a scalable architecture combining TP-monitor-like middleware, 64-bit VLM server hardware, parallel-scalable RDBMSs, and second-generation CADEs. Aberdeen dismisses Java as immature and warns that enterprises without proper architectural foundations will find that short-term Internet success blocks long-term success.",CC-BY-4.0,high,"Published at the apex of the first Internet boom, this Viewpoint articulated the Intranet-first strategy at a moment of maximum enterprise confusion about Internet vs. Intranet priorities; Aberdeen's architectural framework influenced thousands of IS decisions in 1996-1997.",high,"The core architectural principles—TP-monitor-like middleware for scalability, separation of web presentation from data tiers, metadata repositories—are directly ancestral to modern microservices, API gateways, and cloud-native architectures still in use today.",high,Aberdeen's prediction that Java would be limited near-term as a '3GL without 4GL extensions' proved accurate for 1996-1998; the Intranet-first thesis proved correct as enterprises deployed intranets before public e-commerce matured; middleware and RDBMS scalability predictions all materialized.
