study_id,title,author,date,type,subject_domain,methodology,source_file,abstract,license,importance,importance_rationale,relevance,relevance_rationale,prescience,prescience_rationale
aberdeen-1996-managing-customers-next-gen-helpdesk,Managing Customers with Next-Generation Software Applications: 1996 Edition,Aberdeen Group,1996-10-01,market-study,customer-interaction-software-CRM,"industry-analysis, competitive-profiling, field-research",1996 Managing Customers with Next-Generation... Helpdesk -- Customer Support Software.pdf,"Aberdeen Group's second report on the Customer Interaction Software (CIS) market defines the category encompassing sales force automation, helpdesk, field service, telemarketing, and related technologies. The study profiles over 40 CIS suppliers, identifies market dynamics, and advises IS executives that CIS is the key to building long-term profitable customer relationships while warning that most of the hundreds of suppliers will not survive long-term.",CC-BY-4.0,high,This study was an early and comprehensive market definition of what would become CRM software—a category that grew to $40+ billion annually. Aberdeen's 1996 CIS framework anticipated the consolidation and key functionality that shaped CRM platforms for the next three decades.,medium,"The CIS/CRM software category Aberdeen defined is now a major enterprise software sector. The analytical framework (modules, integration, supplier profiles) remains directly applicable, though specific vendors have largely consolidated or disappeared.",high,"Aberdeen predicted massive market consolidation ('only a few will be around long-term') and identified companies like Siebel Systems, Oracle, and Remedy that became market leaders. The prediction of Internet CIS implications proved accurate as web-based CRM became standard. Dozens of the 40+ profiled vendors were acquired or shut down within 10 years."
aberdeen-1996-microsoft-windows-nt-server-40,Windows NT Server 4.0 — A Giant Step Forward,Aberdeen Group,1996-07-01,market-study,network-operating-system-server,"industry-analysis, competitive-profiling, field-research, expert-opinion",1996 Microsoft Corporation -- Windows NT Server 4.0 -- A Giant Step Forward pr.pdf,"Aberdeen Group evaluates Microsoft Windows NT Server 4.0, concluding that it is 'a giant step forward' for the network operating system market. The study analyzes NT 4.0's improvements in convenience, Internet/intranet integration, network connectivity, and performance, positioning it as the dominant application server for workgroups and departments while predicting it will displace Novell NetWare and other competitors to become the dominant NOS platform.",CC-BY-4.0,high,"This profile was published at the August 1996 release of Windows NT Server 4.0, a pivotal product that transformed the enterprise server market. Aberdeen's early institutional endorsement carried significant IS buyer influence, and the study captures the competitive dynamics that would determine Microsoft's decade-long server dominance.",medium,"The specific product (Windows NT Server 4.0) is long superseded, but the competitive dynamics Aberdeen analyzed (Microsoft vs. Novell/Unix for enterprise workloads) defined the server market for a decade. The analysis of Internet/intranet integration is historically significant as a contemporaneous view of the pivotal 1996 moment.",high,"Aberdeen correctly predicted NT Server would become the dominant application server platform, correctly identified Novell NetWare's decline trajectory, and accurately predicted that ISV application support would determine the long-term winner. NT 4.0 and its successors (Windows 2000, Server 2003) dominated enterprise server deployments through the 2000s."
aberdeen-1996-mitels-nevadanetworked-voice-data-speeding-toward,Mitel's NeVaDa (Networked Voice and Data) – Speeding Toward Convergence,Aberdeen Group,1996-04-02,market-study,telecommunications-CTI,"industry-analysis, competitive-profiling, field-research",1996 Mitel NeVaDa Networked Voice Data speeding toward.pdf,"Aberdeen Group profiles Mitel Corporation's NeVaDa (Networked Voice and Data) platform, announced April 2, 1996, as a strategic move to transform Mitel's SX-2000 PBX into an integrated voice-data-video server on a broadband ATM/SONET enterprise backbone. The study documents the IT industry's growing demand for voice-data convergence, evaluates NeVaDa's modular collapsed-backbone topology with Madge Networks LAN switching, and assesses Mitel's competitive position and strategic risks in the emerging CTI market. Aberdeen concludes NeVaDa is a logical step toward convergence but notes Mitel must move quickly, secure ATM technology, and build credibility in the data networking community.",CC-BY-4.0,medium,"Documented an early enterprise voice-data convergence architecture at a critical juncture, when IT and telecom worlds were just beginning to merge; Mitel's PBX-to-call-server evolution path anticipated UCaaS by a decade, though DEC/Intel/Microsoft partnerships were not yet sufficient to make Mitel a household name in IT.",medium,"The architectural vision — converging voice, data, and video over a single enterprise backbone — directly predicts modern UCaaS, SD-WAN, and WebRTC paradigms. The analytical framework for evaluating PBX-to-IP migration remains applicable to ongoing legacy telephony modernization challenges.",medium,"Aberdeen correctly identified that voice-data convergence would succeed and that IT culture would ultimately define the model, but overestimated Mitel's ability to lead the space; Mitel went through multiple ownership changes and narrowly avoided extinction before becoming a significant Unified Communications vendor by the 2010s."
aberdeen-1996-moving-effectively-next-gen-client-server,Moving Effectively To Next-Generation Client-Server Development,Aberdeen Group,1996-01-12,white-paper,client-server-development-tools-CADE,"industry-analysis, competitive-profiling, field-research, expert-opinion",1996 Moving Effectively To Next-Generation Client-Server Development wp.pdf,"Aberdeen Group white paper, sponsored by Gupta Technologies, argues that first-generation client-server application development environments (CADEs) such as Visual Basic and PowerBuilder are 'topping out' and recommends immediate adoption of next-generation CADEs. The study provides an evaluation framework for next-generation CADE selection and positions Gupta's Centura product as the leading choice for organizations migrating from first-generation toolsets.",CC-BY-4.0,medium,"This white paper captured the mid-1990s industry transition from departmental to enterprise-scale client-server development, identifying the limitations of Visual Basic and PowerBuilder that would drive the next wave of development tool adoption. The CADE evaluation framework was substantive, though the study's vendor-sponsored nature (Gupta) limits its independence.",low,"The specific products (Centura, SQLWindows, PowerBuilder) are largely obsolete. However, the scalability challenges Aberdeen described — application partitioning, deployment automation, repository-based development, 3-tier architecture — directly anticipate modern cloud-native and microservices concerns.",medium,"Aberdeen's prediction that Visual Basic and PowerBuilder shops would face serious scalability constraints proved accurate. However, the resolution was not Centura/Gupta (which was acquired by Unify 2006, then OpenText 2015) but rather Java EE, .NET, and eventually cloud-native frameworks that obviated the CADE category entirely."
aberdeen-1996-ncr-fail-safe-enterprise-nt,NCR: Finally a Fail-Safe Choice For Enterprise NT,Aberdeen Group,1996-05-25,market-study,enterprise-NT-OLTP,"field-research, industry-analysis, competitive-profiling",1996 NCR_ Finally a Fail-Safe Choice For Enterprise NT.pdf,"Aberdeen Group evaluates NCR's Windows NT Server products for mission-critical OLTP applications based on user interviews with early adopters. The study finds that NCR's LifeKeeper, TOP END, and WorldMark servers address NT's enterprise weaknesses in reliability, scalability, and manageability. Aberdeen concludes that NCR has delivered on its 1994 promise and is a 'fail-safe choice' for NT-based OLTP deployment in retail, finance, telecom, and transportation industries.",CC-BY-4.0,high,Published at a pivotal moment when Windows NT was challenging Unix and mainframes for enterprise OLTP workloads; NCR (formerly AT&T GIS) was the leading enterprise NT integrator and this Aberdeen Viewpoint shaped early-adopter decisions in 1996.,medium,"NT-specific product details are obsolete, but the study's framework for evaluating RAS (Reliability, Availability, Serviceability) requirements for OS platform transitions remains applicable to modern cloud/edge migration decisions.",high,Aberdeen's prediction that NT SMP scalability would reach 8-12 CPUs by mid-1997 proved accurate with NT Server 4.0 Enterprise Edition and SQL Server 6.5/7.0; Windows NT's enterprise dominance over Unix for OLTP by 2000 also materialized.
aberdeen-1996-network-appliance-data-appliances,Network Appliance: Data Appliances for Commercial Network Computing,Aberdeen Group,1996-11-01,market-study,network-attached-storage,"industry-analysis, competitive-profiling, field-research",1996 Network Appliance_ Data Appliances for Commercial Network Computing pr.pdf,"Aberdeen Group profiles Network Appliance (NetApp) as a pioneer in network-attached storage (NAS) for commercial computing environments. The study examines NetApp's filer hardware (F220, F330, F540), Data ONTAP software with WAFL file system, and multiprotocol support (NFS, CIFS, HTTP). Aberdeen concludes NetApp is well-positioned to capitalize on the shift from application-server-based storage to dedicated network-attached data servers, citing revenue growth from $2M (1994) to $47M (FY1996) approaching $100M.",CC-BY-4.0,high,Aberdeen identified NetApp at the precise moment the NAS market was emerging as a distinct category; the study's framing of 'data appliance' as a product concept helped define the NAS segment and NetApp grew to become a $6B+ annual revenue company by 2024.,high,"NetApp remains a leading data infrastructure company (NASDAQ: NTAP, ~$6.3B revenue FY2024); the architectural principles of dedicated NAS vs. general-purpose servers underpin modern cloud storage and object storage design decisions.",high,"Aberdeen predicted NetApp would approach $100M revenue in FY1997 (actual FY1997 was ~$166M), and foresaw CIFS and HTTP multiprotocol support as the key differentiator—both proved foundational to NetApp's long-term dominance of enterprise NAS."
aberdeen-1996-object-oriented-three-tier-plus-computing,Object-Oriented Three-Tier-Plus Computing: Client-Server for Adults,Aberdeen Group,1996-02-01,white-paper,client-server-architecture,"field-research, industry-analysis, competitive-profiling",1996 Object-Oriented Three-Tier-Plus Computing wp.pdf,"Aberdeen Group's whitepaper examines the maturation of three-tier client-server computing in 1996, presenting the 'Three-Tier Plus' model that adds MPP/clustered SMP as a fourth tier for data warehousing. The study synthesizes field research from Aberdeen consulting assignments showing that organizations implementing 3-Tier architectures achieve four key business outcomes: improved enterprise efficiency, multi-source information access, scalability for emerging technologies, and superior ROI. Aberdeen argues object-oriented programming is critical for partitioning applications across tiers and predicts NT Server will close the gap with Unix on mid-tier within 24 months.",CC-BY-4.0,high,One of the most comprehensive 1996 frameworks for enterprise client-server architecture; Aberdeen's 'Three-Tier Plus' model captured the evolution from 3-tier to n-tier computing that became the foundation for all modern enterprise application architecture.,high,"The three-tier model (presentation, logic, data) remains the foundational pattern for web applications, microservices, and cloud-native architectures; Aberdeen's 1996 observations on application partitioning, OO programming, and MPP scaling are directly applicable to modern Kubernetes/container architectures.",high,Aberdeen predicted NT Server would close the gap with Unix on mid-tier within 24 months (verified: NT 4.0 achieved this by 1997-1998); predicted MPP machines would achieve broader market acceptance (verified: data warehouse MPP systems became mainstream by 2000); mainframe residual value decline prediction fully confirmed.
aberdeen-1996-omnibox-interactive-broadcasting-network,OmniBox Interactive Broadcasting Network: Bringing Electronic Commerce and Entertainment to the Masses,Aberdeen Group,1996-11-01,market-study,"interactive-TV, e-commerce, digital-broadcasting","industry-analysis, competitive-profiling, expert-opinion",1996 OmniBox Interactive Broadcasting Network pr.pdf,"Aberdeen Group profiles OmniBox, Inc., a Stamford CT startup with patented technology for delivering interactive television, electronic commerce, and digital content to homes via cable, satellite, and the Internet. The study evaluates OmniBox's architecture—comprising compression technology, transaction processing, and set-top hardware—and positions it as the most comprehensive model for home electronic commerce delivery seen to date. Aberdeen predicts OmniBox stands out as an early leader among vendors competing for the nascent 100-million-household US interactive TV market.",CC-BY-4.0,medium,"OmniBox was an Aberdeen vendor profile in the emerging interactive-TV/e-commerce space; while Aberdeen was influential, OmniBox was a small startup and the study filled a niche rather than shaping broad industry direction.",medium,"The architectural vision of converging broadcast content with transactional e-commerce foreshadows streaming+commerce platforms; the specific hardware details (set-top boxes, 28.8Kbps modems) are obsolete.",low,"OmniBox predicted rapid 1997 rollout and mass-market success; the company never achieved commercial scale, was overtaken by cable-modem ISPs and web browsers, and the OmniBox network never materialized as described."
aberdeen-1996-open-market-web-based-commerce,Open Market: Delivering the Infrastructure For Truly Open Web-based Commerce,Aberdeen Group,1996-10-01,market-study,"web-commerce, e-commerce-infrastructure, payment-systems","industry-analysis, competitive-profiling, field-research, expert-opinion",1996 Open Market_ Delivering the Infrastructure For Truly Open Web-based Commerce pr.pdf,"Aberdeen Group profiles Open Market, Inc. (Cambridge, MA), a pioneer in enterprise-grade web commerce infrastructure. The study examines Open Market's product suite—OM-Transact, OM-Axcess, and OM-SecureLink—designed to support many-to-many web-based transactions across multiple content servers and back-office systems. Aberdeen strongly recommends Open Market's platform as the most comprehensive and production-ready solution for enterprises building next-generation electronic commerce infrastructure, and contrasts it favorably against IBM and point-to-point proprietary competitors.",CC-BY-4.0,high,"Open Market was among the first enterprise-grade web commerce platforms at a pivotal moment in e-commerce infrastructure formation (1996); Aberdeen's endorsement to AT&T, BT, MCI, and major banks made this a significant industry signal.",medium,"The many-to-many transaction architecture and CSP model anticipated API-based commerce ecosystems; specific OM-Transact/OM-Axcess products are obsolete, but the conceptual framework for distributed commerce middleware remains instructive.",medium,"Aberdeen correctly predicted that enterprise web commerce would require comprehensive back-office integration beyond simple HTTP servers; however Open Market was acquired by Divine (2001) then went bankrupt (2003), not achieving the sustained market leadership Aberdeen projected."
aberdeen-1996-oracle-network-computing-architecture,Oracle's Network Computing Architecture,Aberdeen Group,1996-10-01,market-study,"enterprise-software, distributed-computing, internet-architecture, RDBMS","industry-analysis, competitive-profiling, expert-opinion, document-review",1996 Oracle's Network Computing Architecture pr.pdf,"Aberdeen Group evaluates Oracle's Network Computing Architecture (NCA), a comprehensive framework integrating multi-tier client-server, Internet, and distributed-object technologies through a 'cartridge' component model and Inter-Cartridge Exchange (ICX) middleware based on CORBA. The study concludes that NCA is not a 'marketecture' but a substantive extension of proven Oracle products providing a least-cost migration path to mission-critical 21st-century transaction processing, and recommends ISVs and enterprise IS factor it into their 1-2 year technology strategies.",CC-BY-4.0,high,Oracle's NCA represented a defining moment in enterprise middleware strategy as the industry transitioned from client-server to Internet architectures; Aberdeen's endorsement of NCA over competing approaches from Microsoft and others carried significant weight with enterprise IT buyers.,medium,"The cartridge/component model anticipated modern microservices and API-based architectures; Oracle's Universal Server became the foundation for Oracle Database which remains active, though NCA-specific cartridge mechanisms are long obsolete.",high,Aberdeen correctly predicted Oracle would dominate enterprise internet database strategy and that component-based architecture would become the standard; Oracle remains a dominant enterprise database and application platform 30 years later.
aberdeen-1996-progress-software-webspeed-internet,Progress Software's WebSpeed: Business Transaction Processing On The Internet,Aberdeen Group,1996-10-01,market-study,"internet-development-tools, transaction-processing, web-application-development","industry-analysis, competitive-profiling, expert-opinion, document-review",1996 Progress Software's WebSpeed_ Business Transaction Processing On The Internet pr.pdf,"Aberdeen Group profiles Progress Software's WebSpeed, an Internet development platform aimed at building data-intensive, scalable web applications that integrate with legacy transaction-processing systems. WebSpeed combines the Progress 4GL development environment with a multi-tier Transaction Server providing TP-monitor-like middleware, state management, and load balancing. Aberdeen recommends WebSpeed to enterprises seeking to merge proven client-server data-management with Internet architecture, and positions Progress as superior to both traditional CADE suppliers and new web-only toolset vendors for data-intensive Internet applications.",CC-BY-4.0,medium,"Progress Software held a meaningful but niche position in the mid-1990s application development market; WebSpeed addressed a real architectural gap but was less influential than Oracle, Microsoft, or Netscape in shaping internet application development at the industry level.",low,"WebSpeed's specific 4GL-based architecture was superseded by Java EE, .NET, and later frameworks; Progress Software survived as a company but WebSpeed is a legacy product primarily of historical interest to researchers studying 1990s internet development tooling.",medium,"Aberdeen correctly identified that state management and TP-monitor middleware would be essential for scalable web apps (validated by J2EE/EJB, later microservices), but WebSpeed itself lost to Java and .NET; Progress Software survived via pivot to OpenEdge and data integration."
aberdeen-1996-remote-access-cisco-untold-story,Remote Access: Cisco's Untold Story,Aberdeen Group,1996-11-25,market-study,"networking, remote-access, ISP-infrastructure, enterprise-networking","industry-analysis, competitive-profiling, field-research, expert-opinion",1996 Remote Access_ Cisco's Untold Story apr.pdf,"Aberdeen Group examines Cisco Systems' remote access strategy as of November 1996, revealing Cisco's 'untold story' of quietly dominating the enterprise branch-to-branch segment (60%+ market share) while making aggressive inroads into the high-end ISP and carrier markets with the AS5200 access server. The study evaluates Cisco's multi-product portfolio (AS5200, 3600, 1600 series), IOS software competitive advantages, and the Telebit MICA technology acquisition, predicting Cisco is better positioned than competitors to serve the rapidly evolving ISP/carrier market.",CC-BY-4.0,high,This study documented Cisco's strategic pivot to the ISP/carrier market at the inflection point when internet access was transitioning from experimental to commercial infrastructure; Cisco's subsequent dominance of this market makes this a historically significant analysis of a turning-point moment.,medium,"Cisco remains dominant in enterprise networking 30 years later; the strategic frameworks (end-to-end solutions, IOS software as moat, acquisition-led tech expansion) remain applicable, though specific products (AS5200, ISDN, modem-based access) are long obsolete.",high,"Aberdeen correctly predicted Cisco would extend leadership to the ISP/carrier market (verified: Cisco became dominant in ISP infrastructure by 1999-2000), that IOS software would be Cisco's durable competitive moat, and that internet access would commoditize driving ISP consolidation—all of which materialized."
aberdeen-1996-risc-unix-market,"Commercial, Multiuser Risc/Unix 1995: High Growth and HP Dominate",Aberdeen Group,1996-02-12,market-study,commercial-unix-platforms,"market-analysis, competitive-profiling, revenue-benchmarking",1995-Commercial-Multiuser-Risc_Unix-1995_-High-Growth-and-HP-Dominate-mvp-3.pdf,"This Aberdeen Group Market Viewpoint (Volume 9, Number 5, February 12, 1996) presents the firm's sixth annual review and analysis of the worldwide commercial, multiuser RISC/Unix systems market. The study measures market size and growth by end-user revenue for core system platform components—RISC-based multiuser servers with attached mass storage, Unix operating system and systems software licenses, and direct installation and maintenance services—deployed for production OLTP, decision support, and batch processing workloads. The methodology combines primary field research (IS-executive interviews), revenue benchmarking against supplier-reported and estimated figures, and competitive profiling of the leading and niche platform vendors. Key findings reveal that the worldwide commercial RISC/Unix market reached $14.3 billion in 1995, a 43% increase over 1994's $10.0 billion, far outpacing PC market growth (25%) and mainframe growth (~5%). Hewlett-Packard dominated with $7.0 billion in revenue (57% growth, 49% share), maintaining its position as number-one for the sixth consecutive year; IBM ranked second at $2.75 billion (45% growth, 19% share) driven largely by its RS/6000 SP massively-parallel system and ISSC professional services engagements; Sun Microsystems placed third at $1.3 billion (35% growth, 9% share), establishing Solaris as a credible production environment. Digital Equipment Corporation posted the highest growth rate (73%) reaching $475 million, anchored by a world-record TPC-C result of over 11,000 tpmC achieved in conjunction with Oracle. Among the unique-strength suppliers, SNI/Pyramid reached $825 million (+10%), Data General $620 million (+11%), ICL/Fujitsu $340 million (flat), Bull $300 million, and Tandem $250 million (+32%). By contrast, the top three Intel/Unix suppliers (AT&T GIS/NCR, Unisys, Sequent) combined for only $2.26 billion—roughly one-fifth of the top-three RISC/Unix total of $11.05 billion—with AT&T GIS and Unisys both posting significant losses and revenue declines. Microsoft NT Server, despite widespread anticipation, failed to displace RISC/Unix for business-critical production applications in 1995 due to scalability and stability issues; NT 4.0 was not expected until April 1996. Aberdeen's forward-looking conclusions project continued 40%+ growth for the RISC/Unix market in 1996, driven by expansion of production applications already deployed and movement of 1995 prototypes into production. The study predicts HP will further increase its market share as enterprises standardize on a single Unix/RISC platform, that NT Server will complement rather than displace RISC/Unix, and that all major RISC/Unix suppliers except IBM will transition to 64-bit operating environments during 1996. The year-2000 mainframe replacement cycle is identified as an incremental opportunity. Four product agenda items—production Unix functionality advances, 64-bit transitions, workgroup interoperability (Novell NetWare and NT Server), and MPP platform maturation—are prescribed for all leading suppliers in 1996.",CC-BY-4.0,high,"Definitive annual market measurement of the $14.3B commercial RISC/Unix market at its peak growth year (43% YoY); Aberdeen's vendor-by-vendor revenue data shaped purchasing and investment decisions across HP, IBM, Sun, DEC and their enterprise customers.",medium,"Frameworks for enterprise server market analysis (revenue benchmarking by vendor, growth rates, market share) remain standard; specific RISC/Unix market is archival as Linux x86 displaced proprietary RISC/Unix by 2005; HP-UX EOL December 2025.",medium,6 of 8 predictions confirmed: HP market share leadership sustained through 1997; 64-bit transitions delivered; NT complemented rather than displaced RISC/Unix through 2000; MPP matured; Y2K opportunity materialized. However the predicted 40%+ growth continuation was incorrect—RISC/Unix growth slowed sharply as Linux x86 emerged faster than Aberdeen anticipated.
