"tech_id","tech_name","category","vendor","era","lifecycle_at_study","lifecycle_current","study_id","notes"
"TECH-LAP-001","LapLink (Remote Control Software)","Remote Access Utility","Traveling Software","1983-present","Mature / Evolving","Active (pivoted to PCmover; remote control feature legacy)","1997-laplink-solutions-offer-telecommuti-292aa8","Remote control and file transfer software; SpeedSync reduces transfer times 80%; Aberdeen's study subject"
"TECH-LAP-002","Remote Control Architecture","Networking Architecture","Multiple","1980s-2000s","Active","Superseded by RDP/VPN/cloud","1997-laplink-solutions-offer-telecommuti-292aa8","Runs all apps on host CPU with only keystrokes/mouse transmitted to remote; bandwidth-efficient for dial-up; LapLink's core architecture"
"TECH-LAP-003","Remote Node Architecture","Networking Architecture","Multiple (built into Windows)","1990s-present","Emerging (in Windows 95/NT)","Superseded by VPN","1997-laplink-solutions-offer-telecommuti-292aa8","Client-server approach built into Windows 95/NT Dial-Up Networking; suited for small file transfers/email not bandwidth-intensive apps"
"TECH-LAP-004","SpeedSync","File Synchronization","Traveling Software","1996-2000s","Active","Defunct (superseded by cloud sync)","1997-laplink-solutions-offer-telecommuti-292aa8","Proprietary file synchronization transferring only changed file portions; reduces transfer times by up to 80%"
"TECH-LAP-005","Dial-Up Networking","WAN Connectivity","Multiple","1990s-2005","Dominant (for telecommuters)","Obsolete (replaced by broadband/VPN)","1997-laplink-solutions-offer-telecommuti-292aa8","Most prevalent connectivity for telecommuters in 1997; modem-based dial-up; phased out as broadband adoption grew post-2000"
"TECH-LAP-006","Remote Desktop Protocol (RDP)","Remote Access","Microsoft","1998-present","Not yet available at study","Dominant standard","1997-laplink-solutions-offer-telecommuti-292aa8","Microsoft's built-in remote desktop solution (introduced in Windows NT 4.0 Terminal Server 1998); eventually superseded LapLink remote control"
"TECH-LAP-007","VPN (Virtual Private Network)","Network Security","Multiple","1996-present","Emerging","Dominant","1997-laplink-solutions-offer-telecommuti-292aa8","Encrypted tunneling solution that became dominant remote access approach post-2000; supplanted LapLink dial-up remote control"
