"tech_id","tech_name","category","vendor","era","lifecycle_at_study","lifecycle_current","study_id","notes"
"digital-vax","Digital VAX/OpenVMS","platform","Digital Equipment Corporation","1977-1999","mature","legacy","dectp-genspark-research2-4-a09a82","DECtp built on VAX; VAX 9000-210 and VAX 4000-300 published TPC-A results."
"ibm-cics","IBM CICS TP Monitor","platform","IBM","1968-present","dominant","active","dectp-genspark-research2-4-a09a82","IBM's dominant TP monitor; massive installed base; primary competitive target for DECtp."
"tpc-benchmark","TPC (Transaction Processing Performance Council) Benchmarks","benchmark","TPC (consortium)","1988-present","founding","active","dectp-genspark-research2-4-a09a82","TPC formed August 1988; DEC adopted TPC-A for benchmarking strategy."
"oracle-rdb","Oracle Rdb","application","Digital Equipment Corporation / Oracle","1984-present","active","legacy","dectp-genspark-research2-4-a09a82","VAX Rdb Version 3.0; five-fold performance increase; up to 50GB data; DECtp launch component."
"oltp","Online Transaction Processing (OLTP)","application","various","1970s-present","dominant","current","dectp-genspark-research2-4-a09a82","Core DECtp market; 5% DEC share pre-launch; target 10-15% by 1991."
"client-server","Client-Server Architecture","framework","various","1980s-2000s","emerging","legacy","dectp-genspark-research2-4-a09a82","Emerging architecture that would undermine DECtp minicomputer-centric approach."
"vax-acms","VAX ACMS (Application Control and Management System)","platform","Digital Equipment Corporation","1980s-1990s","active","unknown","dectp-genspark-research2-4-a09a82","Version 3.0 at DECtp launch; 4GL approach; 5-20 TPS range; £3,800-£56,612 pricing."
"decintact","DECintact","platform","Digital Equipment Corporation","1988-1990s","new","unknown","dectp-genspark-research2-4-a09a82","Version 1.0 at DECtp launch; based on Advanced Systems Concepts Intact product; 6-53 TPS range; £5,290-£77,316."
