"entity_id","entity_name","entity_type","sector","status","successor","years_active","study_id","notes"
"aberdeen-group","Aberdeen Group","firm","industry-analyst","acquired","Harte-Hanks (2002-2017) -> Spiceworks Ziff Davis","1988-present","technology-news-future-tech-microsoft-la-625f49","Boston-based IT industry analyst firm"
"peter-s-kastner","Peter S. Kastner","person","industry-analyst","active","","1970s-present","technology-news-future-tech-microsoft-la-625f49","EVP / chief research officer / research VP; various titles 1988-2007"
"microsoft","Microsoft Corporation","company","software","active","","1975-present","technology-news-future-tech-microsoft-la-625f49","Redmond WA software company"
"intel-corporation","Intel Corporation","company","semiconductor","active","","1968-present","technology-news-future-tech-microsoft-la-625f49","Leading x86 CPU manufacturer"
"amd","Advanced Micro Devices, Inc.","company","semiconductor","active","","1969-present","technology-news-future-tech-microsoft-la-625f49","x86 and more recently GPU competitor to Intel"
"technewsworld","TechNewsWorld / ECT News Network","firm","news-media","active","","2000-present","technology-news-future-tech-microsoft-la-625f49","IT news publication; part of ECT News Network (E-Commerce Times, LinuxInsider, CRM Buyer)"
"jay-lyman-journalist","Jay Lyman","person","journalist","active","","2000s-present","technology-news-future-tech-microsoft-la-625f49","TechNewsWorld / ECT News Network staff writer; later 451 Research / S&P Global Market Intelligence analyst"
"gartner-inc","Gartner, Inc.","firm","industry-analyst","active","","1979-present","technology-news-future-tech-microsoft-la-625f49","Stamford CT IT research and advisory firm"
"martin-reynolds-gartner","Martin Reynolds","person","industry-analyst","active","","1990s-present","technology-news-future-tech-microsoft-la-625f49","Gartner research vice president covering semiconductors and client computing"
