"tech_id","tech_name","category","vendor","era","lifecycle_at_study","lifecycle_current","study_id","notes"
"amd-athlon-64","AMD Athlon 64 processor","chip","AMD","2003-2009","new","legacy-supplanted","technology-news-hardware-amd-makes-athlo-214a36","AMD first desktop 64-bit CPU (Sep 2003, K8 microarchitecture); brought AMD64 ISA to consumer desktops ahead of Intel EM64T"
"amd64-architecture","AMD64 / x86-64 architecture (Opteron/Athlon 64)","chip","AMD","2003-present","new","mature","technology-news-hardware-amd-makes-athlo-214a36","AMD 64-bit extension of x86 (Opteron Apr 2003, Athlon 64 Sep 2003); Intel adopted as Intel 64 (EM64T) 2004; became dominant 64-bit desktop/server ISA"
"laptop-notebook-pc","Laptop / notebook PC","platform","industry","1985-present","mature","active","technology-news-hardware-amd-makes-athlo-214a36","Portable clamshell PCs; thin-and-light category emerged 2003-2005; overtook desktops in unit sales ~2008"
"windows-xp-sp2","Microsoft Windows XP Service Pack 2","operating-system","Microsoft","2004-2014","new","end-of-life","technology-news-hardware-amd-makes-athlo-214a36","Major XP service pack Aug 2004; added Windows Security Center, firewall on by default, NX bit / DEP, Bluetooth stack; fundamental XP security overhaul"
"nx-bit-dep","NX bit / Data Execution Prevention (DEP) / Enhanced Virus Protection","chip","AMD/Intel","2003-present","new","mature","technology-news-hardware-amd-makes-athlo-214a36","Hardware no-execute page-protection bit; AMD branded ""Enhanced Virus Protection""; Intel ""XD bit""; OS support in Windows XP SP2 (2004), Linux PaX; blocks code-injection malware"
"windows-xp-64bit","Microsoft Windows XP 64-bit Edition / Windows XP Professional x64 Edition","operating-system","Microsoft","2005-2014","new","legacy-supplanted","technology-news-hardware-amd-makes-athlo-214a36","Microsoft 64-bit Windows XP; Itanium edition 2001, AMD64/x64 edition 2005; released in beta Feb 2004; limited driver/application support; displaced by Windows Vista/7 x64"
