"tech_id","tech_name","category","vendor","era","lifecycle_at_study","lifecycle_current","study_id","notes"
"TECH-S2-001","Lotus Notes / Domino","collaboration-groupware","Lotus/IBM","1989-2021","growth","legacy","1997-ibm-s-solution-centric-global-healt-7a073f","Used for Kaiser Permanente case management; HCL Software acquired Notes/Domino from IBM in 2018"
"TECH-S2-002","IBM MedSpeak/Radiology","speech-recognition","IBM","1996-2003","early-growth","obsolete","1997-ibm-s-solution-centric-global-healt-7a073f","Continuous speech recognition for radiology dictation; discontinued; Dragon Medical (Nuance) became market leader"
"TECH-S2-003","IBM ClinWare","clinical-trials-software","IBM","1996-2000s","early-growth","obsolete","1997-ibm-s-solution-centric-global-healt-7a073f","Clinical trials management for pharma; IBM later exited clinical trials software market"
"TECH-S2-004","IBM HealthVillage","consumer-health-portal","IBM","1997-2000s","launch","obsolete","1997-ibm-s-solution-centric-global-healt-7a073f","Internet-based health information portal for health plan members; discontinued in early 2000s"
"TECH-S2-005","IBM Tivoli (TME)","systems-management","IBM/Tivoli","1994-present","growth","active","1997-ibm-s-solution-centric-global-healt-7a073f","Systems management framework; Tivoli acquired by IBM 1996; rebranded IBM Tivoli; still active"
"TECH-S2-006","Electronic Health Records (EHR)","clinical-information-system","various","1960s-present","early-growth","dominant","1997-ibm-s-solution-centric-global-healt-7a073f","Aberdeen discusses next-generation healthcare IS adoption; EHR became mandated under HITECH 2009"
"TECH-S2-007","IBM Health Data Network","health-information-exchange","IBM","1997-2000s","launch","obsolete","1997-ibm-s-solution-centric-global-healt-7a073f","Legacy system integration and enterprise patient data consolidation; evolved into broader HIE market"
"TECH-S2-008","RDBMS / Relational Database Management","database","various","1980s-present","mature","dominant","1997-ibm-s-solution-centric-global-healt-7a073f","Client-server RDBMS adoption in healthcare; replaced proprietary mainframe/minicomputer systems"
