tech_id,tech_name,category,vendor,era,lifecycle_at_study,lifecycle_current,study_id,notes
TECH-LUC-001,Internet Telephony Server SP,VoIP Gateway Platform,Lucent Technologies,1997-2002,Emerging,Obsolete (superseded by softswitch/SIP),1997-lucent-delivers-internet-telephony--888598,"First scalable carrier-grade VoIP gateway; 24+ ports; POTS-to-POTS capability; Aberdeen's product of focus"
TECH-LUC-002,Voice over IP (VoIP),Communication Technology,Multiple,1996-present,Emerging,Dominant / universal,1997-lucent-delivers-internet-telephony--888598,"Core enabling technology; routing voice and fax over IP networks; became standard for all voice communications by 2010s"
TECH-LUC-003,SX7300P Speech Codec,Voice Compression,elemedia (Lucent),1996-2000s,Emerging,Obsolete (superseded by G.729 Opus SILK),1997-lucent-delivers-internet-telephony--888598,"elemedia's proprietary voice codec delivering near toll-grade sound quality; adopted by Netscape Media Server"
TECH-LUC-004,Internet Protocol (IP) Networks,Networking Protocol,IETF (open standard),1970s-present,Dominant,Dominant,1997-lucent-delivers-internet-telephony--888598,Carrier network protocol enabling internet telephony; rapidly expanding in service provider networks
TECH-LUC-005,POTS (Plain Old Telephone Service),Legacy Telephony,Multiple telcos,1876-2020s,Dominant,Declining/being phased out,1997-lucent-delivers-internet-telephony--888598,"Traditional circuit-switched telephone network; Lucent's solution enables POTS-to-POTS calling over IP without user behavior change"
TECH-LUC-006,SIP (Session Initiation Protocol),VoIP Signaling,IETF,1999-present,Not yet standardized at study,Dominant VoIP standard,1997-lucent-delivers-internet-telephony--888598,"Eventual dominant VoIP signaling protocol (RFC 2543 1999); superseded proprietary gateway approaches like Lucent's initial implementation"
TECH-LUC-007,H.323,VoIP Signaling,ITU-T,1996-2000s,Emerging,Legacy/declining (superseded by SIP),1997-lucent-delivers-internet-telephony--888598,"Early VoIP signaling standard; competed with SIP; eventually lost to SIP for most applications"
TECH-LUC-008,Class Based Queuing (CBQ),Network QoS,Multiple,1990s-present,Emerging,Active (QoS mechanisms standard),1997-lucent-delivers-internet-telephony--888598,"QoS mechanism for managing bandwidth; relevant for internet telephony quality of service guarantees"
