entity_id,entity_name,entity_type,sector,hit_count,first_context
aberdeen-group,Aberdeen Group,firm,IT market analysis,3,nic Commerce And Entertainment To The Masses   ## Preface   Aberdeen Group believes that North American society is about to change in
omnibox-inc,"OmniBox, Inc.",company,interactive-television,2,"**==> picture [240 x 82] intentionally omitted <==**  ## _OmniBox, Inc._   100 First Stamford Place Suite 550 Stamford, CT 06902 (2"
susan-rinehart,Susan Rinehart,person,Aberdeen Marketing,1,"Tel: 617.723.7890 Fax: 617.723.7897_   Contact Information: Susan Rinehart, Client Services Manager(direct #: 617.854.5212) David Bord"
time-warner-cable,Time Warner Cable,company,cable-mso,1,em supplier to successfully demonstrate this integration on Time Warner Cable’s Quantum system in New York City. OmniBox’s analog/digital
directtv,DirecTV,company,broadcast,1,"lite information service (and Hughes’ companion TV product, DirecTV) by its ability to span both TV and PC; its architectural f"
primestar,Primestar,company,direct-broadcast-satellite,1,"its own cable hardware or to alternate settop hardware from Primestar, Phillips and others. OmniBox’s technology is also compatib"
