"tech_id","tech_name","category","vendor","era","lifecycle_at_study","lifecycle_current","study_id","notes"
"linux","Linux","platform","Open Source","1991-present","emerging","active","2003-dell-and-oracle-boldly-predict-the-demise-of-big-i-073fba","Core of Dell/Oracle cluster vision; predicted to replace proprietary OSes"
"x86-commodity-servers","x86 Commodity Servers","platform","Dell/HP/IBM","1990-present","mature","active","2003-dell-and-oracle-boldly-predict-the-demise-of-big-i-073fba","Dell's hardware in the clustered data center vision"
"oracle-9i-rac","Oracle9i Real Application Clusters","application","Oracle","2001-2005","mature","obsolete","2003-dell-and-oracle-boldly-predict-the-demise-of-big-i-073fba","Oracle's clustered database; key enabler of the Dell cluster vision"
"blade-servers","Blade Servers","platform","Multiple","2001-present","emerging","active","2003-dell-and-oracle-boldly-predict-the-demise-of-big-i-073fba","Referenced in keywords as part of scale-out architecture"
"grid-computing","Grid Computing","framework","Multiple","2000-2010","emerging","obsolete","2003-dell-and-oracle-boldly-predict-the-demise-of-big-i-073fba","Grid computing referenced; evolved into cloud computing"
"big-iron","Big Iron (Mainframes / Large Unix Servers)","platform","IBM/HP/Sun","1950-present","mature","active","2003-dell-and-oracle-boldly-predict-the-demise-of-big-i-073fba","Target of Dell/Oracle prediction; still active in 2026 with ~6000 shops"
"linux-cluster","Linux Server Clusters","platform","Dell/Multiple","2000-present","emerging","active","2003-dell-and-oracle-boldly-predict-the-demise-of-big-i-073fba","Core of Dell/Oracle shared vision; became cloud computing substrate"
