entity_id,entity_name,entity_type,sector,status,successor,years_active,study_id,notes
DEC,Digital Equipment Corporation,company,computer-hardware-software,acquired,Compaq (1998) then HP (2002),1957-1998,dtj-v03-01-tp-and-fault-tolerant-1991-cf078c,Primary publisher and subject; headquartered in Maynard MA; Peter S. Kastner led Marketing and the DECtp product work documented in this journal
ibm,International Business Machines Corporation,company,computer-hardware-software,active,[none],1911-present,dtj-v03-01-tp-and-fault-tolerant-1991-cf078c,Referenced as owner of SNA LU6.2 communication protocol; trademark acknowledged in journal
transaction-processing-performance-council,Transaction Processing Performance Council (TPC),institution,standards-body,active,[none],1988-present,dtj-v03-01-tp-and-fault-tolerant-1991-cf078c,Owns TPC Benchmark A trademark; Waterside Associates (Menlo Park CA) administers benchmark specification
carlos-g-borgialli,Carlos G. Borgialli,person,transaction-processing,unknown,[none],1991,dtj-v03-01-tp-and-fault-tolerant-1991-cf078c,"Senior Manager, DECtp Software Engineering at DEC; wrote Foreword to this journal issue"
philip-a-bernstein,Philip A. Bernstein,person,database-research,active,[none],1987-present,dtj-v03-01-tp-and-fault-tolerant-1991-cf078c,Senior consultant engineer and architecture consultant in DEC Transaction Processing Systems Group and Cambridge Research Lab; prior professor at Wang Institute and Harvard; co-author DECdta architecture paper; lead author on seminal distributed database textbook
william-t-emberton,William T. Emberton,person,transaction-processing,unknown,[none],1987-1991,dtj-v03-01-tp-and-fault-tolerant-1991-cf078c,Principal software engineer at DEC; DECtp product architecture team; X/Open and POSIX TP standards work; prior Director of Software Development at National Semiconductor and NCR
vijay-trehan,Vijay Trehan,person,transaction-processing,unknown,[none],1978-1991,dtj-v03-01-tp-and-fault-tolerant-1991-cf078c,Technical director responsible for DECtp architecture design and standards; architect of DECdtm protocol and DDIF; joined DEC 1978
thomas-g-speer,Thomas G. Speer,person,transaction-processing,unknown,[none],1981-1991,dtj-v03-01-tp-and-fault-tolerant-1991-cf078c,Principal software engineer in DECtp/East Engineering Group; leading DECintact V2.0 project; joined DEC 1981
mark-w-storm,Mark W. Storm,person,transaction-processing,unknown,[none],1976-1991,dtj-v03-01-tp-and-fault-tolerant-1991-cf078c,Consulting engineer; original designer of ACMS monitor; acting technical director for East Coast TP Engineering Group; joined DEC 1976
william-a-laing,William A. Laing,person,operating-systems,unknown,[none],1981-1991,dtj-v03-01-tp-and-fault-tolerant-1991-cf078c,Senior consultant engineer based in Newbury England; technical leader for VMS production systems; designed SMP support for VMS; responsible for DECdtm design and implementation
james-e-johnson,James E. Johnson,person,operating-systems,unknown,[none],1984-1991,dtj-v03-01-tp-and-fault-tolerant-1991-cf078c,Consulting software engineer in VMS Engineering Group; project leader VMS Engineering Europe; led RMS project; designed DECdtm services; patent application for two-phase commit optimization
robert-v-landau,Robert V. Landau,person,operating-systems,unknown,[none],1987-1991,dtj-v03-01-tp-and-fault-tolerant-1991-cf078c,Principal software engineer in VMS Engineering Group Newbury England; project leader for VMS advanced development high-performance flat file system
walter-h-kohler,Walter H. Kohler,person,performance-engineering,unknown,[none],1988-1991,dtj-v03-01-tp-and-fault-tolerant-1991-cf078c,Software engineering senior manager responsible for TP system performance measurement; leads Digital's TP benchmark standards activities; prior professor at University of Massachusetts Amherst; IEEE/CS Meritorious Service Award recipient
yun-ping-hsu,Yun-Ping Hsu,person,performance-engineering,unknown,[none],1987-1991,dtj-v03-01-tp-and-fault-tolerant-1991-cf078c,Principal software engineer in TP Systems Performance and Characterization Group; TPC Benchmark A standardization activity 1989
thomas-k-rogers,Thomas K. Rogers,person,performance-engineering,unknown,[none],1988-1991,dtj-v03-01-tp-and-fault-tolerant-1991-cf078c,Project leader for TP Systems Performance and Characterization Group; responsible for VAX 9000 Model 210 TPC Benchmark A testing; prior Sperry Corporation
wael-h-bahaa-el-din,Wael H. Bahaa-El-Din,person,database-performance,unknown,[none],1987-1991,dtj-v03-01-tp-and-fault-tolerant-1991-cf078c,Senior consultant to DEC Systems Performance Group Database Systems; PhD Ohio State 1984; prior assistant professor University of Houston
william-z-zahavi,William Z. Zahavi,person,performance-engineering,unknown,[none],1987-1991,dtj-v03-01-tp-and-fault-tolerant-1991-cf078c,Engineering manager for predictive sizing tools for TP applications; prior technical consultant Sperry Corporation; MBA Northeastern University
frances-a-habib,Frances A. Habib,person,performance-engineering,unknown,[none],1987-1991,dtj-v03-01-tp-and-fault-tolerant-1991-cf078c,Principal software engineer developing TP workload characterization and sizing tools; prior Data General and GTE Laboratories; MS Operations Research MIT
kenneth-j-omahen,Kenneth J. Omahen,person,performance-engineering,unknown,[none],1987-1991,dtj-v03-01-tp-and-fault-tolerant-1991-cf078c,Principal engineer developing object-oriented queuing network solvers; prior Bell Telephone Laboratories and Purdue University faculty
ananth-raghavan,Ananth Raghavan,person,database-engineering,unknown,[none],1988-1991,dtj-v03-01-tp-and-fault-tolerant-1991-cf078c,Software engineer leading KODA/Rdb Group projects; two patent applications for undo and undo/redo database algorithms
t-k-rengarajan,T. K. Rengarajan,person,database-engineering,unknown,[none],1987-1991,dtj-v03-01-tp-and-fault-tolerant-1991-cf078c,Member of DEC Database Systems Group since 1987; works on KODA software kernel; WORM devices and global buffer management in VAXcluster
peter-m-spiro,Peter M. Spiro,person,database-engineering,unknown,[none],1985-1991,dtj-v03-01-tp-and-fault-tolerant-1991-cf078c,"Principal software engineer optimizing database technology for RISC; worked on KODA access methods, journaling, recovery, transaction protocols; patent pending for database journaling and recovery method"
ashok-m-joshi,Ashok M. Joshi,person,database-engineering,unknown,[none],1987-1991,dtj-v03-01-tp-and-fault-tolerant-1991-cf078c,Principal software engineer on KODA subsystem for Rdb/VMS and DBMS; developed hash indexing and record placement for Rdb/VMS; IIT Bombay and University of Wisconsin
william-f-bruckert,William F. Bruckert,person,hardware-engineering,unknown,[none],1969-1991,dtj-v03-01-tp-and-fault-tolerant-1991-cf078c,Consulting engineer; joined DEC 1969; architect of VAXft 3000 system; previously designed cache/memory/IO subsystem for VAX 8600 and was architect of VAX 8650; holds seven patents
carlos-alonso,Carlos Alonso,person,hardware-engineering,unknown,[none],1984-1991,dtj-v03-01-tp-and-fault-tolerant-1991-cf078c,Principal software engineer and team leader for System-V OS port to VAXft 3000; prior project leader for VAXft 3000 system validation; developed VMS Distributed Lock Manager concurrency control test bed
james-m-melvin,James M. Melvin,person,hardware-engineering,unknown,[none],1984-1991,dtj-v03-01-tp-and-fault-tolerant-1991-cf078c,Principal design engineer for VAXft hardware error-handling specifications; engineering project leader for future VAXft systems; holds three patents on VAXft 3000 error handling
jane-c-blake,Jane C. Blake,person,technical-publishing,unknown,[none],1991,dtj-v03-01-tp-and-fault-tolerant-1991-cf078c,Editor of the Digital Technical Journal; wrote Editor's Introduction for this issue
samuel-h-fuller,Samuel H. Fuller,person,research,unknown,[none],1991,dtj-v03-01-tp-and-fault-tolerant-1991-cf078c,Chairman of the Digital Technical Journal Advisory Board
x-open-company,X/Open Company Ltd.,institution,standards-body,unknown,unknown,1984-2002,dtj-v03-01-tp-and-fault-tolerant-1991-cf078c,Industry consortium developing open standards APIs for TP; X/Open Transaction Processing Working Group developing standard APls referenced in DECdta architecture
iso,International Organization for Standardization,institution,standards-body,active,[none],1947-present,dtj-v03-01-tp-and-fault-tolerant-1991-cf078c,Developing OSI-TP (Open Systems Interconnection Transaction Processing) wire protocols for multi-vendor TP interoperability
ieee,Institute of Electrical and Electronics Engineers,institution,standards-body,active,[none],1884-present,dtj-v03-01-tp-and-fault-tolerant-1991-cf078c,POSIX TP standard referenced as target API for DECdta interoperability
codasyl,Conference on Data Systems Languages (CODASYL),institution,standards-body,unknown,unknown,1959-1984,dtj-v03-01-tp-and-fault-tolerant-1991-cf078c,CODASYL FIMS Committee produced FIMS standard implemented by DECforms; CODASYL data model implemented by VAX DBMS
sperry-corporation,Sperry Corporation,company,computer-hardware,acquired,Unisys (1986),1933-1986,dtj-v03-01-tp-and-fault-tolerant-1991-cf078c,Prior employer of Thomas Rogers and William Zahavi; referenced in biographies
national-semiconductor,National Semiconductor Corporation,company,semiconductor,acquired,Texas Instruments (2011),1959-2011,dtj-v03-01-tp-and-fault-tolerant-1991-cf078c,Prior employer of William Emberton (Director of Software Development)
ncr,NCR Corporation,company,computer-hardware-software,active,[none],1884-present,dtj-v03-01-tp-and-fault-tolerant-1991-cf078c,Prior employer of William Emberton (Manager of Systems Development for International Retail Systems)
peter-s-kastner,Peter S. Kastner,person,marketing-strategy,active,[none],1988-1991,dtj-v03-01-tp-and-fault-tolerant-1991-cf078c,[KEY CONTEXT] Not a paper author but led the Marketing work at DEC that produced the 1988 DECtp announcement and the overall DECtp product strategy documented in this journal; this journal is a primary record of Kastner's employer-record at DEC
