"entity_id","entity_name","entity_type","sector","status","successor","years_active","study_id","notes"
"sun-microsystems","Sun Microsystems Computer Company (SMCC)","company","computer-hardware-software","acquired","Oracle Corporation (2010)","1982-2010","aberdeen-1996-sun-microsystems-ultracomputing-business","Founded 1982; acquired by Oracle in January 2010 for $7.4B ($5.6B net); Java and Solaris key assets retained by Oracle"
"ibm","IBM Corporation","company","computer-hardware-software","active","","1911-present","aberdeen-1996-sun-microsystems-ultracomputing-business","Key competitor in commercial Unix server market; RS/6000 platform"
"hewlett-packard","Hewlett-Packard Company","company","computer-hardware","active","HP Inc. + HPE (split 2015)","1939-present","aberdeen-1996-sun-microsystems-ultracomputing-business","Key competitor in Unix server market; HP-UX platform; later acquired Compaq/DEC"
"oracle-corporation","Oracle Corporation","company","database-software","active","","1977-present","aberdeen-1996-sun-microsystems-ultracomputing-business","ISV partner; database runs on Solaris; later acquired Sun in 2010"
"javasoft","JavaSoft (Sun subsidiary)","company","software","merged","Merged back into Sun; then Oracle","1996-1999","aberdeen-1996-sun-microsystems-ultracomputing-business","Sun subsidiary for Java platform; Java technology acquired by Oracle in 2010"
"aberdeen-group","Aberdeen Group, Inc.","firm","IT-research","acquired","Harte-Hanks (2001)","1988-present","aberdeen-1996-sun-microsystems-ultracomputing-business","Boston-based IT research firm; publisher"
