"entity_id","entity_name","entity_type","sector","status","successor","years_active","study_id","notes"
"peoplesoft-incorporated","PeopleSoft, Incorporated","company","enterprise-business-applications","acquired","PeopleSoft -> Oracle","1987-2005","1997-peoplesoft-works-the-internet-452445","Pleasanton CA; acquired by Oracle for $10.3B in 2005 after hostile takeover battle"
"aberdeen-group","Aberdeen Group","firm","IT-research","acquired","Aberdeen (Harte-Hanks) -> HFS Research","1988-2014","1997-peoplesoft-works-the-internet-452445","Boston-based IT analyst firm"
"oracle-corporation","Oracle Corporation","company","database-software","active","","1977-present","1997-peoplesoft-works-the-internet-452445","Acquired PeopleSoft in 2005; now markets Oracle PeopleSoft HCM"
"edify-corporation","Edify Corporation","company","telephony-automation","acquired","Edify -> SNET -> EasyLink","1990-2004","1997-peoplesoft-works-the-internet-452445","IVR and telephony integration partner; acquired by EasyLink 2004"
"netdynamics","NetDynamics","company","web-application-development","acquired","NetDynamics -> Sun Microsystems","1995-1999","1997-peoplesoft-works-the-internet-452445","Java web application server maker; acquired by Sun Microsystems 1999"
"onewave","OneWave Inc.","company","enterprise-internet","acquired","OneWave -> BroadVision","1994-1999","1997-peoplesoft-works-the-internet-452445","OpenScape enterprise Internet solutions; acquired by BroadVision"
"talx-corporation","TALX Corporation","company","hr-technology","acquired","TALX -> Equifax","1969-2007","1997-peoplesoft-works-the-internet-452445","HR content/IVR for PeopleSoft; acquired by Equifax for $1.4B in 2007"
"sap","SAP SE","company","enterprise-business-applications","active","","1972-present","1997-peoplesoft-works-the-internet-452445","Implicit EBA competitor context"
