"tech_id","tech_name","category","vendor","era","lifecycle_at_study","lifecycle_current","study_id","notes"
"peoplesoft-7","PeopleSoft Version 7","application","PeopleSoft","1997-2000","emerging","obsolete","1997-peoplesoft-works-the-internet-452445","Release 7 introduced Java client and Internet capabilities; succeeded by PS 8 in 2000"
"peopletools","PeopleTools","framework","PeopleSoft","1988-present","mature","active","1997-peoplesoft-works-the-internet-452445","PeopleSoft's development framework; still active as Oracle PeopleTools"
"java","Java","language","Sun Microsystems","1995-present","emerging","active","1997-peoplesoft-works-the-internet-452445","Universal Applications built as Java applets"
"application-navigator","PeopleSoft Application Navigator","application","PeopleSoft","1997-2005","emerging","obsolete","1997-peoplesoft-works-the-internet-452445","Internet navigational framework; superseded by Oracle's portal approach post-acquisition"
"universal-applications","PeopleSoft Universal Applications","application","PeopleSoft","1997-2005","emerging","obsolete","1997-peoplesoft-works-the-internet-452445","15 pilot self-service modules for occasional users"
"supply-chain-collaborator","PeopleSoft Supply Chain Collaborator","application","PeopleSoft","1997-2005","emerging","obsolete","1997-peoplesoft-works-the-internet-452445","EDI-complement for Internet supply chain planning; free download"
"edi","Electronic Data Interchange","protocol","multiple","1960s-present","mature","legacy-supported","1997-peoplesoft-works-the-internet-452445","Traditional B2B data exchange; Supply Chain Collaborator positioned as complement"
"intranet","Corporate Intranet","framework","multiple","1994-present","emerging","active","1997-peoplesoft-works-the-internet-452445","Internal web network; central to PeopleSoft self-service deployment model"
"extranet","Extranet","framework","multiple","1994-2005","emerging","obsolete","1997-peoplesoft-works-the-internet-452445","Private inter-company network; PeopleSoft used for supply chain partner access"
