"entity_id","entity_name","entity_type","sector","status","successor","years_active","study_id","notes"
"intel","Intel Corporation","vendor","semiconductors","active","","1968-present","intel-ia2004-pk4-kc-edits-d61ef2","Dominant x86 processor and chipset manufacturer; collaborated on this white paper"
"aberdeen-group","Aberdeen Group","analyst","technology-research","acquired","Spiceworks Ziff Davis","1988-2015","intel-ia2004-pk4-kc-edits-d61ef2","Boston-based technology research firm; authored this white paper; acquired by Harte-Hanks then Spiceworks Ziff Davis"
"dell","Dell Inc.","vendor","computer-hardware","active","","1984-present","intel-ia2004-pk4-kc-edits-d61ef2","Referenced as Fortune 500 company using Xeon servers for workgroup computing"
"oracle","Oracle Corporation","vendor","enterprise-software","active","","1977-present","intel-ia2004-pk4-kc-edits-d61ef2","Referenced as Fortune 500 company using Xeon servers for enterprise workloads"
"pci-sig","PCI Special Interest Group","standards-body","technology-standards","active","","1992-present","intel-ia2004-pk4-kc-edits-d61ef2","Industry standards body that develops PCI, PCI-X, and PCI Express specifications; still active developing PCIe 6.0/7.0"
