"tech_id","tech_name","category","vendor","era","lifecycle_at_study","lifecycle_current","study_id","notes"
"CS6400","Cray CS6400 SMP Server","server hardware","Cray Research","mid-1990s","growth","obsolete","aberdeen-1995-rdbms-cray-research-inc","SPARC-based SMP system with 4–64 CPUs; up to 5TB online storage; 1.76 GB/s internal bandwidth. Sold to Sun in 1996; evolved into Sun Enterprise 10000 (Starfire)."
"SOLARIS-CX","Cray-Enhanced Solaris OS","operating system","Cray Research / Sun","mid-1990s","growth","obsolete","aberdeen-1995-rdbms-cray-research-inc","Sun Solaris UNIX 5.4 enhanced with processor partitioning, memory management, and hot-swap RAS features for enterprise workloads."
"SPARC","Sun SPARC Architecture","processor architecture","Sun Microsystems","mid-1990s","mature","legacy","aberdeen-1995-rdbms-cray-research-inc","RISC processor architecture; Cray CS6400 was binary-compatible with Sun SPARC, enabling access to 10000+ ISV applications."
"SMP","Symmetric Multiprocessing","computing paradigm","multiple","mid-1990s","growth","mature","aberdeen-1995-rdbms-cray-research-inc","SMP scaling to 64 CPUs was the key architecture for high-end RDBMS workloads; succeeded by NUMA and cloud scale-out architectures."
"T3D","Cray T3D Massively Parallel Processor","server hardware","Cray Research","mid-1990s","growth","obsolete","aberdeen-1995-rdbms-cray-research-inc","MPP system using DEC Alpha chipset; for scientific workloads >5TB. Later evolved into T3E under SGI ownership."
"VLDB","Very Large Database (VLDB) Technology","database paradigm","multiple","mid-1990s","growth","mature","aberdeen-1995-rdbms-cray-research-inc","Databases at 20GB–5TB scale requiring specialized hardware. The VLDB concept is now mainstream via cloud data warehouses."
"RDBMS-PARALLEL","Parallel RDBMS (Oracle"," Informix"," Sybase)","database software","multiple","mid-1990s","growth","mature, aberdeen-1995-rdbms-cray-research-inc, Relational database engines optimized for SMP/MPP parallelism to support OLTP and DSS at scale."
