"entity_id","entity_name","entity_type","sector","status","successor","years_active","study_id","notes"
"e3-01","Hewlett-Packard Company","company","IT Hardware/Software","split","HP Inc. + Hewlett Packard Enterprise (2015)","1939-2015","1997-hewlett-packard’s-strategy-to-surpa-905013","$38B revenue in 1997. Acquired Compaq 2002 for $25B. Split into HP Inc. and HPE in 2015."
"e3-02","Compaq Computer Corporation","company","IT Hardware","acquired","Hewlett-Packard Company (2002)","1982-2002","1997-hewlett-packard’s-strategy-to-surpa-905013","$20B revenue in 1997. Acquired Tandem Computers 1997. Acquired DEC 1998. Acquired by HP 2002 for ~$25B."
"e3-03","Microsoft Corporation","company","Software","active","Microsoft Corporation (ongoing)","1975-present","1997-hewlett-packard’s-strategy-to-surpa-905013","HP co-announced Simplified Enterprise Computing with Bill Gates in March 1997. HP endorsed Exchange Server, IIS, Wolfpack clustering, ZAW initiative."
"e3-04","Tandem Computers","company","IT Hardware","acquired","Compaq Computer Corporation (1997)","1974-1997","1997-hewlett-packard’s-strategy-to-surpa-905013","Non-Stop fault-tolerant systems. Acquired by Compaq 1997. Tandem handled 70% of world monetary transactions, 66% ATM/credit card, 90% stock transactions. NonStop eventually became HPE NonStop."
"e3-05","IBM","company","IT Hardware/Software","active","IBM (ongoing)","1911-present","1997-hewlett-packard’s-strategy-to-surpa-905013","$76B revenue in 1997. Cited as competing with HP for enterprise NT; also offered Lotus Notes/Domino as Exchange alternative."
"e3-06","Dell Computer Corporation","company","IT Hardware","active","Dell Technologies (ongoing)","1984-present","1997-hewlett-packard’s-strategy-to-surpa-905013","Cited as competitive pressure on Compaq via direct-sales no-middleman model. Direct model had ""leap-frogged"" Compaq."
"e3-07","Digital Equipment Corporation","company","IT Hardware","acquired","Compaq (1998); HP (2002)","1957-1998","1997-hewlett-packard’s-strategy-to-surpa-905013","$15B revenue in 1997. Acquired by Compaq for $9.6B in June 1998."
"e3-08","Intel Corporation","company","Semiconductors","active","Intel Corporation (ongoing)","1968-present","1997-hewlett-packard’s-strategy-to-surpa-905013","HP co-developing IA-64 (Merced) with Intel; HP expected early chip access advantage."
