"entity_id","entity_name","entity_type","sector","status","successor","years_active","study_id","notes"
"peter-s-kastner","Peter S. Kastner","person","IT-analyst","active","","1969-present","boston-globe-mit-enterprise-forum-kastne-2a3462","Aberdeen Group co-founder, VP/EVP/CRO; prior: PHI, Wang, ADL, Prime, Stratus, DEC"
"aberdeen-group","Aberdeen Group","firm","IT-research","acquired","Harte-Hanks (2007); Spiceworks Ziff Davis","1988-present","boston-globe-mit-enterprise-forum-kastne-2a3462","Boston-based IT research firm"
"boston-globe","Boston Globe","publication","newspaper","active","","1872-present","boston-globe-mit-enterprise-forum-kastne-2a3462","Major Boston daily newspaper"
"ronald-rosenberg-bg","Ronald Rosenberg","person","journalist","active","","1970s-2000s","boston-globe-mit-enterprise-forum-kastne-2a3462","Boston Globe Emerging Business columnist; bylined the listing"
"lawrence-genovesi","Lawrence Genovesi","person","tech-executive","active","","1990s","boston-globe-mit-enterprise-forum-kastne-2a3462","President, Powerstation Technologies Inc., Canton MA; case-study lead"
"powerstation-technologies-inc","Powerstation Technologies Inc.","company","computer-systems","defunct","","1990s","boston-globe-mit-enterprise-forum-kastne-2a3462","Canton MA technology firm; MIT Enterprise Forum case study subject"
"mit-enterprise-forum","MIT Enterprise Forum","organization","innovation-network","active","","1978-present","boston-globe-mit-enterprise-forum-kastne-2a3462","MIT-affiliated entrepreneurship and tech-innovation network"
"oravax-inc","OraVax Inc.","company","biotech","renamed-acquired","Acambis (2003), then Sanofi","1990-2003","boston-globe-mit-enterprise-forum-kastne-2a3462","Cambridge MA biotech; correction in same Boston Globe column"
"geltex-pharmaceuticals","GelTex Pharmaceuticals Inc.","company","pharmaceuticals","acquired","Genzyme (1998)","1991-1998","boston-globe-mit-enterprise-forum-kastne-2a3462","Waltham MA biotech; subject of Sept 24 Emerging Business correction"
