"tech_id","tech_name","category","vendor","era","lifecycle_at_study","lifecycle_current","study_id","notes"
"ca-etrust","CA eTrust Security Suite","application","Computer Associates","1999-2015","emerging","obsolete","2001-ca-s-etrust-directory-a-cornerstone-of-e-business--194413","Integrated enterprise security suite covering PKI, antivirus, firewall, VPN, intrusion detection, authentication, authorization"
"pki","Public Key Infrastructure (PKI)","protocol","Multiple","1995-present","emerging","active","2001-ca-s-etrust-directory-a-cornerstone-of-e-business--194413","Certificate and signature infrastructure; part of CA eTrust keyword set"
"antivirus","Antivirus / Anti-Malware Software","application","Multiple","1987-present","mature","active","2001-ca-s-etrust-directory-a-cornerstone-of-e-business--194413","Core component of eTrust security suite"
"vpn","Virtual Private Network (VPN)","protocol","Multiple","1996-present","emerging","active","2001-ca-s-etrust-directory-a-cornerstone-of-e-business--194413","Part of CA eTrust security suite"
"firewall","Enterprise Firewall","application","Multiple","1993-present","mature","active","2001-ca-s-etrust-directory-a-cornerstone-of-e-business--194413","Core enterprise security component; part of eTrust suite"
"ldap-directory","Enterprise Directory / LDAP","application","Multiple (CA, Microsoft, Sun)","1993-present","mature","active","2001-ca-s-etrust-directory-a-cornerstone-of-e-business--194413","eTrust Directory is an LDAP-based enterprise directory service"
"intrusion-detection","Intrusion Detection System (IDS)","application","Multiple","1990s-present","emerging","active","2001-ca-s-etrust-directory-a-cornerstone-of-e-business--194413","Part of CA eTrust integrated security suite"
