"tech_id","tech_name","category","vendor","era","lifecycle_at_study","lifecycle_current","study_id","notes"
"t90-01","Ingres version 5 / version 6","relational-database","Ingres Corporation/RTI","1985-1995","current","evolved; Ingres 12.0 via Actian (2024)","1990-bull-rdbms-1990-and-2024-metadata-fe61bf","v5 for decision support; v6 first designed for high-performance OLTP. Aberdeen recommends v6.3 for Bull."
"t90-02","Sybase version 3 / version 4","relational-database","Sybase Inc.","1987-1995","current","evolved into SAP Adaptive Server Enterprise; acquired by SAP 2010","1990-bull-rdbms-1990-and-2024-metadata-fe61bf","v3 for decision support; v4 first designed for high-performance OLTP. Reliability issues noted vs. Ingres."
"t90-03","Oracle RDBMS","relational-database","Oracle Corporation","1979-present","current","active (Oracle Database 23ai in 2024)","1990-bull-rdbms-1990-and-2024-metadata-fe61bf","Rejected by virtually all contacts for architectural weaknesses for high-performance OLTP."
"t90-04","SQL (Structured Query Language)","query-language","ANSI/ISO","1974-present","emerging-standard","ubiquitous standard","1990-bull-rdbms-1990-and-2024-metadata-fe61bf","ANSI SQL-86/SQL-89 standard; QUEL (Ingres query language) being replaced by SQL in Ingres."
"t90-05","Client-Server Architecture","computing-architecture","industry","1985-present","emerging","ubiquitous","1990-bull-rdbms-1990-and-2024-metadata-fe61bf","Aberdeen notes customers needed outside consulting help to understand client-server; adoption cycle ~2-3 years."
"t90-06","Ingres Knowledge Manager (4GL/CASE tools)","application-development-tool","Ingres Corporation","1988-1995","current","discontinued","1990-bull-rdbms-1990-and-2024-metadata-fe61bf","Customers looking forward to joint Cadre/Ingres CASE tools; Knowledge Manager seen as growth path."
"t90-07","IMS (IBM Information Management System)","hierarchical-database","IBM","1966-present","legacy-incumbent","active (IMS 15.4 in 2024)","1990-bull-rdbms-1990-and-2024-metadata-fe61bf","Trade press reported Salomon Brothers might move IMS applications to Sybase; survey found Salomon wished it had used Ingres."
"t90-08","PS/2 OS/2","personal-computer-platform","IBM","1987-2001","current","discontinued","1990-bull-rdbms-1990-and-2024-metadata-fe61bf","Aberdeen noted Sybase pro-actively supporting only Sun Microsystems and PS/2-OS/2 platforms."
