"tech_id","tech_name","category","vendor","era","lifecycle_at_study","lifecycle_current","study_id","notes"
"commerce-exchange","Commerce eXchange 2.0","application","InterWorld Technology Ventures","1996-2000","emerging","obsolete","1997-commerce-exchange-pvp-250db8","Enterprise internet commerce platform; components: transaction engine (Financial eXchange), application portfolio (Catalog, Digital Delivery, Chat, Note), Oasis distributed architecture, Workplace management tools; EDI integration driver; CORBA and DCOM neutral via abstraction layer; clients included Broderbund, MicroWarehouse, Multiple Zones, Comdisco, Scholastic."
"oasis-platform","Oasis (Object Architecture and Scalable Interoperating System)","framework","InterWorld Technology Ventures","1996-2000","emerging","obsolete","1997-commerce-exchange-pvp-250db8","InterWorld's distributed transaction processing platform; abstraction layer between applications and object architectures (CORBA/DCOM); avoids technology lock-in; remote object marshaling to minimize network communication; eliminates universal messaging queue bottlenecks; dissolved with InterWorld."
"corba","CORBA (Common Object Request Broker Architecture)","framework","OMG","1991-2005","emerging","obsolete","1997-commerce-exchange-pvp-250db8","OMG standard for distributed object communication; Aberdeen reports Oracle and BroadVision promoting CORBA for enterprise internet commerce; InterWorld's Oasis neutral between CORBA and DCOM; CORBA largely superseded by REST, SOAP, and API-based integration by 2010."
"dcom","DCOM (Distributed Component Object Model)","framework","Microsoft","1996-2005","emerging","obsolete","1997-commerce-exchange-pvp-250db8","Microsoft's distributed object model for Windows-based internet commerce; competing with CORBA for enterprise internet commerce standard; InterWorld's Oasis supports DCOM without translation gateways; DCOM largely obsolete, superseded by WCF, REST, and cloud APIs."
"edi-electronic-data-interchange","EDI (Electronic Data Interchange)","protocol","multiple","1968-present","mature","declining","1997-commerce-exchange-pvp-250db8","Electronic document interchange for B2B transactions (purchase orders, invoices); Fortune 1000 standard for supply chain integration; Commerce eXchange supports EDI via driver for B2B channel; still used in legacy supply chain systems but being replaced by API-based integration and EDI-over-AS2/AS4."
"ssl-encryption","SSL (Secure Sockets Layer) Encryption","protocol","Netscape","1995-2015","emerging","obsolete","1997-commerce-exchange-pvp-250db8","Aberdeen notes Commerce eXchange uses SSL to protect sessions between browser and server; RC4 and MD5 encryption; SSL deprecated in favor of TLS (Transport Layer Security); TLS 1.3 is current standard; SSL itself obsolete."
"digital-delivery","Digital Delivery (Software Distribution)","application","InterWorld Technology Ventures","1996-2000","emerging","obsolete","1997-commerce-exchange-pvp-250db8","InterWorld's digital goods download component; compliant with Microsoft ESD guidelines and SPA EULA; integrates with software clearinghouses; precursor concept to modern app stores (App Store 2008, Steam, etc.)."
"internet-commerce-platform","Internet Commerce Platform (Category)","application-category","multiple","1995-present","emerging","active","1997-commerce-exchange-pvp-250db8","The emerging category of software that Commerce eXchange exemplified; Aberdeen's analysis of this category anticipates modern e-commerce platforms (Shopify, Magento, Salesforce Commerce Cloud, etc.); the category grew to a multi-billion dollar market."
