"tech_id","tech_name","category","vendor","era","lifecycle_at_study","lifecycle_current","study_id","notes"
"batch-computing","Batch Computing","platform","various","1950s-1970s","mature","legacy-end-of-life","volume-1-introduction-physics-of-the-machine","Listed as one of the major computing transitions the memoir passes through."
"timesharing","Timesharing","platform","various","1960s-1970s","mature","legacy-end-of-life","volume-1-introduction-physics-of-the-machine","Named as a major industry transition featured in the memoir."
"32-bit-minicomputer","Minicomputers","platform","various (DEC, Prime, Stratus)","1970s-1980s","mature","legacy-end-of-life","volume-1-introduction-physics-of-the-machine","Named as a major computing transition; central to Prime, DEC, and Stratus chapters."
"fault-tolerant-computing","Fault-Tolerant OLTP","platform","Stratus, Tandem","1980s-1990s","growing","legacy-supported","volume-1-introduction-physics-of-the-machine","Named as a major computing transition; the Stratus fault-tolerant lab is a key setting."
"client-server","Client-Server Computing","platform","various","1990s","growing","legacy-end-of-life","volume-1-introduction-physics-of-the-machine","Named as a major revolution the memoir covers; the client-server era is a central period."
"ibm-mainframe","IBM Mainframes","platform","IBM","1960s-1990s","mature","legacy-supported","volume-1-introduction-physics-of-the-machine","Two IBM mainframes used in a secret benchmark to ambush the enterprise computing industry, referenced in the introduction."
"magnetic-tape","Magnetic Tape","platform","various","1950s-1980s","mature","legacy-end-of-life","volume-1-introduction-physics-of-the-machine","Referenced in an anecdote about a customs inspector in Rio unspooling magnetic tape on an airport floor."
