"tech_id","tech_name","category","vendor","era","lifecycle_at_study","lifecycle_current","study_id","notes"
"tandem-clx","Tandem CLX (610/620/640/660)","platform","Tandem Computers","1987-1993","launch","obsolete","stratus-sales-support-competitive-news-1-2aac8d","Low-end GUARDIAN 'network extender'; CMOS custom processor with internal comparators"
"tandem-lxn","Tandem LXN","platform","Tandem Computers","1987-1990","launch","obsolete","stratus-sales-support-competitive-news-1-2aac8d","M68020-based Altos 3068 OEM; Unix System V Release 2; 32 users max"
"tandem-vlx","Tandem VLX","platform","Tandem Computers","1986-1992","production","obsolete","stratus-sales-support-competitive-news-1-2aac8d","Top-of-line Tandem; new 2/3-CPU models at $585K entry"
"tandem-nonstop-sql","Tandem NonStop SQL","application","Tandem Computers","1987-2000s","launch","legacy-supported","stratus-sales-support-competitive-news-1-2aac8d","Tandem's first SQL DBMS; transaction protection impacts ET-1 tps"
"guardian-os","Tandem GUARDIAN operating system","platform","Tandem Computers","1976-present","mature","legacy-supported","stratus-sales-support-competitive-news-1-2aac8d","Tandem's proprietary fault-tolerant OS; renamed NonStop Kernel"
"unix-system-v","Unix System V Release 2","platform","AT&T","1983-1990","production","legacy","stratus-sales-support-competitive-news-1-2aac8d","Tandem LXN operating system; not fault tolerant"
"et-1","ET-1 benchmark (NonStop SQL transaction-protected)","framework","Tandem Computers","1985-1989","production","obsolete","stratus-sales-support-competitive-news-1-2aac8d","Tandem's name for DebitCredit; restated under NonStop SQL 1987"
"motorola-68020","Motorola 68020 CPU","platform","Motorola","1984-1995","production","obsolete","stratus-sales-support-competitive-news-1-2aac8d","32-bit CPU used in LXN"
"tcp-ip","TCP/IP protocol","protocol","IETF","1983-present","emerging","mature","stratus-sales-support-competitive-news-1-2aac8d","Promised future LXN Ethernet controller protocol"
