"tech_id","tech_name","category","vendor","era","lifecycle_at_study","lifecycle_current","study_id","notes"
"enterprise-service-bus","Enterprise Service Bus (ESB)","integration-middleware","multi-vendor","2000s","growth","legacy","esb-in-soa-e002b7","Emerging as de-facto technology standard for integrating SOA infrastructure; 60% of large company respondents using/planning shared messaging; three-phase evolution: message bus → service bus → process bus."
"service-oriented-architecture","Service-Oriented Architecture (SOA)","architecture-framework","industry-standard","2000s","growth","evolved","esb-in-soa-e002b7","SOA adoption survey (286 companies): 76% implementing Web Services calls; 73% implementing app-related services; 60% implementing shared messaging; 58% governance/management."
"web-services","Web Services (XML/SOAP/WSDL/UDDI)","integration-protocol","industry-standard","2000s","growth","mature","esb-in-soa-e002b7","76% implementing web services calls to existing applications or planning within 12 months; WS-* stack cited as requirement for 'true ESB' by SOA purists like Cape Clear."
"ws-star-standards","WS-* Standards Stack","integration-protocol","industry-standard","2000s","growth","evolved","esb-in-soa-e002b7","Cape Clear et al. argue true ESB must religiously adhere to WS-* stack; products that simply wrap proprietary legacy middleware do not provide same characteristics or benefits."
"message-oriented-middleware","Message-Oriented Middleware (MOM) / Enterprise Messaging","integration-middleware","multi-vendor","2000s","mature","evolved","esb-in-soa-e002b7","ESB phase 1 (message bus): data transformation and reliable routing; traditional role of ESB; first wave of ESBs provided reliable messaging."
"services-orchestration","Services Orchestration","integration-middleware","multi-vendor","2000s","growth","evolved","esb-in-soa-e002b7","ESB phase 2 (service bus): where most of the market is in 2005; enables composite applications and event-based processing; real-time message content analysis."
"business-process-management","Business Process Management (BPM) / Process Bus","process-management","multi-vendor","2000s","emerging","mature","esb-in-soa-e002b7","ESB phase 3 (process bus / mediation): complex manipulations, long process execution; handles SOA decomposition data — applications data, logic, web services, XML messages, BP models, business rules, policies, external data sources."
"composite-applications","Composite Applications","application-architecture","multi-vendor","2000s","emerging","evolved","esb-in-soa-e002b7","49% currently use or plan within 12 months; enabled by phase 2 (service bus / orchestration) of ESB evolution."
"soa-services-registry","SOA Services Registry / UDDI","soa-governance","multi-vendor","2000s","emerging","legacy","esb-in-soa-e002b7","Aberdeen recommends ESB vendors must interact with or inherit Services Registry characteristics; critical for SOA governance and management."
"xml-gateway-adapters","XML Gateways / Adapters","integration-middleware","multi-vendor","2000s","growth","evolved","esb-in-soa-e002b7","65% of survey respondents currently use or plan XML gateways/adapters within 12 months."
"bea-aqualogic-service-bus","BEA AquaLogic Service Bus","integration-middleware","BEA Systems","2000s","emerging","legacy","esb-in-soa-e002b7","ESB pioneer/SOA-specific; best-of-breed attractiveness for pure SOAs; faster ROI due to well-defined scope."
"ibm-websphere-esb","IBM WebSphere ESB","integration-middleware","IBM","2000s","growth","legacy","esb-in-soa-e002b7","Listed in ESB pioneer/SOA-specific segment; IBM also present in platform (WebSphere Message Broker) and process-centric (WebSphere Process Server) segments."
"sap-netweaver","SAP NetWeaver","integration-platform","SAP","2000s","growth","evolved","esb-in-soa-e002b7","Listed in 'Part of a platform' ESB vendor segment; good fit for service-oriented business applications development; inherent latency and cost overhead from monolithic nature."
"microsoft-biztalk","Microsoft BizTalk Server","integration-platform","Microsoft","2000s","mature","active","esb-in-soa-e002b7","Listed in 'Part of a platform' ESB vendor segment; composite application enablement; legacy SOA enablement."
"enterprise-application-integration-eai","Enterprise Application Integration (EAI)","integration-methodology","multi-vendor","2000s","mature","evolved","esb-in-soa-e002b7","Traditional EAI/EII players: IONA, Informatica, iWay, FusionWare, Sterling Commerce, SUN/SeeBeyond, TIBCO, webMethods. Good entrenchment; speed and cost of implementations challenged by SOA pioneers."
"business-process-workflows","Business Process / Workflow Services","process-management","multi-vendor","2000s","growth","mature","esb-in-soa-e002b7","69% currently use or plan business process/workflow services within 12 months (survey, 286 companies)."
"soa-governance-management","SOA Governance / Management of Services","soa-governance","multi-vendor","2000s","emerging","mature","esb-in-soa-e002b7","58% implementing or plan governance/management of services within 12 months; Aberdeen recommends evaluating policy/governance management as ESB selection criterion."
