"tech_id","tech_name","category","vendor","era","lifecycle_at_study","lifecycle_current","study_id","notes"
"amd-athlon-64","AMD Athlon 64 (desktop, ClawHammer)","platform","AMD","2003-2006","not-yet-launched","legacy","dct-memoir-athlon-64-prescience-2003","Launched Sept 23 2003 — three weeks after the last Aug 2003 weekly; the architectural inflection missed by the commentary"
"amd-athlon-xp","AMD Athlon XP","platform","AMD","2001-2004","mature","legacy","dct-memoir-athlon-64-prescience-2003","32-bit processor recommended throughout the Aug 2003 weeklies"
"amd-opteron","AMD Opteron","platform","AMD","2003-present","emerging","active","dct-memoir-athlon-64-prescience-2003","Server variant of K8/Hammer architecture; launched April 22 2003 — a visible 64-bit signal available when the Aug 2003 weeklies were written"
"x86-64","AMD64 / x86-64 Architecture","framework","AMD","2003-present","not-yet-launched-consumer","active","dct-memoir-athlon-64-prescience-2003","The 64-bit extension to x86 that Athlon 64 introduced to consumers; adopted industry-wide and became dominant through 2010s"
"intel-em64t","Intel EM64T / Intel 64","framework","Intel","2004-present","not-yet-launched","active","dct-memoir-athlon-64-prescience-2003","Intel's adoption of AMD's x86-64 — first shipped mid-2004 (Nocona Xeon), mainstream desktop 2005 (Pentium 4 6xx); confirms AMD-early thesis"
"windows-xp-x64","Windows XP Professional x64 Edition","platform","Microsoft","2005-2014","not-yet-released","end-of-life","dct-memoir-athlon-64-prescience-2003","Shipped April 25 2005 — 19 months after Athlon 64 launch; poor driver ecosystem limited adoption; OS support latency central to this memoir's thesis"
"windows-xp","Windows XP (32-bit)","platform","Microsoft","2001-2014","mature","end-of-life","dct-memoir-athlon-64-prescience-2003","The OS actually installed on every Athlon XP or early Athlon 64 consumer PC sold in 2003-2005"
"windows-vista-x64","Windows Vista x64","platform","Microsoft","2007-2017","not-yet-released","end-of-life","dct-memoir-athlon-64-prescience-2003","First consumer-facing 64-bit Windows with meaningful driver support; Jan 2007 launch — 40+ months after Athlon 64"
