"tech_id","tech_name","category","vendor","era","lifecycle_at_study","lifecycle_current","study_id","notes"
"product-launch-framework","Cross-Functional Matrix Product Launch Framework","framework","Multiple","1990-present","mature","mature","sun-launch-best-practices-report-draft-8-9741fb","Standardized cross-functional launch process with a named team owner."
"webinar-webcast","Webinar / Webcast technology","framework","Multiple","2000-present","emerging","mature","sun-launch-best-practices-report-draft-8-9741fb","Noted as increasing-emphasis delivery method in 2002."
"web-elearning","Web-based E-Learning","framework","Multiple","2000-present","emerging","mature","sun-launch-best-practices-report-draft-8-9741fb","Noted as one of seven launch-material delivery methods."
"collaboration-software","Collaboration Software (Lotus Notes, etc.)","application","IBM/Lotus/Multiple","1989-present","mature","mature","sun-launch-best-practices-report-draft-8-9741fb","Cited use: Lotus Notes for launch process."
"intranet-database","Intranet Database","framework","Multiple","1995-present","mature","mature","sun-launch-best-practices-report-draft-8-9741fb","One of seven delivery methods."
