entity_id,entity_name,entity_type,sector,status,successor,years_active,study_id,notes
aberdeen-group,Aberdeen Group,firm,IT-research,acquired,Harte-Hanks (Sep 2006) -> Halyard Capital (Apr 2015) -> Spiceworks Ziff Davis (Dec 2020),1988-2010s,esb-0617-5cc5fa,"Author and publisher | Source: Aberdeen Group acquired by Harte-Hanks in September 2006, then sold to Halyard Capital in April 2015, then acquired by Spiceworks Ziff Davis in December 2020. https://www.mrweb.com/drno/news5946.htm; https://www.pehub.com/spiceworks-ziff-davis-buys-aberdeen/; https://en.wikipedia.org/wiki/Aberdeen_Strategy_and_Research"
bea-systems,BEA Systems,company,enterprise-software,acquired,Oracle Corporation (January 2008),1995-2008,esb-0617-5cc5fa,"Top primary ESB vendor: 57% BIC choice; AquaLogic ESB product; incumbent EAI vendor transitioning to SOA; also listed as primary SOA vendor at 14% | Source: Oracle acquired BEA Systems for approximately $8.5 billion, completed January 2008. https://www.cbc.ca/news/science/oracle-completes-8-5b-takeover-of-bea-systems-1.724924"
ibm,IBM,company,enterprise-hardware,active,,1911-present,esb-0617-5cc5fa,Sponsor; second primary ESB vendor (37% BIC); IBM WebSphere; highest pure SOA primary vendor recognition (22% primary SOA vendor); also MQ messaging | Source: IBM (International Business Machines) remains a major publicly traded technology company (NYSE: IBM).
webmethods,webMethods,company,enterprise-software,acquired,Software AG (April 2007),1996-2007,esb-0617-5cc5fa,Third primary ESB vendor (29% overall); incumbent EAI vendor; no ESB per se but products perform ESB functions; EAI functional equivalency protecting investments | Source: Software AG acquired webMethods for $546 million in April 2007. https://www.cnbc.com/2007/04/05/software-ag-snaps-up-webmethods-for-546-million.html
microsoft,Microsoft,company,software,active,,1975-present,esb-0617-5cc5fa,Fourth primary SOA vendor (22% overall); dominant for .Net-only sites; SOA Lite category; 6% primary ESB vendor | Source: Microsoft Corporation remains one of the largest technology companies globally. https://www.microsoft.com
oracle,Oracle,company,enterprise-software,active,,1977-present,esb-0617-5cc5fa,Oracle Fusion: 18% primary SOA vendor; 8% primary ESB vendor; sells SOA middleware standalone and with applications | Source: Oracle Corporation remains a major publicly traded enterprise software and cloud company (NYSE: ORCL).
sap,SAP,company,enterprise-software,active,,1972-present,esb-0617-5cc5fa,SAP NetWeaver: 16% primary SOA vendor; 4% primary ESB vendor; 1/6 respondents view SAP as primary SOA vendor; ERP SOA category | Source: SAP SE remains a major publicly traded enterprise software company (NYSE: SAP).
fiorano-software,Fiorano Software,company,enterprise-software,active,,1995-present,esb-0617-5cc5fa,Sponsor; leading choice in pure-play ESB alongside IONA Technologies
iona-technologies,IONA Technologies,company,enterprise-software,acquired,Progress Software (August 2008),1991-2008,esb-0617-5cc5fa,Leading choice in pure-play ESBs alongside Fiorano; acquired by Progress Software 2008 | Source: Progress Software acquired IONA Technologies for $162 million in August 2008. https://www.finextra.com/pressarticle/23361/progress-software-completes-iona-acquisition; https://www.irishtimes.com/news/iona-technologies-sold-to-us-software-group-in-162m-deal-1.1271895
