"entity_id","entity_name","entity_type","sector","status","successor","years_active","study_id","notes"
"aberdeen-group","Aberdeen Group","firm","technology-research","acquired","Harte-Hanks -> Aberdeen (standalone brand under various owners)","1988-2014","1998-advertising-on-the-internet-leveraging-the-virtual-3972d6","Founded Boston MA; acquired by Harte-Hanks 2001; brand continued under multiple owners"
"internet-advertising-bureau","Internet Advertising Bureau (IAB)","institution","internet-advertising","active","","1996-present","1998-advertising-on-the-internet-leveraging-the-virtual-3972d6","Trade organization for online advertising; renamed IAB in 2011; still active as of 2026"
"doubleclick","DoubleClick","company","ad-technology","acquired","Google","1996-2008","1998-advertising-on-the-internet-leveraging-the-virtual-3972d6","Major ad server provider; acquired by Google in 2008 for $3.1 billion; technology integrated into Google Marketing Platform"
"24-7-media","24/7 Media","company","ad-technology","acquired","CMGI -> 24/7 Real Media -> WPP","1995-2007","1998-advertising-on-the-internet-leveraging-the-virtual-3972d6","Internet advertising network; merged into WPP's 24/7 Real Media; dissolved as independent entity"
"flycast-communications","Flycast Communications","company","ad-technology","acquired","CMGI","1996-2000","1998-advertising-on-the-internet-leveraging-the-virtual-3972d6","Ad network; acquired by CMGI in 1999 for $684 million"
"real-media","Real Media","company","ad-technology","acquired","24/7 Real Media -> WPP","1995-2007","1998-advertising-on-the-internet-leveraging-the-virtual-3972d6","Ad serving and network company; merged with 24/7 Media to form 24/7 Real Media; later acquired by WPP"
"engage-technologies","Engage Technologies","company","ad-technology","dissolved","CMGI","1995-2001","1998-advertising-on-the-internet-leveraging-the-virtual-3972d6","CMGI subsidiary for online behavioral targeting; dissolved during dot-com bust"
"netratings","NetRatings","company","internet-measurement","acquired","Nielsen","1999-2007","1998-advertising-on-the-internet-leveraging-the-virtual-3972d6","Internet audience measurement; became Nielsen Online then Nielsen Digital"
