"tech_id","tech_name","category","vendor","era","lifecycle_at_study","lifecycle_current","study_id","notes"
"wifi","Wi-Fi (802.11)","standard","Various","1999-present","growing","{'lifecycle_current': 'active', 'notes': 'Wi-Fi (802.11) is fully active. Wi-Fi 7 (802.11be) is current standard. Wi-Fi Alliance actively certifying products.', 'source': 'General knowledge'}","sars2-hot-topic-cf91d4","85%+ of all WiFi gear made in Taiwan and PRC; extreme supply chain concentration highlighted"
"playstation","Sony PlayStation (manufacturing)","hardware","Sony","1994-present","mature","{'lifecycle_current': 'active', 'notes': 'Sony PlayStation manufacturing (and the PlayStation brand) is actively ongoing. PlayStation 5 is current generation; PlayStation 6 in development. Reference here is to semiconductor/electronics manufacturing context.', 'source': 'https://www.playstation.com/en-us/'}","sars2-hot-topic-cf91d4","All PlayStation manufacturing announced to move to PRC; represents consumer electronics supply chain concentration"
"semiconductor-8-inch-fab","8-inch Semiconductor Fabrication Plant","hardware","Various (PRC)","2003","emerging","{'lifecycle_current': 'active', 'notes': '8-inch (200mm) semiconductor fabrication plants remain in active use for mature process nodes (analog, power, RF, MEMS). The SARS-era concern about PRC-based fabs remains relevant. New 8-inch fab investments continue.', 'source': 'General semiconductor industry'}","sars2-hot-topic-cf91d4","Eight new PRC 8-inch wafer fabs under construction with commitments from NEC, Philips, Oki, Elpida, Infineon"
"ac-dc-power-supply","AC-to-DC Power Supply (electronics component)","hardware","Various (PRC)","1990s-present","mature","{'lifecycle_current': 'active', 'notes': 'AC-to-DC power supplies are fundamental electronics components, actively manufactured and used across all electronic devices, servers, and computing equipment.', 'source': 'General electronics industry'}","sars2-hot-topic-cf91d4","Invariably manufactured in PRC; example of no-second-source component dependency; laptop cannot ship without it"
"just-in-time-manufacturing","Just-In-Time (JIT) Manufacturing","standard","Various","1970s-present","mature","{'lifecycle_current': 'active', 'notes': ""JIT manufacturing remains widely used, though pandemic supply chain disruptions prompted shifts toward 'Just-in-Case' hybrid models. JIT is evolving with AI and real-time analytics but remains a core manufacturing strategy."", 'source': 'https://www.fictiv.com/articles/jit-just-in-time-manufacturing'}","sars2-hot-topic-cf91d4","Global electronics industry supply chain model; fundamentally incompatible with quarantine/disruption scenarios"
