"entity_id","entity_name","entity_type","sector","status","successor","years_active","study_id","notes"
"hewlett-packard","Hewlett-Packard (HP)","company","hardware","merged","HP Inc. + Hewlett Packard Enterprise (2015)","1939-2015","2002-performance-breakthroughs-the-benchmarking-fanatic-6d41fa","Split into HP Inc. (consumer/printing) and HPE (enterprise) in 2015; Superdome product line continues under HPE"
"ibm","IBM","company","hardware","active","","1911-present","2002-performance-breakthroughs-the-benchmarking-fanatic-6d41fa","Active; IBM's server division sold to Lenovo in 2014 for x86 servers; POWER/mainframe retained"
"intel","Intel Corporation","company","semiconductor","active","","1968-present","2002-performance-breakthroughs-the-benchmarking-fanatic-6d41fa","Active; Itanium product line ended July 2021"
"nec","NEC Corporation","company","hardware","active","","1899-present","2002-performance-breakthroughs-the-benchmarking-fanatic-6d41fa","Japanese electronics company; active; set NEC Itanium 2 benchmark records in 2002-2003"
"sap","SAP SE","company","software","active","","1972-present","2002-performance-breakthroughs-the-benchmarking-fanatic-6d41fa","German ERP vendor; active as of 2026; S/4HANA is current flagship"
"aberdeen-group","Aberdeen Group","firm","IT-research","acquired","Spiceworks Ziff Davis (2020)","1988-2020","2002-performance-breakthroughs-the-benchmarking-fanatic-6d41fa","Research publisher"
