"entity_id","entity_name","entity_type","sector","status","successor","years_active","study_id","notes"
"aberdeen-group","Aberdeen Group","firm","industry-analyst","acquired","Harte-Hanks (2002-2017) -> Spiceworks Ziff Davis","1988-present","sun-micro-slammed-as-quarterly-report-di-e9ee61","Boston-based IT industry analyst firm"
"peter-s-kastner","Peter S. Kastner","person","industry-analyst","active","","1970s-present","sun-micro-slammed-as-quarterly-report-di-e9ee61","EVP / chief research officer / research VP; various titles 1988-2007"
"sun-microsystems","Sun Microsystems, Inc.","company","computer-systems","acquired","Oracle Corporation (2010)","1982-2010","sun-micro-slammed-as-quarterly-report-di-e9ee61","UNIX workstation/server/SPARC/Java company"
"oracle-corp","Oracle Corporation","company","database-software","active","","1977-present","sun-micro-slammed-as-quarterly-report-di-e9ee61","Flagship database vendor; acquired Sun Microsystems 2010"
"marketwatch-inc","MarketWatch / CBS.MarketWatch.com","firm","news-media","acquired","Dow Jones / News Corp (2005)","1997-present","sun-micro-slammed-as-quarterly-report-di-e9ee61","Financial news site; acquired by Dow Jones 2005 for $520M; now part of News Corp"
"rex-crum-journalist","Rex Crum","person","journalist","[DEFERRED]","","","sun-micro-slammed-as-quarterly-report-di-e9ee61","CBS.MarketWatch.com reporter; later MarketWatch writer covering tech"
"scott-mcnealy","Scott McNealy","person","executive","active","","1982-2006","sun-micro-slammed-as-quarterly-report-di-e9ee61","Sun Microsystems co-founder and CEO 1984-2006; outspoken Microsoft/Oracle critic"
"credit-suisse-first-boston","Credit Suisse First Boston","company","investment-bank","renamed","Credit Suisse (2006) -> UBS (2023)","1978-2023","sun-micro-slammed-as-quarterly-report-di-e9ee61","Investment bank research/equity house; acquired into Credit Suisse then UBS"
"bernstein-research","Bernstein Research / Sanford C. Bernstein & Co.","firm","sell-side-research","acquired","AllianceBernstein (2000)","1967-present","sun-micro-slammed-as-quarterly-report-di-e9ee61","Influential sell-side research house; acquired by Alliance Capital 2000"
