"tech_id","tech_name","category","vendor","era","lifecycle_at_study","lifecycle_current","study_id","notes"
"ibm-notes-domino","Lotus Notes / Domino","application","Lotus/IBM","1989-2024","mature","legacy-supported","aberdeen-1996-ibm-transformation-business-machines-information-service","Internet-enabled Domino Notes released; IBM leveraged acquisition for network computing strategy"
"network-computing","Network Computing (IBM vision)","framework","IBM","1996-2005","emerging","legacy-supported","aberdeen-1996-ibm-transformation-business-machines-information-service","IBM's unifying vision: open network-centric IT; precursor to cloud computing"
"os2","OS/2","platform","IBM","1987-2006","declining","obsolete","aberdeen-1996-ibm-transformation-business-machines-information-service","IBM desktop OS; limited ISV support vs Windows; strategic liability identified by Aberdeen"
"ibm-db2","IBM DB2","application","IBM","1983-present","mature","active","aberdeen-1996-ibm-transformation-business-machines-information-service","Aberdeen identifies DB2 as functional follower vs Oracle/Sybase/Informix"
"ibm-s390","IBM S/390 (Mainframe)","platform","IBM","1990-2000","mature","legacy-supported","aberdeen-1996-ibm-transformation-business-machines-information-service","Evolving to IBM Z-series; mainframe migrations driving Y2K and services demand"
"ibm-as400","IBM AS/400","platform","IBM","1988-present","mature","legacy-supported","aberdeen-1996-ibm-transformation-business-machines-information-service","Mentioned as formerly competing hardware division; now IBM i"
"ibm-rs6000","IBM RS/6000 / PowerPC","platform","IBM","1990-2003","mature","obsolete","aberdeen-1996-ibm-transformation-business-machines-information-service","Unix server line; formerly competing internally with mainframe and AS/400 divisions"
