"entity_id","entity_name","entity_type","sector","status","successor","years_active","study_id","notes"
"cisco-systems","Cisco Systems, Inc.","company","enterprise-networking","active","","1984-present","1997-cisco-s-core-products-business-inte-bd8697","Founded 1984 by Len Bosack and Sandy Lerner at Stanford; $4B revenue trailing four quarters at time of report; $40B market cap in 1997; became largest networking company in the world; peak market cap ~$555B in March 2000 during dot-com bubble; still active and dominant as of 2026 (NASDAQ: CSCO)."
"stratacom","StrataCom, Inc.","company","enterprise-networking","acquired","Cisco Systems","1986-1996","1997-cisco-s-core-products-business-inte-bd8697","Leading high-end ATM/frame relay switch supplier; acquired by Cisco for $4.67B in June 1996 (Cisco's largest acquisition to date at that point); StrataCom BPX switch and Stratm Technology became key to Cisco's ISP and WAN switching strategy; integrated into Cisco's service provider product line."
"bay-networks","Bay Networks","company","enterprise-networking","acquired","Nortel Networks","1994-1998","1997-cisco-s-core-products-business-inte-bd8697","Referenced in report as a networking vendor adding routing intelligence to switches; formed by merger of Synoptics and Wellfleet (1994); acquired by Nortel Networks for $9.1B (1998); Nortel ultimately failed; Bay Networks assets dispersed."
"cabletron-systems-cisco","Cabletron Systems, Inc.","company","enterprise-networking","dissolved","Enterasys Networks","1983-2001","1997-cisco-s-core-products-business-inte-bd8697","Referenced in report as competitor adding routing intelligence to switches; see separate Cabletron profile study."
"3com-corp","3Com Corporation","company","enterprise-networking","acquired","HP Enterprise","1979-2010","1997-cisco-s-core-products-business-inte-bd8697","Referenced as announcing IP switching devices; mid-tier networking vendor; acquired by HP for $2.7B (2010); HP spun off enterprise division as HPE; 3Com brand discontinued."
"ascend-communications","Ascend Communications","company","enterprise-networking","acquired","Lucent Technologies","1989-1999","1997-cisco-s-core-products-business-inte-bd8697","Referenced as announcing IP switching devices; WAN/ATM networking vendor; acquired by Lucent Technologies for $20B (1999); became part of Lucent then Alcatel-Lucent."
