"entity_id","entity_name","entity_type","sector","status","successor","years_active","study_id","notes"
"peter-s-kastner","Peter S. Kastner","person","IT-analyst","active","","1969-present","computerworld-stratus-xa2000-launch-1987-d9d143","Aberdeen Group co-founder, VP/EVP/CRO; prior: PHI, Wang, ADL, Prime, Stratus, DEC"
"stratus-computer","Stratus Computer","company","fault-tolerant-computing","acquired","Stratus Technologies (now Penguin Solutions)","1980-present","computerworld-stratus-xa2000-launch-1987-d9d143","Kastner's Stratus employer (marketing/sales support)"
"tandem-computers","Tandem Computers","company","fault-tolerant-computing","acquired","Compaq (1997), then HP (2002)","1974-2002","computerworld-stratus-xa2000-launch-1987-d9d143","Stratus competitor; debit-credit benchmark publisher"
"ibm","IBM Corporation","company","computer-systems","active","","1911-present","computerworld-stratus-xa2000-launch-1987-d9d143","OEM partner of Stratus (System/88 = Stratus-built FT systems)"
"motorola-inc","Motorola, Inc.","company","semiconductor","split","Freescale Semiconductor (2004) -> NXP (2015); Motorola Solutions / Mobility","1928-present","computerworld-stratus-xa2000-launch-1987-d9d143","68000/68010/68020 + 68881 used in Stratus systems"
"william-e-foster","William E. Foster","person","executive","active","","1970s-present","computerworld-stratus-xa2000-launch-1987-d9d143","Stratus Computer co-founder and CEO; cited 1987 XA2000 launch"
"yankee-group","The Yankee Group","firm","IT-research","acquired","Acquired by 451 Research / various","1970-2010s","computerworld-stratus-xa2000-launch-1987-d9d143","Boston-based market research firm; Thomas Henkel cited 1987 XA2000 piece"
"computerworld","Computerworld","publication","trade-press","active","IDG","1967-present","computerworld-stratus-xa2000-launch-1987-d9d143","Major IT weekly; ran 1987 XA2000 + 2002 Itanium-vs-Sun pieces"
