"tech_id","tech_name","category","vendor","era","lifecycle_at_study","lifecycle_current","study_id","notes"
"sei-cmm","SEI Capability Maturity Model","framework","SEI/Carnegie Mellon","1991-2006","mature","legacy-supported","ie-appendix-lane-qa-research-e594cb","5-level maturity model for software processes; succeeded by CMMI in 2002; CSC had Levels 2-5 across units"
"iso-9000","ISO 9000 Quality Management","framework","ISO","1987-present","mature","active","ie-appendix-lane-qa-research-e594cb","International quality management standard; used by Deloitte (Europe/Canada), Keane (UK), EDS (some units)"
"iso-9001","ISO 9001 Certification","framework","ISO","1987-present","mature","active","ie-appendix-lane-qa-research-e594cb","Specific certification standard; CSC SEAS earned in 1997; Keane UK certified"
"balanced-scorecard","Balanced Scorecard","framework","Kaplan and Norton","1992-present","emerging","active","ie-appendix-lane-qa-research-e594cb","Used by CSC for QA reporting; tracks errors and progress on outstanding items"
"lotus-notes","Lotus Notes","application","IBM/Lotus","1989-2010s","mature","obsolete","ie-appendix-lane-qa-research-e594cb","Used by CSC for Corporate Knowledge Program database"
"knowledge-management","Knowledge Management Systems","application","Various","1990s-present","emerging","active","ie-appendix-lane-qa-research-e594cb","KPMG rolling out KM tool; EDS building corporate knowledge base; Keane archiving QA findings"
