"entity_id","entity_name","entity_type","sector","status","successor","years_active","study_id","notes"
"peter-s-kastner","Peter S. Kastner","person","IT-analyst","active","","1969-present","ca-jasmine-ii-brochure-kastner-endorseme-6588be","Aberdeen Group co-founder, VP/EVP/CRO; prior: PHI, Wang, ADL, Prime, Stratus, DEC"
"aberdeen-group","Aberdeen Group","firm","IT-research","acquired","Harte-Hanks (2007); Spiceworks Ziff Davis","1988-present","ca-jasmine-ii-brochure-kastner-endorseme-6588be","Boston-based IT research firm"
"computer-associates","Computer Associates International (CA)","company","enterprise-software","renamed","CA Technologies (2010), Broadcom (2018)","1976-2018","ca-jasmine-ii-brochure-kastner-endorseme-6588be","Enterprise software vendor; Wang/Kumar leadership"
"idc-corporation","IDC","firm","IT-research","active","","1964-present","ca-jasmine-ii-brochure-kastner-endorseme-6588be","Market-research firm; competitor to Aberdeen"
"tony-picardi","Tony Picardi","person","IT-analyst-IDC","active-then","","1990s-2000s","ca-jasmine-ii-brochure-kastner-endorseme-6588be","Group Senior Vice President Worldwide Software, IDC; quoted in Jasmine brochure"
"ulma-gonzalez","Ulma Gonzalez","person","public-sector-IT","active-then","","1990s-2000s","ca-jasmine-ii-brochure-kastner-endorseme-6588be","Division Director Data Administration, IT Dept, Miami Dade County"
"miami-dade-county","Miami-Dade County","government","public-sector","active","","1957-present","ca-jasmine-ii-brochure-kastner-endorseme-6588be","Florida county government; named CA Jasmine TND user"
"sanjay-kumar","Sanjay Kumar","person","CA-executive","convicted-2006","","1980s-2006","ca-jasmine-ii-brochure-kastner-endorseme-6588be","CA CEO 2000-2004; later convicted in 2006 fraud case"
"charles-wang","Charles Wang","person","CA-executive","deceased-2018","","1976-2018","ca-jasmine-ii-brochure-kastner-endorseme-6588be","CA founder/Chairman; led firm through 1990s"
