"tech_id","tech_name","category","vendor","era","lifecycle_at_study","lifecycle_current","study_id","notes"
"ca-jasmine-tnd","CA Jasmine TND (Jasmine ii)","application-platform","Computer Associates","1999-2002","active-product","discontinued","ca-jasmine-ii-brochure-kastner-endorseme-6588be","CA's object-relational application platform; later abandoned"
"ca-neugents","CA Neugents","neural-network-agents","Computer Associates","1996-2003","active-product","discontinued","ca-jasmine-ii-brochure-kastner-endorseme-6588be","CA's neural-network/predictive-agent technology"
"business-intelligence","Business Intelligence (BI)","analytical-application","Industry","1989-present","active-strategy-trend","evolving-into-augmented-analytics-and-LLM-BI","ca-jasmine-ii-brochure-kastner-endorseme-6588be","Term popularized by Howard Dresner (Gartner) 1989; Kastner uses in endorsement"
"pattern-recognition-agents","Pattern Recognition / Predictive Agents","AI-pattern","Industry","1990s-2000s","research-and-emerging","evolved-into-AutoML-and-LLM-agents","ca-jasmine-ii-brochure-kastner-endorseme-6588be","Forthcoming agents per Kastner endorsement"
"object-relational-store","Object-Relational Store with Active Rules","database-architecture","CA Jasmine / industry","1990s-2000s","active-product","evolved-into-document-stores-and-graph-DBs","ca-jasmine-ii-brochure-kastner-endorseme-6588be","Jasmine TND's underlying data store architecture"
