"tech_id","tech_name","category","vendor","era","lifecycle_at_study","lifecycle_current","study_id","notes"
"java-web-dev","Java/J2EE and Web Site Development","development-platform","","2000s","growth","mature","outsourcing-adm-864c88","Top outsourcing target; pure Java/J2EE and Unix development and maintenance cited as prime outsourcing enabler"
"dotnet-windows-dev",".NET and Windows Development","development-platform","Microsoft","2000s","growth","mature","outsourcing-adm-864c88","Second major outsourcing target; Windows development and maintenance cited in PACE framework"
"portals-dev","Portal Development","application","","2000s","growth","mature","outsourcing-adm-864c88","Top strategic IT target; Aberdeen recommends BIC keep portal dev in-house as key differentiator"
"soa-development","SOA Development","framework","","2000s","emerging","mature","outsourcing-adm-864c88","PACE framework lists SOA development as area to consider keeping internal; strategic value high"
"cobol-legacy","COBOL and Legacy Application Maintenance","development-platform","","1960s-2000s","declining","legacy","outsourcing-adm-864c88","Classic outsourcing target for maintenance; AS/400 RPG and client-server also mentioned"
"open-source-linux","Open Source / Linux Development","development-platform","","2000s","emerging","mature","outsourcing-adm-864c88","PACE table lists open source/Linux development as area to consider retaining internally for strategic value"
"bpm-technology","Business Process Management (BPM) Technology","middleware","","2000s","emerging","mature","outsourcing-adm-864c88","Mentioned in PACE table as an action for companies facing mandate to improve IT service levels with business units"
"ajax-html","Ajax/HTML Web Development","development-platform","","2000s","growth","mature","outsourcing-adm-864c88","Listed in PACE enablers as outsourcing targets for web site development (Ajax, HTML, SAP, BAP)"
