"entity_id","entity_name","entity_type","sector","status","successor","years_active","study_id","notes"
"aberdeen-group","Aberdeen Group","firm","industry-analyst","acquired","Harte-Hanks (2002-2017) -> Spiceworks Ziff Davis","1988-present","sap-sybase-face-off-f2612e","Boston-based IT industry analyst firm"
"peter-s-kastner","Peter S. Kastner","person","industry-analyst","active","","1970s-present","sap-sybase-face-off-f2612e","EVP / chief research officer / research VP; various titles 1988-2007"
"sap-ag","SAP AG (later SAP SE)","company","enterprise-software","active","SAP SE (2014)","1972-present","sap-sybase-face-off-f2612e","Walldorf Germany-based ERP vendor; R/3 and later S/4HANA"
"sybase","Sybase, Inc.","company","database-software","acquired","SAP AG (2010)","1984-2010","sap-sybase-face-off-f2612e","Emeryville CA-based relational database; SQL Server/Adaptive Server"
"informix","Informix Software","company","database-software","acquired","IBM (2001)","1980-2001","sap-sybase-face-off-f2612e","Relational database vendor; acquired by IBM 2001 for $1B"
"oracle-corp","Oracle Corporation","company","database-software","active","","1977-present","sap-sybase-face-off-f2612e","Flagship database vendor; acquired Sun Microsystems 2010"
"informationweek","InformationWeek / TechWeb","firm","news-media","active","","1985-present","sap-sybase-face-off-f2612e","IT business trade publication; Techweb digital arm"
"mike-regan-sybase","Mike Regan","person","executive","unknown","","","sap-sybase-face-off-f2612e","Sybase general manager of applications support, Emeryville CA [REVIEW]"
"paul-wahl-sap","Paul Wahl","person","executive","unknown","","","sap-sybase-face-off-f2612e","SAP executive VP and international marketing director, Walldorf Germany [REVIEW]"
