"entity_id","entity_name","entity_type","sector","status","successor","years_active","study_id","notes"
"peter-s-kastner","Peter S. Kastner","person","IT-analyst","active","","1969-present","meetings-conventions-virtual-meetings-ps-c1b097","Aberdeen Group co-founder, VP/EVP/CRO; prior: PHI, Wang, ADL, Prime, Stratus, DEC"
"aberdeen-group","Aberdeen Group","firm","IT-research","acquired","Harte-Hanks (2007); Spiceworks Ziff Davis","1988-present","meetings-conventions-virtual-meetings-ps-c1b097","Boston-based IT research firm"
"meetings-conventions-magazine","Meetings & Conventions Magazine","publication","trade-press","active","Northstar Travel Group","1965-present","meetings-conventions-virtual-meetings-ps-c1b097","Secaucus NJ; covers meetings/events industry"
"placeware-inc","PlaceWare, Inc.","company","web-conferencing","acquired","Microsoft (2003) -> Live Meeting -> Lync/Skype-for-Business -> Teams","1996-2003","meetings-conventions-virtual-meetings-ps-c1b097","Mountain View CA virtual events; Barry James Folsom president; 49% spike post-9/11"
"webex-inc","WebEx Communications, Inc.","company","web-conferencing","acquired","Cisco Systems (2007)","1995-2007","meetings-conventions-virtual-meetings-ps-c1b097","San Jose CA virtual meetings; Praful Shah cited; pre-Zoom era"
