"tech_id","tech_name","category","vendor","era","lifecycle_at_study","lifecycle_current","study_id","notes"
"edi-electronic-data-interchange","Electronic Data Interchange (EDI)","protocol","multiple","1970-present","mature","legacy-supported","dollars-and-sense-b2b-ec-eb8c9d","Traditional B2B data exchange protocol; still used in healthcare/retail but declining vs APIs"
"eft-electronic-funds-transfer","Electronic Funds Transfer (EFT)","protocol","multiple","1970-present","mature","active","dollars-and-sense-b2b-ec-eb8c9d","Financial transaction protocol; still active in ACH/wire transfer systems"
"edi-van","EDI Value-Added Networks (VAN)","platform","multiple","1975-2010","mature","legacy-supported","dollars-and-sense-b2b-ec-eb8c9d","Managed EDI transmission networks; largely superseded by AS2/SFTP/APIs"
"internet-ec-1998","Internet-Based Electronic Commerce","platform","multiple","1996-present","emerging","active","dollars-and-sense-b2b-ec-eb8c9d","Web-based B2B commerce; the ""new EC"" Aberdeen analyzed; now dominant"
"xml-edi","XML/EDI Integration","protocol","multiple","1997-2010","emerging","legacy-supported","dollars-and-sense-b2b-ec-eb8c9d","XML as EDI replacement protocol; evolved into EDI/XML hybrid standards"
"public-key-encryption","Public Key Encryption","protocol","multiple","1990-present","emerging","active","dollars-and-sense-b2b-ec-eb8c9d","Internet security standard; Appendix A covers security implementation"
"b2b-marketplace","B2B Electronic Marketplace","platform","multiple","1997-2010","emerging","legacy-superseded","dollars-and-sense-b2b-ec-eb8c9d","Hub-and-spoke trading exchanges; most failed post-dot-com; concept persists in modern platforms"
"erp-ec-integration","ERP/Electronic Commerce Integration","application","multiple","1997-present","emerging","active","dollars-and-sense-b2b-ec-eb8c9d","Integration of ERP back-ends with e-commerce front-ends; now standard"
