"entity_id","entity_name","entity_type","sector","status","successor","years_active","study_id","notes"
"aberdeen-group","Aberdeen Group","firm","industry-analyst","acquired","Harte-Hanks (2002-2017) -> Spiceworks Ziff Davis","1988-present","sd-cards-overtake-memory-stick-12-may-20-81d89c","Boston-based IT industry analyst firm"
"peter-s-kastner","Peter S. Kastner","person","industry-analyst","active","","1970s-present","sd-cards-overtake-memory-stick-12-may-20-81d89c","EVP / chief research officer / research VP; various titles 1988-2007"
"sony-corp","Sony Corporation","company","consumer-electronics","active","","1946-present","sd-cards-overtake-memory-stick-12-may-20-81d89c","Japanese electronics; Memory Stick developer; competitor to SD standard"
"panasonic","Panasonic Corporation","company","consumer-electronics","active","Renamed from Matsushita 2008","1918-present","sd-cards-overtake-memory-stick-12-may-20-81d89c","Japanese electronics conglomerate; SD Card Association co-founder"
"sd-card-association","SD Card Association","firm","trade-standards","active","","2000-present","sd-cards-overtake-memory-stick-12-may-20-81d89c","Global standards body for SD Card formats; co-founded by Panasonic, SanDisk, Toshiba"
"ray-creech-sda","Ray Creech","person","executive","[DEFERRED]","","","sd-cards-overtake-memory-stick-12-may-20-81d89c","President of SD Card Association, 2003 era"
"npd-group","NPD Group, Inc.","firm","market-research","active","Circana (2022 merger with IRI)","1966-present","sd-cards-overtake-memory-stick-12-may-20-81d89c","US consumer market research firm; renamed Circana 2022"
"vnunet-com","vnunet.com / Computing.co.uk","firm","news-media","acquired","Incisive Media (2008)","1999-2008","sd-cards-overtake-memory-stick-12-may-20-81d89c","VNU-owned IT news/content network; acquired by Incisive Media"
