"tech_id","tech_name","category","vendor","era","lifecycle_at_study","lifecycle_current","study_id","notes"
"windows-nt","Windows NT (all versions)","platform","Microsoft","1993-2000","mature","obsolete","1998-nt-professional-services-buying-guide-1998-edition-14e452","Core platform driving the professional services market analyzed in this report"
"sap-r3","SAP R/3","application","SAP AG","1992-2015","mature","legacy-supported","1998-nt-professional-services-buying-guide-1998-edition-14e452","Key NT application driving services demand; succeeded by SAP S/4HANA"
"unix","Unix Operating Systems","platform","Multiple (HP-UX / AIX / Solaris)","1969-present","mature","active","1998-nt-professional-services-buying-guide-1998-edition-14e452","Primary integration target alongside NT — NT/Unix integration cited as key service need"
"erp-platforms","Enterprise Resource Planning (ERP) Platforms","application","Multiple (SAP/Baan/Oracle/CA)","1990s-present","mature","active","1998-nt-professional-services-buying-guide-1998-edition-14e452","ERP deployment on NT was primary driver of IS staff consuming professional services"
"internet-intranet","Internet/Intranet Infrastructure","platform","Multiple","1995-present","emerging","active","1998-nt-professional-services-buying-guide-1998-edition-14e452","Establishing enterprise intranets cited as competing demand on IS resources"
"as400","IBM AS/400","platform","IBM","1988-2008","mature","legacy-supported","1998-nt-professional-services-buying-guide-1998-edition-14e452","AS/400 background cited as marker of consultant production-environment experience; renamed iSeries then IBM i"
