entity_id,entity_name,entity_type,sector,status,successor,years_active,study_id,notes
ENT-INFORMIX,Informix Corporation,vendor,database-software,acquired,"IBM (database assets, 2001); Ascential Software (remainder)",1980-2001,aberdeen-1995-universal-servers-rdbms-technology-next-decade,IBM acquired Informix database assets for $1B in 2001; Informix products merged into IBM DB2 product line. Informix-IDS still sold as IBM Informix.
ENT-ILLUSTRA,Illustra Information Technologies,vendor,database-software,acquired,Informix (acquired 1995),1992-1995,aberdeen-1995-universal-servers-rdbms-technology-next-decade,Illustra OODBMS/object-relational DBMS with DataBlade technology; acquired by Informix in 1995 to create Universal Server.
ENT-ORACLE-DB4,Oracle Corporation,vendor,database-software,active,,1977-present,aberdeen-1995-universal-servers-rdbms-technology-next-decade,Oracle 7.3 assessed; Oracle eventually released Oracle8/8i with full object-relational features; now Oracle Database dominates enterprise RDBMS.
ENT-IBM-DB2,IBM DB2,product,database-software,active,,1983-present,aberdeen-1995-universal-servers-rdbms-technology-next-decade,IBM DB2 Common Server assessed; DB2 absorbed Informix technology after 2001 acquisition; still active.
ENT-CA-INGRES,Computer Associates (CA-Ingres + Jasmine),vendor,database-software,acquired,Actian Corporation (Ingres); CA Technologies→Broadcom,1976-2018,aberdeen-1995-universal-servers-rdbms-technology-next-decade,CA had dual strategy: CA-Ingres RDBMS + Jasmine OODBMS; Ingres later became independent as Actian.
ENT-SYBASE-DB,Sybase Inc.,vendor,database-software,acquired,SAP SE (acquired 2010),1984-2010,aberdeen-1995-universal-servers-rdbms-technology-next-decade,Sybase System 11 assessed; Sybase acquired by SAP in 2010 for $5.8B; SAP ASE/IQ products continue.
ENT-MSFT-SQL,Microsoft SQL Server,product,database-software,active,,1989-present,aberdeen-1995-universal-servers-rdbms-technology-next-decade,Microsoft assessed as lagging in Universal Server; SQL Server evolved to become major RDBMS with extensive extensions.
ENT-VERITY,Verity Inc.,vendor,search-software,acquired,Autonomy Corporation (acquired 2005),1988-2005,aberdeen-1995-universal-servers-rdbms-technology-next-decade,Verity text search referenced as DataBlade partner; acquired by Autonomy in 2005.
ENT-MAPINFO,MapInfo Corporation,vendor,gis-software,acquired,Pitney Bowes (acquired 2007),1986-2007,aberdeen-1995-universal-servers-rdbms-technology-next-decade,MapInfo spatial DataBlade partner; acquired by Pitney Bowes in 2007.
