"tech_id","tech_name","category","vendor","era","lifecycle_at_study","lifecycle_current","study_id","notes"
"eai","Enterprise Application Integration (EAI)","framework","multiple","1996-2010","emerging","legacy-supported","1998-enterprise-application-integration-advanced-techno-71496c","Core subject; EAI evolved into SOA then iPaaS/API management"
"traditional-middleware","Traditional Middleware","platform","multiple","1985-2005","mature","legacy-supported","1998-enterprise-application-integration-advanced-techno-71496c","Aberdeen explicitly contrasted EAI vs middleware as key differentiator"
"message-broker","Message Broker (EAI Message Bus)","platform","IBM/TIBCO/multiple","1990-present","emerging","active","1998-enterprise-application-integration-advanced-techno-71496c","Core EAI architecture pattern; evolved into Apache Kafka and modern event streaming"
"workflow-engine","Workflow Engine / Process Automation","application","multiple","1995-present","emerging","active","1998-enterprise-application-integration-advanced-techno-71496c","Process-sense EAI component; evolved into BPM then RPA then modern workflow automation"
"erp-integration","ERP Application Integration (SAP/Oracle connectivity)","framework","SAP/Oracle/multiple","1995-present","emerging","active","1998-enterprise-application-integration-advanced-techno-71496c","Key use case driving EAI adoption; SAP Business Connector directly addressed this"
"supply-chain-integration","Supply Chain Integration","framework","multiple","1995-present","emerging","active","1998-enterprise-application-integration-advanced-techno-71496c","Aberdeen cited supply chain planning and execution as key EAI application area"
"heterogeneous-platform-integration","Heterogeneous Platform Integration","framework","multiple","1993-present","emerging","active","1998-enterprise-application-integration-advanced-techno-71496c","Abstracting network protocols/databases/OS differences; still core iPaaS value proposition"
