"tech_id","tech_name","category","vendor","era","lifecycle_at_study","lifecycle_current","study_id","notes"
"internet-procurement-software","Internet Procurement Software","application","Ariba/Commerce One","1996-present","emerging","active","1998-internet-procurement-cdc4a6","Core subject of study; e-procurement software for indirect goods; Ariba and Commerce One were pioneer vendors; now SAP Ariba dominates"
"electronic-catalog","Electronic Product Catalog","application","Multiple","1996-present","emerging","active","1998-internet-procurement-cdc4a6","Online catalogs for non-production goods purchasing; Commerce One launched 5M-product catalog by 1998"
"erp-procurement-module","ERP Procurement Module","application","SAP/Oracle/PeopleSoft","1992-present","mature","active","1998-internet-procurement-cdc4a6","Built-in procurement in R/3 and Oracle ERP; Aberdeen noted these lacked depth vs. specialist tools; eventually enhanced via partnerships"
"internet-web-technology","Internet/Web Technology","platform","Multiple","1993-present","emerging","active","1998-internet-procurement-cdc4a6","HTTP/browser as procurement UI; enabling browser-based purchase requisition workflow vs. legacy EDI"
"edi-procurement","Electronic Data Interchange for Procurement","protocol","Multiple","1970-2000s","mature","legacy-supported","1998-internet-procurement-cdc4a6","Traditional procurement interchange standard; Aberdeen positioned Internet procurement as successor/supplement to EDI"
"workflow-approval-software","Workflow and Approval Software","application","Multiple","1995-present","emerging","active","1998-internet-procurement-cdc4a6","Automated purchase approval routing; key feature of Ariba and Commerce One platforms"
