entity_id,entity_name,entity_type,sector,status,successor,years_active,study_id,notes
ENT-EC-001,Aberdeen Group,Research Firm,IT Research & Advisory,Acquired,Harte-Hanks (2001) then rebranded,1988-2013,1997-electronic-commerce-to-internet-com-b26a35,Publisher of this white paper
ENT-EC-002,The InterNetworked Enterprise (concept),Business Model Framework,Cross-industry,Evolved,Cloud/Digital Transformation era,1997-2005,1997-electronic-commerce-to-internet-com-b26a35,"Aberdeen's term for enterprises adopting Internet Commerce; concept evolved into 'digital transformation'"
ENT-EC-003,Amazon.com,E-Commerce Retailer,Retail / Technology,Active,,1994-present,1997-electronic-commerce-to-internet-com-b26a35,"Not named in study but emblematic of the Internet Commerce revolution Aberdeen described; launched 1994 as online bookstore"
ENT-EC-004,EDI (Electronic Data Interchange) ecosystem,Standards Ecosystem,Cross-industry,Legacy/Niche,Web EDI then B2B integration platforms,1970s-present,1997-electronic-commerce-to-internet-com-b26a35,"EDI identified in study as established EC foundation being transformed by Internet; still used in legacy supply chain contexts"
ENT-EC-005,Internet Commerce vendors (generic),Vendor Category,Technology,Evolved,SaaS e-commerce platforms (Shopify Magento etc.),1996-2005,1997-electronic-commerce-to-internet-com-b26a35,"The EC/IC supplier category Aberdeen develops an assessment framework for; evolved into modern e-commerce platform industry"
