"entity_id","entity_name","entity_type","sector","status","successor","years_active","study_id","notes"
"ENT-NOR-001","Nortel Networks Corporation (Northern Telecom)","Corporation","Telecommunications Equipment","Bankrupt/Liquidated","Multiple (see notes)","1895-2009","1997-nortel--transforming-business-by-po-3edae6","Subject of this profile. Filed for bankruptcy January 14, 2009. Assets sold: wireless to Ericsson ($1.13B), enterprise to Avaya ($915M), optical/Ethernet to Ciena ($774M), carrier VoIP to GENBAND ($282M), patents to Apple/Microsoft/Ericsson/RIM/EMC/Sony consortium ($4.5B 2011). Peak market cap $297-400B (~2000). At bankruptcy, ~30,000 employees; peak was 95,000."
"ENT-CISCO-001","Cisco Systems Inc.","Corporation","Networking Equipment","Active","","1984-present","1997-nortel--transforming-business-by-po-3edae6","Cited as Nortel's primary hardware competitor. Cisco dominated IP routing while Nortel focused on ATM. Cisco survived and became the dominant enterprise networking vendor; Nortel did not."
"ENT-LUCENT-001","Lucent Technologies","Corporation","Telecommunications Equipment","Acquired","Alcatel-Lucent (2006); Nokia (2016)","1996-2006","1997-nortel--transforming-business-by-po-3edae6","Cited as competitor. Spun off from AT&T in 1996. Merged with Alcatel in 2006; Nokia acquired Alcatel-Lucent in 2016."
"ENT-IBM-002","IBM Corporation","Corporation","Enterprise Computing","Active","","1911-present","1997-nortel--transforming-business-by-po-3edae6","Cited as competitor in enterprise networking market."
"ENT-SUN-001","Sun Microsystems Inc.","Corporation","Enterprise Computing","Acquired","Oracle Corporation (2010)","1982-2010","1997-nortel--transforming-business-by-po-3edae6","Nortel partner for next-generation multimedia client-server telephone development. Sun acquired by Oracle in 2010."
"ENT-ABD-001","Aberdeen Group Inc.","Research/Analyst Firm","IT Research","Acquired","Aberdeen (Harte-Hanks)","1988-2001","1997-nortel--transforming-business-by-po-3edae6","Published this vendor-sponsored profile."
"ENT-AVAYA-001","Avaya Inc.","Corporation","Enterprise Communications","Bankrupt (twice)","None","2000-present","1997-nortel--transforming-business-by-po-3edae6","Acquired Nortel's enterprise solutions for $915M in December 2009. Avaya itself filed for bankruptcy twice (2017, 2023)."
"ENT-ERICSSON-001","Ericsson AB","Corporation","Telecommunications Equipment","Active","","1876-present","1997-nortel--transforming-business-by-po-3edae6","Acquired Nortel's wireless infrastructure assets for $1.13B in November 2009."
"ENT-CIENA-001","Ciena Corporation","Corporation","Optical Networking","Active","","1992-present","1997-nortel--transforming-business-by-po-3edae6","Acquired Nortel's optical networking and carrier Ethernet businesses for $774M in March 2010."
