"entity_id","entity_name","entity_type","sector","status","successor","years_active","study_id","notes"
"platinum-technology","PLATINUM technology inc.","company","enterprise-software","acquired","Computer Associates International","1987-1999","platinum-riskadvisor-ec30de","Oakbrook Terrace IL; NASDAQ:PLAT; public 1991; acquired by Computer Associates for $3.5B in 1999 (largest software deal at the time); FY1998 revenue $968M; 4330 employees"
"computer-associates","Computer Associates International Inc.","company","enterprise-software","merged","CA Technologies -> Broadcom","1976-present","platinum-riskadvisor-ec30de","Acquired PLATINUM technology in 1999 for $3.5B; DOJ required divestiture of 6 mainframe products; CA rebranded as CA Technologies; acquired by Broadcom in 2018"
"aberdeen-group","Aberdeen Group","firm","technology-research","acquired","IHS Markit -> Omdia","1988-2014","platinum-riskadvisor-ec30de","Boston-based IT analyst firm; publisher of this profile"
"insurance-200","Insurance 200","institution","insurance-industry","active","","1990-present","platinum-riskadvisor-ec30de","Top 200 insurance companies benchmark group referenced in study; Aberdeen notes data warehousing importance equivalent to core insurance activities among Insurance 200 winners"
"large-insurer-customer","Large Insurance Customer (anonymous)","company","insurance","active","","1970s-present","platinum-riskadvisor-ec30de","Anonymous early adopter; $3.5B+ net premiums written; RiskAdvisor installed in a few months; managing 25 years of historical risk management data; praised structure and desktop modules"
