"tech_id","tech_name","category","vendor","era","lifecycle_at_study","lifecycle_current","study_id","notes"
"silknet-eservice","Silknet eService","application","Silknet Software","1997-2000","emerging","obsolete","aberdeen-1997-silknet-software","Introduced March 10 1997; internet-native customer support; thin-client architecture; priced per user or per customer"
"thin-client-web-architecture","Thin-Client Web Architecture","platform","multiple","1995-2005","emerging","active","aberdeen-1997-silknet-software","Silknet used thin-client for universal deployment via browser; foreshadowed SaaS delivery model"
"activex-object-oriented","ActiveX Object-Oriented Application Logic","framework","Microsoft","1996-2005","emerging","obsolete","aberdeen-1997-silknet-software","Silknet eService application logic written in ActiveX; Java capabilities planned Q4 1997"
"java-applets","Java Applets","language","Sun Microsystems","1995-2010","emerging","obsolete","aberdeen-1997-silknet-software","Silknet adding Java capabilities Q4 1997; eService dynamically shares Java applets"
"call-tracking-client-server-cis","Client-Server Call Tracking CIS","application","multiple","1990-2005","mature","obsolete","aberdeen-1997-silknet-software","Incumbent CIS software architecture being disrupted by internet-native alternatives"
"internet-intranet-deployment","Internet/Intranet Application Deployment","platform","multiple","1994-present","emerging","active","aberdeen-1997-silknet-software","Primary delivery medium for next-generation CIS applications; foreshadowed SaaS"
