"entity_id","entity_name","entity_type","sector","status","successor","years_active","study_id","notes"
"e1-01","Forte Software Inc.","company","Enterprise Software","acquired","Sun Microsystems (1999); Oracle (2010)","1992-1999","1997-forte-enterprise-development-enviro-a07cf9","Acquired by Sun Microsystems August 1999 for ~$540M stock deal. Products rebranded as Sun Forte. Oracle acquired Sun in 2010."
"e1-02","Aberdeen Group","analyst-firm","IT Research","acquired","Aberdeen (Harte-Hanks); now part of Informa Tech","1988-present","1997-forte-enterprise-development-enviro-a07cf9","Aberdeen Group acquired by Harte-Hanks in 2001; brand continued under various owners."
"e1-03","Conextion Inc.","company","Enterprise Software","defunct","unknown","1990s","1997-forte-enterprise-development-enviro-a07cf9","Partner providing Enterprise Access Server (EAS) for Forte legacy integration."
"e1-04","Sun Microsystems","company","IT Hardware/Software","acquired","Oracle Corporation (2010)","1982-2010","1997-forte-enterprise-development-enviro-a07cf9","Acquired Forte Software in 1999. Sun itself acquired by Oracle in January 2010."
"e1-05","Digital Equipment Corporation","company","IT Hardware","acquired","Compaq (1998); HP (2002)","1957-1998","1997-forte-enterprise-development-enviro-a07cf9","Key Forte distribution partner. Acquired by Compaq in 1998; Compaq merged with HP in 2002."
