"entity_id","entity_name","entity_type","sector","status","successor","years_active","study_id","notes"
"compaq-computer","Compaq Computer Corporation","company","enterprise-computing","acquired","Hewlett-Packard Company","1982-2002","2001-linux-is-on-the-move-up-6bf089","Listed as major Linux contributor alongside HP and IBM"
"hewlett-packard","Hewlett-Packard Company","company","enterprise-computing","active","HP Inc. / HPE (2015 split)","1939-2015","2001-linux-is-on-the-move-up-6bf089","Major Linux development contributor"
"ibm-corporation","IBM Corporation","company","enterprise-computing","active","","1911-present","2001-linux-is-on-the-move-up-6bf089","Major Linux contributor; z/OS positioned as co-primary server OS with Linux"
"microsoft-corporation","Microsoft Corporation","company","enterprise-software","active","","1975-present","2001-linux-is-on-the-move-up-6bf089","Windows positioned as one of three primary server OSes alongside Linux and z/OS"
"open-source-community","Open Source Developer Community","institution","software-development","active","","1983-present","2001-linux-is-on-the-move-up-6bf089","Open source developers cited as key Linux development contributors"
"aberdeen-group","Aberdeen Group","firm","IT-research","acquired","Aberdeen Strategy & Research (Harte-Hanks)","1988-2014","2001-linux-is-on-the-move-up-6bf089","Publisher; Bill Claybrook was Aberdeen's Linux/Unix analyst"
