"tech_id","tech_name","category","vendor","era","lifecycle_at_study","lifecycle_current","study_id","notes"
"omnis-7","OMNIS 7","application","Blyth Software","1991-2000","mature","obsolete","aberdeen-1996-blyths-ren-architecture-prescription-it-success","Client-server application development environment (CADE); cross-platform Windows/OS2/Mac"
"ren-architecture","REN Architecture","framework","Blyth Software","1996-2001","emerging","obsolete","aberdeen-1996-blyths-ren-architecture-prescription-it-success","Dual-track: traditional client-server + Net client-server; 4 components: dev tools, db tools, lifecycle mgmt, components"
"web-enabler","Web Enabler","application","Blyth Software","1996-2001","emerging","obsolete","aberdeen-1996-blyths-ren-architecture-prescription-it-success","OMNIS extension adding TCP, FTP, SMTP, POP3, HTTP and HTML capabilities"
"omnis-data-server","OMNIS Data Server","application","Blyth Software","1996-2001","emerging","obsolete","aberdeen-1996-blyths-ren-architecture-prescription-it-success","Serves OMNIS apps to web browsers via CGI/HTML"
"web-vault","Web Vault","application","Blyth Software","1996-2001","emerging","obsolete","aberdeen-1996-blyths-ren-architecture-prescription-it-success","Database middleware providing secure web-to-RDBMS access; predecessor to modern API gateways"
"web-manager","Web Manager","application","Blyth Software","1996-2001","emerging","obsolete","aberdeen-1996-blyths-ren-architecture-prescription-it-success","Version control and change management for Net applications; earliest web CMS concept"
"weblets","Weblets","framework","Blyth Software","1996-2001","emerging","obsolete","aberdeen-1996-blyths-ren-architecture-prescription-it-success","Reusable plug-in components for Net apps; precursor to modern web component ecosystems"
"java-applets","Java Applets","language","Sun Microsystems","1995-2015","emerging","obsolete","aberdeen-1996-blyths-ren-architecture-prescription-it-success","Referenced as market's dominant view of Net development at time; OMNIS could generate Java-equivalent code"
"html","HTML","protocol","W3C","1991-present","emerging","active","aberdeen-1996-blyths-ren-architecture-prescription-it-success","Web markup language; Blyth's tools generated HTML dynamically"
