"tech_id","tech_name","category","vendor","era","lifecycle_at_study","lifecycle_current","study_id","notes"
"service-oriented-architecture","Service-Oriented Architecture (SOA)","framework","industry","2000-2010","new","legacy-supplanted","soa-adoption-at-90-percent-c9c4ec","Web-services-based IT infrastructure centered on business processes and services; displaced by microservices/REST APIs/cloud-native architectures"
"enterprise-service-bus","Enterprise Service Bus (ESB)","platform","industry","2002-2015","new","legacy-supplanted","soa-adoption-at-90-percent-c9c4ec","Middleware integration layer for SOA; TIBCO, webMethods, IBM, Oracle, BEA; displaced by API gateways/event streaming"
"web-services-soap","SOAP/XML Web Services","protocol","W3C","2000-2010","new","legacy-supplanted","soa-adoption-at-90-percent-c9c4ec","XML-based RPC/messaging protocol; WS-* stack; displaced by REST/JSON and later GraphQL/gRPC"
"soa-light","SOA ""light"" — open-source + standards","framework","industry","2004-2012","new","legacy-supplanted","soa-adoption-at-90-percent-c9c4ec","Aberdeen-coined SOA adoption tier: Apache Axis + open-source ESBs + web-services standards for small companies and self-service integration"
"enterprise-soa","Enterprise SOA — commercial middleware suite","framework","industry","2004-2015","new","legacy-supplanted","soa-adoption-at-90-percent-c9c4ec","Aberdeen-coined SOA adoption tier: full ESB + BPM + registry/repository commercial suite (IBM, Oracle/BEA, TIBCO, webMethods/Software AG) for complex mission-critical installations"
"soa-erp","SOA ERP — ERP-extension approach","framework","industry","2005-2015","new","legacy-supplanted","soa-adoption-at-90-percent-c9c4ec","Aberdeen-coined SOA adoption tier: SAP NetWeaver, Oracle Fusion, Microsoft BizTalk; entry-level SOA for mid-size and some large companies via ERP platform extensions"
