"entity_id","entity_name","entity_type","sector","status","successor","years_active","study_id","notes"
"circuitcity-com","CircuitCity.com","company","PC-retail","dissolved","shut down with Circuit City liquidation 2009; later revived as direct-to-consumer by Systemax 2016","1999-2012","dct-weekly-2003-01-05","Retailer covered in weekly commentary 2003-01-05"
"dell","Dell Computer","company","PC-manufacturing","active","Dell Technologies (went private 2013; re-listed 2018 via VMware tracking stock)","1984-present","dct-weekly-2003-01-05","PC manufacturer discussed in weekly commentary 2003-01-05"
"hewlett-packard","Hewlett-Packard","company","PC-manufacturing","split","HP Inc. (consumer/PC) and Hewlett Packard Enterprise (enterprise), split November 2015","1939-present","dct-weekly-2003-01-05","PC manufacturer discussed in weekly commentary 2003-01-05"
"compaq","Compaq Computer","company","PC-manufacturing","acquired","HP (May 2002 merger); brand retired 2013","1982-2013","dct-weekly-2003-01-05","PC manufacturer discussed in weekly commentary 2003-01-05"
"gateway-inc","Gateway, Inc.","company","PC-manufacturing","acquired","Acer Inc. (acquired October 2007, $710M); Gateway brand discontinued ~2011","1985-2007","dct-weekly-2003-01-05","PC manufacturer discussed in weekly commentary 2003-01-05"
"sony","Sony","company","PC-manufacturing","active","Sony Group Corporation (renamed 2021)","1946-present","dct-weekly-2003-01-05","PC manufacturer discussed in weekly commentary 2003-01-05"
"emachines","eMachines","company","PC-manufacturing","acquired","Gateway (2004); then Acer (2007); brand discontinued 2013","1998-2013","dct-weekly-2003-01-05","PC manufacturer discussed in weekly commentary 2003-01-05"
"intel","Intel Corporation","company","semiconductor","active","","1968-present","dct-weekly-2003-01-05","Industry entity referenced in weekly commentary 2003-01-05"
"amd","Advanced Micro Devices","company","semiconductor","active","","1969-present","dct-weekly-2003-01-05","Industry entity referenced in weekly commentary 2003-01-05"
