"entity_id","entity_name","entity_type","sector","status","successor","years_active","study_id","notes"
"aberdeen-group","Aberdeen Group","firm","industry-analyst","acquired","Harte-Hanks (2002-2017) -> Spiceworks Ziff Davis","1988-present","soa-adoption-eats-up-40-per-cent-of-it-r-d0cf12","Boston-based IT industry analyst firm"
"peter-s-kastner","Peter S. Kastner","person","industry-analyst","active","","1970s-present","soa-adoption-eats-up-40-per-cent-of-it-r-d0cf12","EVP / chief research officer / research VP; various titles 1988-2007"
"andy-mccue-journalist","Andy McCue","person","journalist","[DEFERRED]","","","soa-adoption-eats-up-40-per-cent-of-it-r-d0cf12","silicon.com / CNET Networks UK journalist; later The Register contributor"
"silicon-com","silicon.com","firm","news-media","acquired","CBS Interactive Business UK (2008) -> shut down 2012","1998-2012","soa-adoption-eats-up-40-per-cent-of-it-r-d0cf12","UK IT news site; CNET Networks UK; shut down 2012; content archived"
"cnet-networks","CNET Networks, Inc.","firm","news-media","acquired","CBS Interactive (2008)","1992-2008","soa-adoption-eats-up-40-per-cent-of-it-r-d0cf12","San Francisco online IT/consumer media; owner of CNET.com, ZDNet, TechRepublic, silicon.com; acquired by CBS for $1.8B (2008)"
