"tech_id","tech_name","category","vendor","era","lifecycle_at_study","lifecycle_current","study_id","notes"
"TECH-KOD-001","Workflow Software","Business Process Management","Multiple (Wang/Eastman Software)","1990s-present","Active / Growing","Evolved to BPM/RPA/low-code platforms","1997-kodak-completes-wang-software-acqui-e78bb4","Core Wang Software technology; routing documents through business processes; evolved into SharePoint Nintex and RPA tools"
"TECH-KOD-002","Document Imaging","Enterprise Content Management","Multiple","1980s-present","Active","Active / evolved to ECM/cloud platforms","1997-kodak-completes-wang-software-acqui-e78bb4","Capture index and store scanned documents; core Kodak capability"
"TECH-KOD-003","COLD (Computer Output to Laser Disk)","Output Management","Wang/Eastman Software","1980s-2005","Active","Obsolete (replaced by digital archiving/cloud)","1997-kodak-completes-wang-software-acqui-e78bb4","Technology for outputting computer-generated reports to optical disk for archival; Eastman Software added COLD to Kodak BIS offerings"
"TECH-KOD-004","Hierarchical Storage Management (HSM)","Storage Management","Wang/Eastman Software","1980s-2010s","Active","Evolved to tiered/cloud storage","1997-kodak-completes-wang-software-acqui-e78bb4","Joint development agreements with Microsoft; Eastman Software HSM for optimizing storage costs across media types; evolved into ILM and cloud tiering"
"TECH-KOD-005","Document Management (DM)","Enterprise Content Management","Wang/Eastman Software","1990s-present","Active","Active / evolved to ECM (OpenText SharePoint)","1997-kodak-completes-wang-software-acqui-e78bb4","Document lifecycle management software from Wang portfolio"
"TECH-KOD-006","IDAR (Integrated Document Architecture and Repository)","ECM Platform","Eastman Software","1997-2000","Emerging","Defunct","1997-kodak-completes-wang-software-acqui-e78bb4","Eastman Software's integrated platform for enterprise document lifecycle; discontinued when Eastman Software was sold in 2000"
"TECH-KOD-007","Microfilm / COM (Computer Output to Microfilm)","Imaging Technology","Multiple","1930s-2000s","Active / Declining","Near-obsolete (niche archival use only)","1997-kodak-completes-wang-software-acqui-e78bb4","Traditional Kodak imaging technology being supplemented by digital; hybrid analog/digital approach described in study"
"TECH-KOD-008","Windows 95 / Windows NT 4.0","Operating System","Microsoft","1995-2001","Active","Obsolete (evolved to Windows Server/10/11)","1997-kodak-completes-wang-software-acqui-e78bb4","Wang imaging technology embedded in both platforms; key distribution channel for Wang/Eastman Software"
